Period,Time,Call Type,Committing Player,Disadvantaged Player,Review Decision,Video,Comment,game_id
Q5,00:02.4,Foul: Personal,Torrey Craig,Andrew Wiggins,CNC,http://official.nba.com/last-two-minute-report/?gameNo=0021900132&eventNum=2324,Craig (DEN) and Wiggins (MIN) each engage with one another and make marginal contact that does not affect the other's FOM as the inbound pass is made.,21900132
Q5,00:02.0,Foul: Personal,Mason Plumlee,Andrew Wiggins,CNC,http://official.nba.com/last-two-minute-report/?gameNo=0021900132&eventNum=2325,Plumlee (DEN) maintains legal guarding position as Wiggins (MIN) turns and initiates contact to his front at the start of the dribble.,21900132
Q5,00:00.9,Foul: Shooting,Mason Plumlee,Josh Okogie,INC,http://official.nba.com/last-two-minute-report/?gameNo=0021900132&eventNum=2326,Plumlee (DEN) makes contact to the body of Okogie (MIN) during his shooting motion that affects his jump shot attempt.,21900132
Q4,01:54.9,Foul: Offensive,Nerlens Noel,George Hill,CNC,http://official.nba.com/last-two-minute-report/?gameNo=0021900135&eventNum=2291,Noel (OKC) establishes himself in a legal screening position in the path of Hill (MIL) and does not deliver contact.,21900135
Q4,01:34.1,Foul: Offensive,Nerlens Noel,George Hill,CNC,http://official.nba.com/last-two-minute-report/?gameNo=0021900135&eventNum=2292,Noel (OKC) establishes himself in a legal screening position in the path of Hill (MIL) and does not deliver contact.,21900135
Q4,01:28.6,Foul: Offensive,Danilo Gallinari,George Hill,CNC,http://official.nba.com/last-two-minute-report/?gameNo=0021900135&eventNum=2293,Gallinari (OKC) makes incidental contact with Hill (MIL) off ball that does not affect his ability to defend.,21900135
Q4,01:26.6,Foul: Defense 3 Second,Brook Lopez,Thunder,CNC,http://official.nba.com/last-two-minute-report/?gameNo=0021900135&eventNum=2294,Lopez (MIL) is in the paint and actively guarding an opponent within three seconds.,21900135
Q4,01:24.6,Foul: Shooting,Eric Bledsoe,Dennis Schroder,CNC,http://official.nba.com/last-two-minute-report/?gameNo=0021900135&eventNum=2295,"Bledsoe (MIL) makes incidental ""high-five"" contact with Schroder (OKC) after the release that does not affect his jump shot attempt.",21900135
Q4,01:06.3,Foul: Loose Ball,George Hill,Dennis Schroder,CNC,http://official.nba.com/last-two-minute-report/?gameNo=0021900135&eventNum=2296,Hill (MIL) makes makes incidental contact with Schroder (OKC) during the rebound.,21900135
Q4,01:04.8,Foul: Offensive,Nerlens Noel,Giannis Antetokounmpo,CNC,http://official.nba.com/last-two-minute-report/?gameNo=0021900135&eventNum=2297,Noel (OKC) brushes Antetokounmpo's (MIL) side as he firms up during the off ball screen and the contact is marginal.,21900135
Q4,00:59.6,Foul: Offensive,Danilo Gallinari,Wesley Matthews,CNC,http://official.nba.com/last-two-minute-report/?gameNo=0021900135&eventNum=2298,Gallinari (OKC) establishes himself in a legal screening position in the path of Matthews (MIL) and does not deliver contact.,21900135
Q4,00:57.0,Foul: Offensive,Wesley Matthews,Danilo Gallinari,CNC,http://official.nba.com/last-two-minute-report/?gameNo=0021900135&eventNum=2299,"After the pick, Gallinari (OKC) and Matthews (MIL) briefly engage and separate off ball.",21900135
Q4,00:48.6,Turnover: Lost Ball Out of Bounds,Eric Bledsoe,Thunder,CC,http://official.nba.com/last-two-minute-report/?gameNo=0021900135&eventNum=2300,Bledsoe (MIL) is the last player to make contact with the ball prior to the ball going out of bounds.,21900135
Q4,00:44.2,Turnover: Traveling,Chris Paul,Bucks,CNC,http://official.nba.com/last-two-minute-report/?gameNo=0021900135&eventNum=2301,Paul (OKC) maintains a legal pivot foot before the start of his dribble.,21900135
Q4,00:41.3,Foul: Away from Play,Dennis Schroder,George Hill,INC,http://official.nba.com/last-two-minute-report/?gameNo=0021900135&eventNum=2302,Schroder (OKC) makes contact with Hill (MIL) that affects his FOM during the inbound.,21900135
Q4,00:41.2,Turnover: 5 Second Violation,Bucks,Thunder,CC,http://official.nba.com/last-two-minute-report/?gameNo=0021900135&eventNum=2303,MIL fails to inbound the ball prior to a five second violation.,21900135
Q4,00:41.2,Foul: Offensive,Nerlens Noel,Giannis Antetokounmpo,CNC,http://official.nba.com/last-two-minute-report/?gameNo=0021900135&eventNum=2305,Noel (OKC) establishes himself in a screening position in the path of Antetokounmpo (MIL) and gives him room to avoid the contact.,21900135
Q4,00:41.2,Foul: Away from Play,Wesley Matthews,Shai Gilgeous-Alexander,CNC,http://official.nba.com/last-two-minute-report/?gameNo=0021900135&eventNum=2304,Matthews (MIL) makes marginal contact with Gilgeous-Alexander (OKC) that doesn't affect his FOM during the inbound.,21900135
Q4,00:41.2,Foul: Personal,Giannis Antetokounmpo,Danilo Gallinari,CNC,http://official.nba.com/last-two-minute-report/?gameNo=0021900135&eventNum=2306,Antetokounmpo (MIL) maintains his legal guarding position as he defends Gallinari (OKC) and does not affect his SQBR.,21900135
Q4,00:33.7,Foul: Shooting,Giannis Antetokounmpo,Danilo Gallinari,CNC,http://official.nba.com/last-two-minute-report/?gameNo=0021900135&eventNum=2307,"Antetokounmpo (MIL) makes incidental ""high-five"" contact with Gallinari (OKC) after the release that does not affect his jump shot attempt.",21900135
Q4,00:32.2,Foul: Personal,Giannis Antetokounmpo,Danilo Gallinari,CNC,http://official.nba.com/last-two-minute-report/?gameNo=0021900135&eventNum=2308,Antetokounmpo (MIL) collapses his arm as he moves alongside Gallinari's (OKC) body during his drive and makes marginal contact.,21900135
Q4,00:24.5,Foul: Offensive,Chris Paul,Giannis Antetokounmpo,CNC,http://official.nba.com/last-two-minute-report/?gameNo=0021900135&eventNum=2309,Paul (OKC) establishes himself in a screening position in the path of Antetokounmpo (MIL) and does not deliver contact.,21900135
Q4,00:24.5,Foul: Offensive,Nerlens Noel,Giannis Antetokounmpo,CNC,http://official.nba.com/last-two-minute-report/?gameNo=0021900135&eventNum=2309,Noel (OKC) establishes himself in a screening position in the path of Antetokounmpo (MIL) and does not deliver contact.,21900135
Q4,00:10.5,Foul: Personal,Dennis Schroder,George Hill,CC,http://official.nba.com/last-two-minute-report/?gameNo=0021900135&eventNum=2310,Schroder (OKC) commits a take foul on Hill (MIL).,21900135
Q4,00:04.8,Foul: Personal,Dennis Schroder,Eric Bledsoe,CC,http://official.nba.com/last-two-minute-report/?gameNo=0021900135&eventNum=2311,Schroder (OKC) commits a take foul on Bledsoe (MIL).,21900135
Q4,00:04.8,Foul: Personal,Danilo Gallinari,Sterling Brown,CNC,http://official.nba.com/last-two-minute-report/?gameNo=0021900135&eventNum=2312,Gallinari (OKC) makes incidental contact with Brown (MIL) during the free throw.,21900135
Q4,1:54,Foul: Personal,DeAndre' Bembry,Damian Lillard,CNC,http://official.nba.com/last-two-minute-report/?gameNo=0021900138&eventNum=2237,Bembry (ATL) makes some contact to Lillard's (POR) body but does not affect his SQBR.,21900138
Q4,1:53,Foul: Shooting,Jabari Parker,Damian Lillard,CNC,http://official.nba.com/last-two-minute-report/?gameNo=0021900138&eventNum=2238,Parker (ATL) jumps vertically and absorbs the oncoming body contact with Lillard (POR) during his driving shot attempt.,21900138
Q4,01:51.6,Foul: Shooting,De'Andre Hunter,Hassan Whiteside,CC,http://official.nba.com/last-two-minute-report/?gameNo=0021900138&eventNum=2239,Hunter (ATL) makes contact to Whiteside's (POR) body which affects his upward shooting motion.,21900138
Q4,01:41.2,Foul: Personal,Kent Bazemore,DeAndre' Bembry,CNC,http://official.nba.com/last-two-minute-report/?gameNo=0021900138&eventNum=2240,Bazemore (POR) and Bembry (ATL) briefly engage and separate during the pick. The contact is deemed marginal.,21900138
Q4,01:33.7,Foul: Loose Ball,DeAndre' Bembry,Damian Lillard,CNC,http://official.nba.com/last-two-minute-report/?gameNo=0021900138&eventNum=2241,Bembry (ATL) and Lillard (POR) arrive at the ball simultaneously and both players make clean contact to the ball during the rebound. Lillard's (POR) reaction is not consistent with the level of contact.,21900138
Q4,01:31.7,Foul: Shooting,Kent Bazemore,Trae Young,CNC,http://official.nba.com/last-two-minute-report/?gameNo=0021900138&eventNum=2242,Bazemore (POR) maintains a legal guarding position during Young's (ATL) shot attempt near the rim.,21900138
Q4,01:21.0,Foul: Personal,Damian Lillard,Trae Young,CNC,http://official.nba.com/last-two-minute-report/?gameNo=0021900138&eventNum=2243,Replay review of the foul called on Lillard (POR) pursuant to a coach's challenge was deemed successful.,21900138
Q4,00:56.7,Foul: Offensive,CJ McCollum,Kevin Huerter,CNC,http://official.nba.com/last-two-minute-report/?gameNo=0021900138&eventNum=2244,McCollum (POR) slightly extends his forearm into Huerter's (ATL) front but his momentum carries him away from the marginal contact.,21900138
Q4,0:45,Foul: Personal,Mario Hezonja,Jabari Parker,CNC,http://official.nba.com/last-two-minute-report/?gameNo=0021900138&eventNum=2245,Hezonja (POR) and Parker (ATL) briefly engage and separate off ball.,21900138
Q4,00:38.7,Foul: Offensive,Jabari Parker,Kent Bazemore,CNC,http://official.nba.com/last-two-minute-report/?gameNo=0021900138&eventNum=2246,Parker (ATL) establishes himself in a legal screening position in Bazemore's (POR) path when the contact occurs during the pick.,21900138
Q4,00:38.7,Foul: Personal,Kent Bazemore,Jabari Parker,CNC,http://official.nba.com/last-two-minute-report/?gameNo=0021900138&eventNum=2246,"After absorbing the contact from the pick, Bazemore (POR) places a hand on the opposite side of Parker's (ATL) body but he immediately removes his hand.",21900138
Q4,00:31.7,Foul: Loose Ball,Kevin Huerter,CJ McCollum,INC,http://official.nba.com/last-two-minute-report/?gameNo=0021900138&eventNum=2247,Huerter (ATL) places a forearm to McCollum's (POR) front as he simultaneously dislodges the ball during the rebound. Huerter (ATL)  extends his forearm and the contact affects McCollum's SQBR.,21900138
Q4,00:31.7,Foul: Loose Ball,CJ McCollum,Kevin Huerter,CNC,http://official.nba.com/last-two-minute-report/?gameNo=0021900138&eventNum=2247,McCollum (POR) engages and disengages with Huerter (ATL) during the rebound.,21900138
Q4,00:09.2,Turnover: Traveling,Damian Lillard, ,CNC,http://official.nba.com/last-two-minute-report/?gameNo=0021900138&eventNum=2248,Lillard (POR) takes a legal two steps after his gather.,21900138
Q4,00:08.6,Foul: Shooting,Damian Jones,Damian Lillard,CNC,http://official.nba.com/last-two-minute-report/?gameNo=0021900138&eventNum=2249,Jones (ATL) makes contact to Lillard's (POR) body after the release that does not affect his driving shot attempt.,21900138
Q4,00:07.0,Foul: Personal,Kent Bazemore,Trae Young,CNC,http://official.nba.com/last-two-minute-report/?gameNo=0021900138&eventNum=2250,Bazemore (POR) and Young (ATL) briefly engage and separate off ball. The arm contact from both players is deemed marginal.,21900138
Q4,01:54.8,Foul: Shooting,Derrick White,Tyus Jones,CNC,http://official.nba.com/last-two-minute-report/?gameNo=0021900143&eventNum=2248,"White (SAS) makes incidental ""high-five"" contact with Jones (MEM) after the release that does not affect his jump shot attempt.",21900143
Q4,1:42,Foul: Offensive,Bryn Forbes,Dillon Brooks,CNC,http://official.nba.com/last-two-minute-report/?gameNo=0021900143&eventNum=2249,"Forbes (SAS) slightly extends his forearm into Brooks (MEM), but does not dislodge him from his legally obtained position.",21900143
Q4,01:39.4,Foul: Offensive,LaMarcus Aldridge,Jonas Valanciunas,CNC,http://official.nba.com/last-two-minute-report/?gameNo=0021900143&eventNum=2250,"Aldridge briefly clamps the arm of Valanciunas (MEM), but does not affect his ability to defend in the post.",21900143
Q4,01:36.4,Foul: Personal,Jonas Valanciunas,LaMarcus Aldridge,CC,http://official.nba.com/last-two-minute-report/?gameNo=0021900143&eventNum=2251,Valanciunas (MEM) extends his hand into Aldridge's (SAS) front and affects his SQBR.,21900143
Q4,01:36.4,Foul: Offensive,Bryn Forbes,Jonas Valanciunas,CNC,http://official.nba.com/last-two-minute-report/?gameNo=0021900143&eventNum=2252,Forbes (SAS) establishes himself in a screening position in the path of Valanciunas (MEM) and absorbs the contact.,21900143
Q4,1:27,Foul: Offensive,Derrick White,Tyus Jones,CNC,http://official.nba.com/last-two-minute-report/?gameNo=0021900143&eventNum=2253,"White (SAS) releases from Jones (MEM) as he slightly extends his forearm prior to the shot attempt, but does not dislodge Jones from his legally obtained position.",21900143
Q4,01:23.8,Foul: Loose Ball,LaMarcus Aldridge,Jae Crowder,CNC,http://official.nba.com/last-two-minute-report/?gameNo=0021900143&eventNum=2254,Aldridge (SAS) makes marginal contact with Crowder (MEM) that does not affect his ability to rebound.,21900143
Q4,01:13.5,Foul: Offensive,Jae Crowder,Rudy Gay,CNC,http://official.nba.com/last-two-minute-report/?gameNo=0021900143&eventNum=2255,Crowder (MEM) establishes himself in a screening position in the path of Gay (SAS) and absorbs the contact.,21900143
Q4,00:55.1,Foul: Personal,Jonas Valanciunas,LaMarcus Aldridge,CC,http://official.nba.com/last-two-minute-report/?gameNo=0021900143&eventNum=2256,Valanciunas (MEM) dislodges Aldridge (SAS) prior to receiving the pass in the post.,21900143
Q4,00:39.2,Foul: Loose Ball,Jonas Valanciunas,LaMarcus Aldridge,CNC,http://official.nba.com/last-two-minute-report/?gameNo=0021900143&eventNum=2257,Valanciunas (MEM) and Aldridge (SAS) engage and disengage while rebounding.,21900143
Q4,00:38.6,Foul: Personal,Derrick White,Jonas Valanciunas,CNC,http://official.nba.com/last-two-minute-report/?gameNo=0021900143&eventNum=2258,White (SAS) makes clean contact to the ball during Valanciunas' (MEM) pass attempt.,21900143
Q4,00:25.7,Foul: Shooting,Jonas Valanciunas,DeMar DeRozan,INC,http://official.nba.com/last-two-minute-report/?gameNo=0021900143&eventNum=2259,Valanciunas (MEM) brings his arm down and makes contact to the head of DeRozan (SAS) on the driving shot attempt.,21900143
Q4,00:25.5,Turnover: Stepped out of Bounds,Jaren Jackson Jr.,Bryn Forbes,CC,http://official.nba.com/last-two-minute-report/?gameNo=0021900143&eventNum=2260,Jackson Jr. (MEM) steps out of bounds prior to releasing his shot attempt on the perimeter.,21900143
Q4,00:23.9,Foul: Personal,LaMarcus Aldridge,Jaren Jackson Jr.,CNC,http://official.nba.com/last-two-minute-report/?gameNo=0021900143&eventNum=2261,"Aldridge (SAS) makes some contact to the arm Jackson Jr. (DET), but does not affect his control of the ball.",21900143
Q4,00:14.6,Foul: Personal,Rudy Gay,Dillon Brooks,CC,http://official.nba.com/last-two-minute-report/?gameNo=0021900143&eventNum=2262,Gay (SAS) commits a take foul on Brooks (MEM).,21900143
Q4,00:14.6,Foul: Personal,Solomon Hill,DeMar DeRozan,CNC,http://official.nba.com/last-two-minute-report/?gameNo=0021900143&eventNum=2263,Hill (MEM) places his arm to the front of DeRozan (SAS) at the start of the drive but the contact does not affect his SQBR.,21900143
Q4,00:12.8,Foul: Personal,Dillon Brooks,LaMarcus Aldridge,CNC,http://official.nba.com/last-two-minute-report/?gameNo=0021900143&eventNum=2264,"Brooks (MEM) briefly places his hand to the opposite side hip of Aldridge (SAS), but does not affect his FOM.",21900143
Q4,00:10.1,Foul: Shooting,Jaren Jackson Jr.,DeMar DeRozan,CNC,http://official.nba.com/last-two-minute-report/?gameNo=0021900143&eventNum=2265,Replay review of the foul called on Jackson Jr. (MEM) pursuant to a coach's challenge was deemed successful.,21900143
Q4,00:02.2,Foul: Personal Take,LaMarcus Aldridge,Jae Crowder,INC,http://official.nba.com/last-two-minute-report/?gameNo=0021900143&eventNum=2266,Aldridge (SAS) uses two hands to make contact to Crowder's (MEM) arms after he has secured the ball.  The contact occurs prior to the jump ball.,21900143
Q4,00:01.0,Foul: Technical,Jae Crowder,Spurs,CC,http://official.nba.com/last-two-minute-report/?gameNo=0021900143&eventNum=2267,All technical fouls are reviewed by League Operations.,21900143
Q4,01:59.8,Foul: Offensive,Tristan Thompson,Josh Richardson,CNC,http://official.nba.com/last-two-minute-report/?gameNo=0021900147&eventNum=2235,Thompson (CLE) is firming up and makes marginal contact with Harris (PHI) while setting the pick.,21900147
Q4,01:56.1,Foul: Personal,Joel Embiid,Collin Sexton,CNC,http://official.nba.com/last-two-minute-report/?gameNo=0021900147&eventNum=2236,Embiid (PHI) cleanly dislodges the ball from Sexton (CLE) during his drive.,21900147
Q4,01:56.1,Foul: Loose Ball,Josh Richardson,Collin Sexton,CNC,http://official.nba.com/last-two-minute-report/?gameNo=0021900147&eventNum=2236,Richardson (PHI) makes marginal contact with Sexton's (CLE) arm during the loose ball.,21900147
Q4,01:43.5,Foul: Offensive,Tobias Harris,Kevin Love,CNC,http://official.nba.com/last-two-minute-report/?gameNo=0021900147&eventNum=2237,Harris (PHI) extends his leg as part of a natural shooting motion and makes marginal contact with Love (CLE) on his follow through.,21900147
Q4,01:43.5,Turnover: 3 Second Violation,Ben Simmons,Cavaliers,CNC,http://official.nba.com/last-two-minute-report/?gameNo=0021900147&eventNum=2237,Simmons (PHI) could be deemed to be in the lane for less than three seconds when the shot is imminent.,21900147
Q4,01:20.1,Foul: Loose Ball,Joel Embiid,Collin Sexton,INC,http://official.nba.com/last-two-minute-report/?gameNo=0021900147&eventNum=2238,Embiid (PHI) dislodges Sexton (CLE) while attempting to secure the rebound.,21900147
Q4,01:20.1,Foul: Loose Ball,Josh Richardson,Collin Sexton,CNC,http://official.nba.com/last-two-minute-report/?gameNo=0021900147&eventNum=2238,Richardson (PHI) slightly extends his arm into Sexton (CLE) during the rebound.,21900147
Q4,00:55.3,Foul: Offensive,Tristan Thompson,Furkan Korkmaz,CNC,http://official.nba.com/last-two-minute-report/?gameNo=0021900147&eventNum=2239,Thompson (CLE) sets a pick on Korkmaz (PHI) and does not delay him while they disengage.,21900147
Q4,00:47.2,Foul: Personal,Furkan Korkmaz,Jordan Clarkson,CNC,http://official.nba.com/last-two-minute-report/?gameNo=0021900147&eventNum=2240,Korkmaz (PHI) makes marginal contact with Clarkson's (CLE) arm that does not affect his SQBR.,21900147
Q4,00:46.3,Turnover: 24 Second Violation,Collin Sexton,76ers,CC,http://official.nba.com/last-two-minute-report/?gameNo=0021900147&eventNum=2241,Sexton (CLE) is still in possession of the ball as the shot clock expires.,21900147
Q4,00:31.7,Foul: Shooting,Tristan Thompson,Joel Embiid,CNC,http://official.nba.com/last-two-minute-report/?gameNo=0021900147&eventNum=2242,Thompson (CLE) makes incidental contact to the arm of Embiid (PHI) after the release that does not affect his driving shot attempt.,21900147
Q4,00:26.6,Foul: Loose Ball,Tristan Thompson,Joel Embiid,CNC,http://official.nba.com/last-two-minute-report/?gameNo=0021900147&eventNum=2243,Thompson (CLE) briefly places his right arm around Embiid (PHI) during the rebound.,21900147
Q4,00:26.6,Foul: Loose Ball,Joel Embiid,Kevin Love,CNC,http://official.nba.com/last-two-minute-report/?gameNo=0021900147&eventNum=2243,Embiid (PHI) and Love (CLE) engages with one another during the rebound and make incidental contact as they fall to the ground.,21900147
Q4,00:21.8,Foul: Personal,Jordan Clarkson,Furkan Korkmaz,CNC,http://official.nba.com/last-two-minute-report/?gameNo=0021900147&eventNum=2244,"During the screen, Clarkson (CLE) and Korkmaz (PHI) engage and disengage with one another.",21900147
Q4,00:18.6,Foul: Offensive,Joel Embiid,Collin Sexton,CNC,http://official.nba.com/last-two-minute-report/?gameNo=0021900147&eventNum=2245,"Embiid (PHI) establishes himself in a screening position in the path of Sexton (CLE) and slightly turns his body, but does not deliver contact during the pick.",21900147
Q4,00:14.7,Foul: Offensive,Joel Embiid,Larry Nance Jr.,CNC,http://official.nba.com/last-two-minute-report/?gameNo=0021900147&eventNum=2246,Embiid (PHI) makes marginal contact with Nance Jr. (CLE) off ball that does not affect his ability to defend the pass.,21900147
Q4,00:13.2,Foul: Personal,James Ennis III,Jordan Clarkson,CNC,http://official.nba.com/last-two-minute-report/?gameNo=0021900147&eventNum=2247,Ennis III (PHI) makes marginal contact with the arm of Clarkson (CLE) and does not affect his FOM.,21900147
Q4,00:13.1,Foul: Personal,Joel Embiid,Jordan Clarkson,CNC,http://official.nba.com/last-two-minute-report/?gameNo=0021900147&eventNum=2248,"During the screen, Embiid (PHI) and Clarkson (CLE) make marginal contact with one another as they engage and disengage.",21900147
Q4,00:09.3,Foul: Offensive,Kevin Love,James Ennis III,CNC,http://official.nba.com/last-two-minute-report/?gameNo=0021900147&eventNum=2249,Love (CLE) is not in the path of Ennis III (PHI) when he sets the screen but the contact is marginal.,21900147
Q4,00:01.7,Foul: Loose Ball,Josh Richardson,Jordan Clarkson,CNC,http://official.nba.com/last-two-minute-report/?gameNo=0021900147&eventNum=2250,"Richardson (PHI) and Clarkson (CLE) engage during the loose ball, but the contact is marginal as both players lose their balance.",21900147
Q4,00:01.7,Foul: Loose Ball,Collin Sexton,Ben Simmons,CNC,http://official.nba.com/last-two-minute-report/?gameNo=0021900147&eventNum=2250,Sexton (CLE) makes incidental foot contact with Simmons (PHI) during the loose ball.,21900147
Q4,00:01.7,Foul: Loose Ball,Tristan Thompson,Joel Embiid,CNC,http://official.nba.com/last-two-minute-report/?gameNo=0021900147&eventNum=2250,Thompson (CLE) slightly extends his arm into Embiid (PHI) as they chase after the loose ball.,21900147
Q4,02:00.5,Foul: Offensive,Mike Conley,Garrett Temple,CNC,http://official.nba.com/last-two-minute-report/?gameNo=0021900152&eventNum=2216,Conley (UTA) establishes a legal screening position as he firms up and does not deliver contact to Temple (BKN).,21900152
Q4,01:58.2,Foul: Shooting,Kyrie Irving,Donovan Mitchell,CNC,http://official.nba.com/last-two-minute-report/?gameNo=0021900152&eventNum=2217,Irving (BKN) moves legally alongside of Mitchell's (UTA) path during his driving shot attempt and cleanly dislodges the ball during his upward shooting motion.,21900152
Q4,01:56.7,Foul: Personal,Joe Ingles,Kyrie Irving,CNC,http://official.nba.com/last-two-minute-report/?gameNo=0021900152&eventNum=2218,Ingles (UTA) makes marginal arm to arm contact allowing Irving (BKN) to play through the contact and continue his drive.,21900152
Q4,01:56.6,Violation: Delay of Game,Donovan Mitchell,Nets,CC,http://official.nba.com/last-two-minute-report/?gameNo=0021900152&eventNum=2219,Mitchell (UTA) directs the ball after the made basket and Utah is correctly assessed a Delay of Game Violation.,21900152
Q4,01:42.0,Foul: Offensive,DeAndre Jordan,Rudy Gobert,CNC,http://official.nba.com/last-two-minute-report/?gameNo=0021900152&eventNum=2220,Jordan (UTA) and Gobert (UTA) briefly engage and disengage in the post.,21900152
Q4,01:41.6,Foul: Shooting,Joe Ingles,DeAndre Jordan,CNC,http://official.nba.com/last-two-minute-report/?gameNo=0021900152&eventNum=2221,Ingles (UTA) cleanly dislodges the ball during Jordan's (BKN) shot at the rim.,21900152
Q4,01:41.5,Turnover: Discontinue Dribble,Joe Ingles,Nets,CNC,http://official.nba.com/last-two-minute-report/?gameNo=0021900152&eventNum=2222,"As Ingles (UTA) gathers the ball, Jordan (BKN) gets his hand on the ball, cleanly dislodging the ball from Ingles. Ingles then legally re-gathers the ball.",21900152
Q4,01:32.1,Foul: Shooting,Taurean Prince,Rudy Gobert,CNC,http://official.nba.com/last-two-minute-report/?gameNo=0021900152&eventNum=2223,Prince (BKN) legally contests Gobert's (UTA) shot at the rim as he does not make contact with Gobert's head.,21900152
Q4,01:24.1,Foul: Loose Ball,Joe Harris,Joe Ingles,CNC,http://official.nba.com/last-two-minute-report/?gameNo=0021900152&eventNum=2224,Harris (BKN) jumps legally up and down attempting to retrieve the rebound as he does not deliver contact to Ingles (UTA).,21900152
Q4,01:17.0,Foul: Shooting,Rudy Gobert,Kyrie Irving,CNC,http://official.nba.com/last-two-minute-report/?gameNo=0021900152&eventNum=2225,Gobert's (UTA) collapses his left forearm against his body while maintaining a vertical arm during Irving's (BKN) driving shot attempt.,21900152
Q4,01:06.8,Foul: Offensive,Mike Conley,Garrett Temple,CNC,http://official.nba.com/last-two-minute-report/?gameNo=0021900152&eventNum=2226,Conley (UTA) is in a legal picking position as he is firmed up and does not deliver contact to Temple (BKN).,21900152
Q4,00:59.7,Foul: Shooting,Kyrie Irving,Donovan Mitchell,CNC,http://official.nba.com/last-two-minute-report/?gameNo=0021900152&eventNum=2227,"As Mitchell's (UTA) momentum is already taking him in that direction, Irving's (BKN) rested hand makes marginal contact with Mitchell during the driving shot attempt.",21900152
Q4,00:58.4,Foul: Shooting,DeAndre Jordan,Rudy Gobert,CNC,http://official.nba.com/last-two-minute-report/?gameNo=0021900152&eventNum=2228,Jordan (BKN) maintains a legal guarding position during the play at the basket by Gobert (UTA).,21900152
Q4,00:56.0,Foul: Offensive,Kyrie Irving,Joe Ingles,CNC,http://official.nba.com/last-two-minute-report/?gameNo=0021900152&eventNum=2229,"Irving (BKN) briefly places his hand to Ingles' (UTA) leg, but immediately disengages sliding his hand off.",21900152
Q4,00:40.0,Foul: Shooting,Joe Ingles,Kyrie Irving,CNC,http://official.nba.com/last-two-minute-report/?gameNo=0021900152&eventNum=2230,Ingles (UTA) moves legally alongside of Irving (BKN) and makes marginal contact with Irving's arm while contesting the driving shot attempt.,21900152
Q4,00:21.3,Foul: Personal,Kyrie Irving,Mike Conley,CNC,http://official.nba.com/last-two-minute-report/?gameNo=0021900152&eventNum=2231,Irving (BKN) makes marginal contact with Conley (UTA) on the perimeter.,21900152
