Period,Time,Call Type,Committing Player,Disadvantaged Player,Review Decision,Video,Comment,game_id
Q4,01:53.3,Foul: Offensive,OG Anunoby,Brandon Ingram,CNC,http://official.nba.com/last-two-minute-report/?gameNo=0021900001&eventNum=2410,Anunoby (TOR) firms up in a legal screening position in Ingram's (NOP) path.,21900001
Q4,1:44,Foul: Offensive,Serge Ibaka,Nicolo Melli,CNC,http://official.nba.com/last-two-minute-report/?gameNo=0021900001&eventNum=2411,Ibaka (TOR) makes marginal contact with Melli (NOP) off ball.,21900001
Q4,01:41.4,Foul: Shooting,JJ Redick,Kyle Lowry,CNC,http://official.nba.com/last-two-minute-report/?gameNo=0021900001&eventNum=2412,Redick (NOP) contests Lowry's (TOR) jump shot attempt and gives him room to land safely.,21900001
Q4,01:34.5,Foul: Personal,Fred VanVleet,Brandon Ingram,CNC,http://official.nba.com/last-two-minute-report/?gameNo=0021900001&eventNum=2413,VanVleet (TOR) maintains a legal guarding position on Ingram (NOP) and absorbs the contact at the end of the drive.,21900001
Q4,01:09.6,Foul: Personal,Fred VanVleet,Brandon Ingram,INC,http://official.nba.com/last-two-minute-report/?gameNo=0021900001&eventNum=2414,VanVleet (TOR) is late to establish himself in a legal guarding position when he delivers contact by turning his body into Ingram (NOP) and affecting his SQBR.,21900001
Q4,01:09.6,Foul: Personal,Marc Gasol,Brandon Ingram,CNC,http://official.nba.com/last-two-minute-report/?gameNo=0021900001&eventNum=2414,Gasol (TOR) places a forearm to Ingram (NOP) and does not affect his SQBR.,21900001
Q4,00:50.1,Foul: Offensive,Pascal Siakam,JJ Redick,CC,http://official.nba.com/last-two-minute-report/?gameNo=0021900001&eventNum=2415,Siakam (TOR) dislodges Redick (NOP) from his legal guarding position.,21900001
Q4,00:46.0,Foul: Personal,Norman Powell,JJ Redick,CNC,http://official.nba.com/last-two-minute-report/?gameNo=0021900001&eventNum=2416,Powell (TOR) rests his hand on Redick's (NOP) back but doesn't affect his SQBR.,21900001
Q4,00:43.3,Foul: Offensive,Brandon Ingram,OG Anunoby,CNC,http://official.nba.com/last-two-minute-report/?gameNo=0021900001&eventNum=2417,Ingram (NOP) establishes himself in a screening position in Anunoby's (TOR) path and absorbs the contact.,21900001
Q4,00:34.7,Foul: Personal,Fred VanVleet,Josh Hart,CNC,http://official.nba.com/last-two-minute-report/?gameNo=0021900001&eventNum=2418,VanVleet (TOR) cleanly dislodges the ball from Hart (NOP) during his drive.,21900001
Q4,00:29.2,Foul: Offensive,Nicolo Melli,OG Anunoby,CNC,http://official.nba.com/last-two-minute-report/?gameNo=0021900001&eventNum=2419,Melli (NOP) establishes himself in Anunoby's (TOR) path when he absorbs the contact on the screen.,21900001
Q4,00:29.2,Foul: Shooting,Josh Hart,Kyle Lowry,CC,http://official.nba.com/last-two-minute-report/?gameNo=0021900001&eventNum=2420,Hart (NOP) makes contact to Lowry's (TOR) body during his shooting motion that affects his driving shot attempt.,21900001
Q4,0:22,Foul: Offensive,Nicolo Melli,OG Anunoby,CNC,http://official.nba.com/last-two-minute-report/?gameNo=0021900001&eventNum=2421,Melli (NOP) establishes himself in a screening position in Anunoby's (TOR) path and absorbs the contact.,21900001
Q4,00:13.9,Foul: Offensive,Nicolo Melli,Kyle Lowry,CNC,http://official.nba.com/last-two-minute-report/?gameNo=0021900001&eventNum=2422,Melli (NOP) firms up in a screening position in Lowry's (TOR) path when they make marginal upper leg to leg contact.,21900001
Q4,00:12.0,Foul: Shooting,OG Anunoby,Jrue Holiday,CNC,http://official.nba.com/last-two-minute-report/?gameNo=0021900001&eventNum=2423,Anunoby (TOR) maintains a legal guarding position during the jump shot attempt by Holiday (NOP).,21900001
Q4,00:10.0,Foul: Loose Ball,Marc Gasol,Nicolo Melli,INC,http://official.nba.com/last-two-minute-report/?gameNo=0021900001&eventNum=2424,Gasol (TOR) pulls Melli's (NOP) jersey away from his body during the shot attempt.,21900001
Q4,00:08.8,Foul: Offensive,Marc Gasol,Frank Jackson,CNC,http://official.nba.com/last-two-minute-report/?gameNo=0021900001&eventNum=2425,Gasol (TOR) is established in Jackson's (NOP) path before the contact during the screen.,21900001
Q4,00:01.5,Foul: Shooting,Frank Jackson,Norman Powell,CNC,http://official.nba.com/last-two-minute-report/?gameNo=0021900001&eventNum=2426,Jackson (NOP) maintains a legal guarding position during the jump shot attempt by Powell (TOR).,21900001
Q5,01:55.4,Foul: Personal,Norman Powell,Brandon Ingram,CNC,http://official.nba.com/last-two-minute-report/?gameNo=0021900001&eventNum=2427,Powell (TOR) makes marginal contact with Ingram (NOP) in the post and does not affect his SQBR.,21900001
Q5,01:44.9,Foul: Loose Ball,Brandon Ingram,Norman Powell,CNC,http://official.nba.com/last-two-minute-report/?gameNo=0021900001&eventNum=2428,Ingram (NOP) cleanly dislodges the ball from Powell (TOR) on the rebound.,21900001
Q5,01:18.2,Foul: Loose Ball,Nicolo Melli,OG Anunoby,CNC,http://official.nba.com/last-two-minute-report/?gameNo=0021900001&eventNum=2429,Melli (NOP) and Anunoby (TOR) engage and disengage on the rebound.,21900001
Q5,00:59.4,Foul: Offensive,Fred VanVleet,Nicolo Melli,CNC,http://official.nba.com/last-two-minute-report/?gameNo=0021900001&eventNum=2430,VanVleet (TOR) establishes himself in a screening position in Melli's path.,21900001
Q5,00:58.1,Foul: Shooting,Jrue Holiday,Kyle Lowry,CNC,http://official.nba.com/last-two-minute-report/?gameNo=0021900001&eventNum=2431,Holiday (NOP) lands in front of Lowry (TOR) and the contact is created by Lowry extending his leg during the follow-through on his jump shot.,21900001
Q5,00:51.9,Foul: Personal,Norman Powell,Jrue Holiday,CNC,http://official.nba.com/last-two-minute-report/?gameNo=0021900001&eventNum=2432,"Powell (TOR) briefly places his hand on Holiday's (NOP) opposite side hip but quickly slides it off, and the contact does not affect his FOM.",21900001
Q5,00:45.5,Turnover: Stepped out of Bounds,Nicolo Melli,Raptors,CNC,http://official.nba.com/last-two-minute-report/?gameNo=0021900001&eventNum=2433,Melli (NOP) does not step out of bounds when he receives the pass before taking the jump shot.,21900001
Q5,00:34.6,Foul: Personal,Jrue Holiday,Kyle Lowry,CC,http://official.nba.com/last-two-minute-report/?gameNo=0021900001&eventNum=2434,Holiday (NOP) moves laterally into Lowry's (TOR) path and the contact affects his SQBR.,21900001
Q5,00:20.3,Foul: Shooting,Josh Hart,Fred VanVleet,CNC,http://official.nba.com/last-two-minute-report/?gameNo=0021900001&eventNum=2435,Hart (NOP) jumps vertically and is turned during the contact initiated by VanVleet (TOR) on his driving shot attempt.,21900001
Q5,00:14.3,Foul: Personal,Marc Gasol,Josh Hart,CC,http://official.nba.com/last-two-minute-report/?gameNo=0021900001&eventNum=2436,Gasol (TOR) makes leg to leg contact with Hart (NOP) that affects his SQBR.,21900001
Q5,00:14.3,Foul: Offensive,Nicolo Melli,OG Anunoby,CNC,http://official.nba.com/last-two-minute-report/?gameNo=0021900001&eventNum=2437,Melli (NOP) establishes himself in a legal screening position and absorbs the contact from Anunoby (TOR).,21900001
Q5,00:06.9,Turnover: Stepped out of Bounds,JJ Redick,Fred VanVleet,CC,http://official.nba.com/last-two-minute-report/?gameNo=0021900001&eventNum=2438,Redick (NOP) steps out of bounds as he receives the pass.,21900001
Q4,01:55.1,Violation: Lane,Lauri Markkanen,Hornets,CC,http://official.nba.com/last-two-minute-report/?gameNo=0021900003&eventNum=2217,Zeller (CHA) steps into the lane prior to the release of the free throw.,21900003
Q4,01:55.1,Foul: Shooting,P.J. Washington,Lauri Markkanen,CC,http://official.nba.com/last-two-minute-report/?gameNo=0021900003&eventNum=2216,Washington (CHI) makes contact with Markkanen's (CHI) arm that affects his play at the basket.,21900003
Q4,01:40.7,Turnover: Traveling,Cody Zeller,Bulls,CNC,http://official.nba.com/last-two-minute-report/?gameNo=0021900003&eventNum=2218,Zeller (CHA) receives the pass and takes two legal steps after the gather.,21900003
Q4,01:31.7,Foul: Personal,Miles Bridges,Zach LaVine,CNC,http://official.nba.com/last-two-minute-report/?gameNo=0021900003&eventNum=2219,Bridges (CHA) briefly places his arms around Carter Jr. (CHI) and the two players engage and disengage.,21900003
Q4,01:26.3,Turnover: Traveling,Wendell Carter Jr.,Cody Zeller,CC,http://official.nba.com/last-two-minute-report/?gameNo=0021900003&eventNum=2220,Carter Jr. (CHI) lifts his pivot before the release of his dribble.,21900003
Q4,01:26.2,Foul: Personal,Tomas Satoransky,Devonte' Graham,CNC,http://official.nba.com/last-two-minute-report/?gameNo=0021900003&eventNum=2221,Satoransky (CHI) and Graham (CHA) engage and disengage prior to the inbound pass.,21900003
Q4,01:03.4,Foul: Offensive,Zach LaVine,Miles Bridges,CNC,http://official.nba.com/last-two-minute-report/?gameNo=0021900003&eventNum=2222,LaVine (CHI) makes marginal contact with Bridges (CHA) during the screen.,21900003
Q4,01:00.9,Foul: Personal,Devonte' Graham,Lauri Markkanen,CNC,http://official.nba.com/last-two-minute-report/?gameNo=0021900003&eventNum=2223,Graham (CHA) makes marginal contact with Markkanen's (CHI) arm that does not affect Markkanen's ability to catch the pass.,21900003
Q4,00:59.3,Foul: Shooting,Cody Zeller,Lauri Markkanen,CC,http://official.nba.com/last-two-minute-report/?gameNo=0021900003&eventNum=2224,Zeller (CHA) jumps into Markkanen's (CHI) body and affects his play at the basket.,21900003
Q4,00:44.4,Foul: Offensive,Cody Zeller,Tomas Satoransky,INC,http://official.nba.com/last-two-minute-report/?gameNo=0021900003&eventNum=2225,Zeller (CHA) extends two arms and pushes Satoransky (CHI) during the screen.,21900003
Q4,00:34.1,Foul: Personal,Otto Porter Jr.,Devonte' Graham,CNC,http://official.nba.com/last-two-minute-report/?gameNo=0021900003&eventNum=2226,Porter Jr. (CHI) makes marginal contact to Graham (CHA) that does not affect his SQBR.,21900003
Q4,00:21.1,Foul: Offensive,Cody Zeller,Zach LaVine,CNC,http://official.nba.com/last-two-minute-report/?gameNo=0021900003&eventNum=2228,Zeller (CHA) establishes himself in a legal screening position in the path of LaVine (CHI).,21900003
Q4,00:21.1,Foul: Away from Play,Otto Porter Jr.,Dwayne Bacon,CNC,http://official.nba.com/last-two-minute-report/?gameNo=0021900003&eventNum=2229,Porter Jr. (CHI) briefly places his hand on Bacon's (CHA) arm that does not affect his FOM.,21900003
Q4,00:21.1,Foul: Personal,Otto Porter Jr.,Devonte' Graham,CC,http://official.nba.com/last-two-minute-report/?gameNo=0021900003&eventNum=2227,Porter Jr. (CHI) makes contact to Graham's arm (CHA) that affects his ability to gather the ball.,21900003
Q4,00:18.9,Foul: Personal,Wendell Carter Jr.,Cody Zeller,CC,http://official.nba.com/last-two-minute-report/?gameNo=0021900003&eventNum=2230,"Carter Jr. (CH) makes contact with the ball, but also with Zeller (CHA) that affects his SQBR.",21900003
Q4,00:17.2,Foul: Personal,Dwayne Bacon,Lauri Markkanen,CC,http://official.nba.com/last-two-minute-report/?gameNo=0021900003&eventNum=2231,Bacon (CHA) makes body contact to Markkanen (CHI) during his drive that affects his SQBR.,21900003
Q4,00:16.8,Foul: Personal,Kris Dunn,Dwayne Bacon,CNC,http://official.nba.com/last-two-minute-report/?gameNo=0021900003&eventNum=2232,Dunn (CHI) makes marginal contact with Bacon (CHA) that does not affect his SQBR.,21900003
Q4,00:11.3,Foul: Personal,Lauri Markkanen,Devonte' Graham,CC,http://official.nba.com/last-two-minute-report/?gameNo=0021900003&eventNum=2233,Markkanen (CHI) makes contact to Graham's arm (CHA) that affects his SQBR.,21900003
Q4,00:11.3,Foul: Personal,Marvin Williams,Zach LaVine,CNC,http://official.nba.com/last-two-minute-report/?gameNo=0021900003&eventNum=2234,Williams (CHA) briefly places a forearm to the front of LaVine (CHI) but the contact is marginal.,21900003
Q4,00:04.5,Foul: Away from Play,Zach LaVine,Devonte' Graham,INC,http://official.nba.com/last-two-minute-report/?gameNo=0021900003&eventNum=2235,LaVine (CHI) wraps Graham (CHA) and affects his FOM.,21900003
Q4,00:04.5,Foul: Away from Play,Terry Rozier,Zach LaVine,CNC,http://official.nba.com/last-two-minute-report/?gameNo=0021900003&eventNum=2235,Rozier (CHA) makes incidental contact with LaVine (CHI).,21900003
Q4,00:02.0,Foul: Personal,Lauri Markkanen,Dwayne Bacon,CNC,http://official.nba.com/last-two-minute-report/?gameNo=0021900003&eventNum=2236,There is no conclusive angle to determine if Markkanen (CHI) makes contact with Bacon (CHA).,21900003
Q4,01:53.1,Foul: Loose Ball,Karl-Anthony Towns,Jarrett Allen,CNC,http://official.nba.com/last-two-minute-report/?gameNo=0021900006&eventNum=2245,Towns (MIN) makes marginal contact with Allen (BKN) during the rebound.,21900006
Q4,01:51.1,Foul: Shooting,Joe Harris,Treveon Graham,CNC,http://official.nba.com/last-two-minute-report/?gameNo=0021900006&eventNum=2246,Harris (BKN) cleanly blocks Graham's (MIN) shot attempt near the rim.,21900006
Q4,01:49.8,Foul: Shooting,Kyrie Irving,Andrew Wiggins,CNC,http://official.nba.com/last-two-minute-report/?gameNo=0021900006&eventNum=2247,Irving (BKN) makes marginal contact to Wiggins' (MIN) body that does not affect his shot attempt.,21900006
Q4,01:41.4,Foul: Shooting,Jeff Teague,Kyrie Irving,CC,http://official.nba.com/last-two-minute-report/?gameNo=0021900006&eventNum=2248,Teague (MIN) makes contact to Irving's (BKN) body during his shooting motion which affects his jump shot attempt.,21900006
Q4,01:33.6,Foul: Personal,Caris LeVert,Karl-Anthony Towns,CNC,http://official.nba.com/last-two-minute-report/?gameNo=0021900006&eventNum=2249,LeVert (BKN) briefly places a hand to the opposite side of Towns (MIN) body during the pick but he immediately removes it. The marginal contact does not affect Towns' (MIN) ability to move freely.,21900006
Q4,01:31.7,Foul: Offensive,Andrew Wiggins,Jarrett Allen, ,http://official.nba.com/last-two-minute-report/?gameNo=0021900006&eventNum=150000,"Wiggins (MIN) extends his hand into Allen's (BKN) body, warding him off and affecting his ability to contest the driving shot attempt.",21900006
Q4,01:06.9,Foul: Personal,Karl-Anthony Towns,Kyrie Irving,CNC,http://official.nba.com/last-two-minute-report/?gameNo=0021900006&eventNum=2251,Towns (MIN) makes marginal contact to Irving's (BKN) arm during the drive that does not affect his SQBR.,21900006
Q4,00:59.6,Foul: Offensive,Jarrett Allen,Jeff Teague,CNC,http://official.nba.com/last-two-minute-report/?gameNo=0021900006&eventNum=2252,Allen (BKN) establishes himself in a legal screening position in the path of Teague (MIN) when the contact occurs.,21900006
Q4,00:47.2,Foul: Shooting,Karl-Anthony Towns,Kyrie Irving,CNC,http://official.nba.com/last-two-minute-report/?gameNo=0021900006&eventNum=2253,Towns (MIN) makes incidental contact with Irving (BKN) after the release that does not affect his jump shot attempt.,21900006
Q4,00:05.7,Foul: Shooting,Karl-Anthony Towns,Jarrett Allen,CC,http://official.nba.com/last-two-minute-report/?gameNo=0021900006&eventNum=2254,Towns (MIN) makes body and arm contact with Allen (BKN) that affects his play at the basket.,21900006
Q4,00:05.7,Foul: Loose Ball,Taurean Prince,Noah Vonleh,CNC,http://official.nba.com/last-two-minute-report/?gameNo=0021900006&eventNum=2255,Prince (BKN) briefly grasps Vonleh's (MIN) arm during the rebound but does not dislodge him from his position.,21900006
Q4,00:05.1,Foul: Shooting,Karl-Anthony Towns,Taurean Prince,CNC,http://official.nba.com/last-two-minute-report/?gameNo=0021900006&eventNum=2256,Towns (MIN) cleanly blocks Prince's (BKN) shot attempt near the rim.,21900006
Q4,00:05.1,Foul: Shooting,Treveon Graham,Taurean Prince,CNC,http://official.nba.com/last-two-minute-report/?gameNo=0021900006&eventNum=2256,Graham (MIN) makes marginal contact with Prince (BKN) that does not affect his play at the basket.,21900006
Q5,01:44.5,Foul: Personal,Karl-Anthony Towns,Kyrie Irving,CNC,http://official.nba.com/last-two-minute-report/?gameNo=0021900006&eventNum=2257,Towns (MIN) jumps vertically and legally contests the drive to the basket by Irving (BKN).,21900006
Q5,1:40,Foul: Personal,Treveon Graham,Joe Harris,INC,http://official.nba.com/last-two-minute-report/?gameNo=0021900006&eventNum=2258,"Graham (MIN) grabs and holds Harris (BKN) off ball, affecting his FOM.",21900006
Q5,01:37.9,Foul: Offensive,Jarrett Allen,Treveon Graham,INC,http://official.nba.com/last-two-minute-report/?gameNo=0021900006&eventNum=2259,Allen (BKN) extends his leg into Graham's (MIN) path and delivers contact during the screen.,21900006
Q5,1:21,Foul: Offensive,Karl-Anthony Towns,Jarrett Allen,CNC,http://official.nba.com/last-two-minute-report/?gameNo=0021900006&eventNum=2260,"Towns (MIN) has his hands placed on Allen's (BKN) back during the rebound, but the contact is marginal.",21900006
Q5,01:10.5,Foul: Shooting,Karl-Anthony Towns,Kyrie Irving,CNC,http://official.nba.com/last-two-minute-report/?gameNo=0021900006&eventNum=2261,Towns (MIN) is retreating and absorbs the oncoming contact with Irving (BKN) with a collapsed forearm.,21900006
Q5,01:08.6,Foul: Personal,Jarrett Allen,Robert Covington,CC,http://official.nba.com/last-two-minute-report/?gameNo=0021900006&eventNum=2262,Allen (BKN) initiates contact with Covington (MIN) that affects his ability to control the rebound.,21900006
Q5,00:56.1,Foul: Personal,Caris LeVert,Karl-Anthony Towns,CNC,http://official.nba.com/last-two-minute-report/?gameNo=0021900006&eventNum=2263,LeVert (BKN) briefly places a hand to the opposite side of Towns (MIN) body during the pick but he immediately removes it.,21900006
Q5,00:36.8,Foul: Shooting,Robert Covington,Kyrie Irving,CC,http://official.nba.com/last-two-minute-report/?gameNo=0021900006&eventNum=2264,Covington (MIN) makes contact to Irving's (BKN) arm that affects his driving shot attempt.,21900006
Q5,00:21.3,Foul: Shooting,Jarrett Allen,Karl-Anthony Towns,CNC,http://official.nba.com/last-two-minute-report/?gameNo=0021900006&eventNum=2265,"Allen (BKN) makes incidental ""high-five"" contact with Towns (MIN) after the release that does not affect his jump shot attempt.",21900006
Q5,0:18,Foul: Loose Ball,Joe Harris,Andrew Wiggins,CNC,http://official.nba.com/last-two-minute-report/?gameNo=0021900006&eventNum=2266,Harris (BKN) makes contact with Wiggins (MIN) while the ball is loose that does not affect his ability to gather it.,21900006
Q5,00:14.5,Foul: Personal,Josh Okogie,Kyrie Irving,CNC,http://official.nba.com/last-two-minute-report/?gameNo=0021900006&eventNum=2267,Okogie (MIN) makes marginal contact with Irving (BKN) as he falls on his own during his dribble.,21900006
Q4,01:51.0,Foul: Shooting,Mike Conley,Chris Paul,CNC,http://official.nba.com/last-two-minute-report/?gameNo=0021900011&eventNum=2215,Conley (UTA) makes contact with the ball and incidental contact with Paul's (OKC) hand on the ball.,21900011
Q4,01:47.9,Turnover: Traveling,Dennis Schroder,Jazz,INC,http://official.nba.com/last-two-minute-report/?gameNo=0021900011&eventNum=2216,"Schroder (OKC) establishes his right foot as his pivot foot, and then moves it before releasing the pass.",21900011
Q4,01:45.0,Foul: Offensive,Steven Adams,Mike Conley,CNC,http://official.nba.com/last-two-minute-report/?gameNo=0021900011&eventNum=2217,Adams (OKC) sets the screen in Conley's (UTA) path and gives him room to avoid the contact.,21900011
Q4,01:41.1,Foul: Personal,Mike Conley,Chris Paul,CC,http://official.nba.com/last-two-minute-report/?gameNo=0021900011&eventNum=2218,Conley (UTA) makes contact with Paul's (OKC) arm during the rip-through.  The contact occurs before Paul begins his upward shooting motion.,21900011
Q4,01:34.9,Foul: Offensive,Royce O'Neale,Shai Gilgeous-Alexander,CNC,http://official.nba.com/last-two-minute-report/?gameNo=0021900011&eventNum=2219,O'Neale (UTA) sets the pick in Gilgeous-Alexander's (OKC) path and does not prevent him from disengaging from the contact.,21900011
Q4,01:20.1,Foul: Offensive,Steven Adams,Donovan Mitchell,CNC,http://official.nba.com/last-two-minute-report/?gameNo=0021900011&eventNum=2220,Adams (OKC) sets the screen in Mitchell's (UTA) path and gives him room to avoid the contact.,21900011
Q4,01:05.0,Foul: Loose Ball,Joe Ingles,Steven Adams,CNC,http://official.nba.com/last-two-minute-report/?gameNo=0021900011&eventNum=2221,Ingles (UTA) and Adams (OKC) make incidental contact with one another during rebounding.,21900011
Q4,00:58.7,Foul: Offensive,Royce O'Neale,Danilo Gallinari,CNC,http://official.nba.com/last-two-minute-report/?gameNo=0021900011&eventNum=2222,O'Neale (UTA) sets the pick in Gilgeous-Alexander's (OKC) path and does not deliver contact.,21900011
Q4,00:54.4,Foul: Offensive,Shai Gilgeous-Alexander,Donovan Mitchell,CNC,http://official.nba.com/last-two-minute-report/?gameNo=0021900011&eventNum=2223,Gilgeous-Alexander (OKC) makes marginal contact with Mitchell (UTA) as he disengages from the contact.,21900011
Q4,00:43.0,Foul: Offensive,Steven Adams,Rudy Gobert,CNC,http://official.nba.com/last-two-minute-report/?gameNo=0021900011&eventNum=2224,Adams (OKC) makes marginal contact with Gobert (UTA) before he contests the shot attempt.,21900011
Q4,00:40.4,Foul: Shooting,Rudy Gobert,Steven Adams,CC,http://official.nba.com/last-two-minute-report/?gameNo=0021900011&eventNum=2225,Gobert (UTA) makes contact to the arm of Adams (OKC) during his shooting motion that affects his play at the basket.,21900011
Q4,00:23.9,Foul: Offensive,Rudy Gobert,Hamidou Diallo,CNC,http://official.nba.com/last-two-minute-report/?gameNo=0021900011&eventNum=2226,Gobert (UTA) sets the pick in Diallo's (OKC) path and gives him room to avoid the contact.,21900011
Q4,00:16.7,Foul: Shooting,Donovan Mitchell,Danilo Gallinari,CNC,http://official.nba.com/last-two-minute-report/?gameNo=0021900011&eventNum=2227,Mitchell (UTA) makes incidental contact with Gallinari (OKC) after the release that does not affect his jump shot attempt.,21900011
Q4,00:14.6,Foul: Personal,Shai Gilgeous-Alexander,Mike Conley,CNC,http://official.nba.com/last-two-minute-report/?gameNo=0021900011&eventNum=2228,Gilgeous-Alexander (OKC) and Conley (UTA) briefly engage and separate off ball.,21900011
Q4,00:11.4,Foul: Personal,Danilo Gallinari,Mike Conley,CC,http://official.nba.com/last-two-minute-report/?gameNo=0021900011&eventNum=2229,Gallinari (OKC) extends his arm into Conley's (UTA) body and affects his SQBR.,21900011
Q4,00:08.1,Foul: Offensive,Shai Gilgeous-Alexander,Joe Ingles,CNC,http://official.nba.com/last-two-minute-report/?gameNo=0021900011&eventNum=2231,Gilgeous-Alexander (OKC) makes marginal contact with Ingles (UTA) during his drive.,21900011
Q4,00:08.1,Foul: Personal,Hamidou Diallo,Donovan Mitchell,CC,http://official.nba.com/last-two-minute-report/?gameNo=0021900011&eventNum=2230,Diallo (OKC) moves laterally into the path of Mitchell (UTA) on the drive and the contact affects his SQBR.,21900011
Q4,00:02.8,Foul: Shooting,Rudy Gobert,Shai Gilgeous-Alexander,CC,http://official.nba.com/last-two-minute-report/?gameNo=0021900011&eventNum=2232,Gobert (UTA) is not in a legal guarding position when contact occurs with Gilgeous-Alexander (OKC) that affects his driving shot attempt.,21900011
Q4,00:02.1,Foul: Personal,Shai Gilgeous-Alexander,Mike Conley,CC,http://official.nba.com/last-two-minute-report/?gameNo=0021900011&eventNum=2233,Gilgeous-Alexander (OKC) commits a take foul on Conley (UTA).,21900011
Q4,00:02.0,Foul: Offensive,Chris Paul,Donovan Mitchell,CNC,http://official.nba.com/last-two-minute-report/?gameNo=0021900011&eventNum=2234,Paul (OKC) and Mitchell (UTA) make incidental contact with one another during the inbound pass.,21900011
Q4,01:33.0,Foul: Shooting,Jaren Jackson Jr.,Zach LaVine,CNC,http://official.nba.com/last-two-minute-report/?gameNo=0021900020&eventNum=2275,Jackson Jr. (MEM) maintains a legal guarding position and makes incidental contact with LaVine (CHI) that does not affect his drive to the basket and shot attempt.,21900020
Q4,01:31.0,Foul: Shooting,Jae Crowder,Zach LaVine,CNC,http://official.nba.com/last-two-minute-report/?gameNo=0021900020&eventNum=2276,Crowder (MEM) makes marginal contact with LaVine (CHI) that does not affect his shot attempt.,21900020
Q4,01:18.8,Foul: Offensive,Dillon Brooks,Tomas Satoransky,CNC,http://official.nba.com/last-two-minute-report/?gameNo=0021900020&eventNum=2277,"Brooks (MEM) extends his leg and creates contact with Satoransky (CHI), but the contact is marginal.",21900020
Q4,01:18.8,Foul: Shooting,Tomas Satoransky,Dillon Brooks,CNC,http://official.nba.com/last-two-minute-report/?gameNo=0021900020&eventNum=2277,Satoransky (CHI) maintains a legal guarding position during the driving shot attempt by Brooks (MEM).,21900020
Q4,01:15.5,Foul: Loose Ball,Jaren Jackson Jr.,Lauri Markkanen,CNC,http://official.nba.com/last-two-minute-report/?gameNo=0021900020&eventNum=2278,Jackson Jr. (MEM) makes marginal contact with Markkanen (CHI) during rebounding.,21900020
Q4,01:15.5,Foul: Loose Ball,Dillon Brooks,Tomas Satoransky,CC,http://official.nba.com/last-two-minute-report/?gameNo=0021900020&eventNum=2278,Brooks (MEM) makes contact with Satoransky (CHI) that affects his ability to rebound.,21900020
Q4,00:34.3,Foul: Shooting,Brandon Clarke,Zach LaVine,IC,http://official.nba.com/last-two-minute-report/?gameNo=0021900020&eventNum=2279,Clarke (MEM) jumps alongside LaVine (CHI) defending the play at the basket.  Jackson Jr. (MEM) makes contact to the arm of LaVine and the foul should be assessed to Jackson Jr.,21900020
Q4,00:34.3,Foul: Personal,Lauri Markkanen,Jaren Jackson Jr.,CNC,http://official.nba.com/last-two-minute-report/?gameNo=0021900020&eventNum=2280,Markkanen (CHI) and Jackson Jr. (MEM) briefly engage and disengage during the inbound.,21900020
Q4,00:34.3,Foul: Offensive,Jaren Jackson Jr.,Coby White,CNC,http://official.nba.com/last-two-minute-report/?gameNo=0021900020&eventNum=2280,Jackson Jr. (MEM) establishes himself in a screening position and makes marginal contact with White (CHI).,21900020
