Period,Time,Call Type,Committing Player,Disadvantaged Player,Review Decision,Video,Comment,game_id
Q4,00:22.0,Foul: Shooting,Cole Anthony,Gordon Hayward,CNC,http://official.nba.com/last-two-minute-report/?gameNo=0022000252&eventNum=2182,"Anthony (ORL) reaches in and makes contact with the ball, followed by marginal contact with Hayward's (CHA) arm.",0022000252
Q4,00:20.2,Foul: Loose Ball,Terrence Ross,Bismack Biyombo,CNC,http://official.nba.com/last-two-minute-report/?gameNo=0022000252&eventNum=2183,Ross (ORL) makes marginal contact with Biyombo (CHA) during the rebound. ,0022000252
Q4,00:19.2,Foul: Personal,Nikola Vucevic,Bismack Biyombo,CC,http://official.nba.com/last-two-minute-report/?gameNo=0022000252&eventNum=2184,Vucevic (ORL) commits a take foul on Biyombo (CHA).,0022000252
Q4,00:14.8,Foul: Offensive,Evan Fournier,Terry Rozier,CNC,http://official.nba.com/last-two-minute-report/?gameNo=0022000252&eventNum=2192,Fournier (ORL) places his off-arm against Rozier (CHA) and the contact is marginal as he releases during the drive.,0022000252
Q4,00:10.3,Foul: Shooting,Gordon Hayward,Terrence Ross,CNC,http://official.nba.com/last-two-minute-report/?gameNo=0022000252&eventNum=2185,Hayward (CHA) legally contests Ross' (ORL) jump shot attempt.,0022000252
Q4,00:08.6,Foul: Offensive,P.J. Washington,Evan Fournier,CNC,http://official.nba.com/last-two-minute-report/?gameNo=0022000252&eventNum=2186,Washington (CHA) establishes himself in a legal screening position in Fournier's (ORL) path and does not deliver any contact. ,0022000252
Q4,00:01.6,Foul: Shooting,Evan Fournier,Gordon Hayward,CNC,http://official.nba.com/last-two-minute-report/?gameNo=0022000252&eventNum=2187,"Prior to Hayward completing his driving shot attempt at the basket, Fournier (ORL) makes marginal contact with Hayward's (CHA) backside on the gather. ",0022000252
Q4,00:00.7,Turnover: 5 Second Violation,Magic,Hornets,CC,http://official.nba.com/last-two-minute-report/?gameNo=0022000252&eventNum=2188,ORL fails to inbound the ball within five seconds.,0022000252
Q4,00:00.6,Foul: Personal,Dwayne Bacon,Gordon Hayward,CNC,http://official.nba.com/last-two-minute-report/?gameNo=0022000252&eventNum=2193,Bacon (ORL) briefly grasps Hayward's (CHA) arm. ,0022000252
Q4,00:00.1,Foul: Personal,Dwayne Bacon,Gordon Hayward,CC,http://official.nba.com/last-two-minute-report/?gameNo=0022000252&eventNum=2189,Bacon (ORL) commits a take foul on Hayward (CHA).,0022000252
Q4,01:52,Foul: Personal,Dillon Brooks,Delon Wright,CNC,http://official.nba.com/last-two-minute-report/?gameNo=0022000255&eventNum=2126,Brooks (MEM) places a resting hand to Wright's (SAC) side and marginal contact occurs during his dribble on the perimeter. ,0022000255
Q4,01:42.9,Foul: Shooting,Desmond Bane,Terence Davis,CNC,http://official.nba.com/last-two-minute-report/?gameNo=0022000255&eventNum=2116,Bane (MEM) legally contests Davis' (SAC) jump shot attempt.,0022000255
Q4,01:40.3,Foul: Loose Ball,Jonas Valanciunas,Buddy Hield,INC,http://official.nba.com/last-two-minute-report/?gameNo=0022000255&eventNum=2127,Valanciunas (MEM) makes contact with Hield's (SAC) wrist and affects his ability to control the rebound.,0022000255
Q4,01:36.7,Turnover: Lost Ball Out of Bounds,Buddy Hield,Dillon Brooks,CC,http://official.nba.com/last-two-minute-report/?gameNo=0022000255&eventNum=2117,The Replay Center determined the on-court ruling was overturned to Grizzlies' ball and Hield (SAC) was the last person to touch the ball before going out of bounds. ,0022000255
Q4,01:32.5,Foul: Offensive,Kyle Anderson,Buddy Hield,CNC,http://official.nba.com/last-two-minute-report/?gameNo=0022000255&eventNum=2118,"As they approach the screen, Anderson (MEM) and Hield (SAC) mutually engage and disengage and the contact is marginal.",0022000255
Q4,01:23.4,Foul: Shooting,Delon Wright,Jonas Valanciunas,CC,http://official.nba.com/last-two-minute-report/?gameNo=0022000255&eventNum=2119,"Wright (SAC) makes contact with Valanciunas' (MEM) arm, which affects his shot near the rim.",0022000255
Q4,01:15.0,Foul: Personal,Ja Morant,Chimezie Metu,CNC,http://official.nba.com/last-two-minute-report/?gameNo=0022000255&eventNum=2120,Morant (MEM) engages on the pick and his hand gets briefly tangled in Metu's (SAC) jersey as he disengages. The contact is marginal and does not affect Metu's FOM.,0022000255
Q4,01:10,Foul: Personal,Buddy Hield,Kyle Anderson,INC,http://official.nba.com/last-two-minute-report/?gameNo=0022000255&eventNum=2128,"Hield (SAC) swipes down and makes contact with Anderson's (MEM) arm, which affects his SQBR. ",0022000255
Q4,01:05.7,Foul: Shooting,Chimezie Metu,Dillon Brooks,CNC,http://official.nba.com/last-two-minute-report/?gameNo=0022000255&eventNum=2121,Metu (SAC) absorbs the contact created by Brooks (MEM) and avoids making contact to Brooks' arm on his dislodge attempt during the driving shot attempt. ,0022000255
Q4,00:50.2,Foul: Personal,Jonas Valanciunas,Delon Wright,CNC,http://official.nba.com/last-two-minute-report/?gameNo=0022000255&eventNum=2122,Valanciunas (MEM) maintains a legal guarding position on Wright (SAC) during the drive.,0022000255
Q4,00:39.9,Turnover: 24 Second Violation,Kings,Grizzlies,CC,http://official.nba.com/last-two-minute-report/?gameNo=0022000255&eventNum=2123,Hield (SAC) is unable to release his shot before the 24 second shot clock expires.,0022000255
Q4,00:34.8,Foul: Personal,Maurice Harkless,Desmond Bane,CC,http://official.nba.com/last-two-minute-report/?gameNo=0022000255&eventNum=2124,Harkless (SAC) commits a take foul on Bane (MEM).,0022000255
Q4,00:24.8,Foul: Shooting,Desmond Bane,Buddy Hield,CNC,http://official.nba.com/last-two-minute-report/?gameNo=0022000255&eventNum=2125,Bane (MEM) legally contests Hield's (SAC) jump shot attempt.,0022000255
Q4,01:56.7,Foul: Personal,Julius Randle,Anfernee Simons,CNC,http://official.nba.com/last-two-minute-report/?gameNo=0022000256&eventNum=2170,Randle (NYK) cleanly deflects the ball from Simons (POR).,0022000256
Q4,01:44.5,Foul: Offensive,Mitchell Robinson,Anfernee Simons,CNC,http://official.nba.com/last-two-minute-report/?gameNo=0022000256&eventNum=2171,Robinson (NYK) sets the screen on Simons (POR) and gives him room to avoid the contact.,0022000256
Q4,01:42.3,Foul: Shooting,Anfernee Simons,Immanuel Quickley,CNC,http://official.nba.com/last-two-minute-report/?gameNo=0022000256&eventNum=2172,Simons (POR) maintains a legal guarding position during the driving shot attempt by Quickley (NYK).,0022000256
Q4,01:41.2,Foul: Loose Ball,Mitchell Robinson,Enes Kanter,CNC,http://official.nba.com/last-two-minute-report/?gameNo=0022000256&eventNum=2173,Robinson (NYK) and Kanter (POR) briefly engage and disengage during the rebound.,0022000256
Q4,01:36.8,Turnover: Traveling,Immanuel Quickley,Trail Blazers,INC,http://official.nba.com/last-two-minute-report/?gameNo=0022000256&eventNum=2174,Quickley (NYK) splits his feet at the start of his dribble.,0022000256
Q4,01:33.4,Foul: Shooting,Anfernee Simons,Immanuel Quickley,CC,http://official.nba.com/last-two-minute-report/?gameNo=0022000256&eventNum=2175,Replay review of the foul called on Simons (POR) pursuant to a coach?s challenge was deemed unsuccessful.  Simons makes contact with Quickley (NYK) while he is in the act of shooting.,0022000256
Q4,01:02.9,Foul: Personal,Enes Kanter,Julius Randle,CNC,http://official.nba.com/last-two-minute-report/?gameNo=0022000256&eventNum=2176,Kanter (POR) maintains a legal guarding position on Randle (NYK) during the drive.,0022000256
Q4,00:59,Foul: Personal,Gary Trent Jr.,Mitchell Robinson,CNC,http://official.nba.com/last-two-minute-report/?gameNo=0022000256&eventNum=2188,Trent Jr. (POR) and Robinson (NYK) briefly engage and separate off-ball.,0022000256
Q4,00:51.5,Foul: Shooting,Enes Kanter,Julius Randle,CNC,http://official.nba.com/last-two-minute-report/?gameNo=0022000256&eventNum=2177,Kanter (POR) establishes a legal guarding position in Randle's (NYK) path and makes contact with the ball to force a tie-up.,0022000256
Q4,00:38.5,Foul: Personal,Alec Burks,Damian Lillard,CC,http://official.nba.com/last-two-minute-report/?gameNo=0022000256&eventNum=2178,Burks (NYK) makes contact with Lillard's (POR) arm and affects his SQBR.,0022000256
Q4,00:36,Foul: Personal,Julius Randle,Carmelo Anthony,CNC,http://official.nba.com/last-two-minute-report/?gameNo=0022000256&eventNum=2189,Randle (NYK) cleanly dislodges the ball from Anthony (POR).,0022000256
Q4,00:30.7,Foul: Personal,Julius Randle,Carmelo Anthony,CC,http://official.nba.com/last-two-minute-report/?gameNo=0022000256&eventNum=2179,Randle (NYK) makes contact with Anthony's (POR) arm and affects his SQBR.,0022000256
Q4,00:27.2,Foul: Shooting,Carmelo Anthony,Julius Randle,CNC,http://official.nba.com/last-two-minute-report/?gameNo=0022000256&eventNum=2180,Anthony (POR) maintains a legal guarding position during the driving shot attempt by Randle (NYK).,0022000256
Q4,00:25.6,Foul: Personal,Julius Randle,Damian Lillard,CC,http://official.nba.com/last-two-minute-report/?gameNo=0022000256&eventNum=2181,Randle (NYK) commits a take foul on Lillard (POR).,0022000256
Q4,00:25.6,Foul: Personal,Derrick Jones Jr.,Immanuel Quickley,CNC,http://official.nba.com/last-two-minute-report/?gameNo=0022000256&eventNum=2182,Jones Jr. (POR) makes marginal contact with Quickley (NYK) at the start of his drive.,0022000256
Q4,00:17.9,Foul: Personal,Julius Randle,Carmelo Anthony,CC,http://official.nba.com/last-two-minute-report/?gameNo=0022000256&eventNum=2183,Randle (NYK) commits a take foul on Anthony (POR).,0022000256
Q4,00:16.6,Foul: Loose Ball,Julius Randle,Robert Covington,CC,http://official.nba.com/last-two-minute-report/?gameNo=0022000256&eventNum=2184,Randle (NYK) makes contact with Covington's (POR) head during the free throw. After communicating with the Replay Center it was determined this did not meet the criteria of a flagrant foul.,0022000256
Q4,00:16.6,Foul: Shooting,Derrick Jones Jr.,Immanuel Quickley,IC,http://official.nba.com/last-two-minute-report/?gameNo=0022000256&eventNum=2185,"Jones Jr. (POR) makes contact with Quickley's (NYK) arm during the horizontal motion of his rip-through. A personal foul, not a shooting foul, should have been called.",0022000256
Q4,00:16.6,Foul: Personal,Robert Covington,Immanuel Quickley,CNC,http://official.nba.com/last-two-minute-report/?gameNo=0022000256&eventNum=2186,Covington (POR) maintains a legal guarding position on Quickley (NYK) during the drive.,0022000256
Q4,00:05.3,Foul: Personal,Immanuel Quickley,Damian Lillard,CC,http://official.nba.com/last-two-minute-report/?gameNo=0022000256&eventNum=2187,Quickley (NYK) commits a take foul on Lillard (POR).,0022000256
Q4,01:55.4,Foul: Offensive,Jarrett Allen,Dennis Schroder,CNC,http://official.nba.com/last-two-minute-report/?gameNo=0022000261&eventNum=2176,Allen (CLE) sets the screen in Schroder's (LAL) path and does not deliver contact.,0022000261
Q4,01:26.8,Foul: Offensive,Jarrett Allen,Alex Caruso,CNC,http://official.nba.com/last-two-minute-report/?gameNo=0022000261&eventNum=2177,Allen (CLE) sets the screen on Caruso (LAL) and gives him room to avoid the contact.,0022000261
Q4,01:21.3,Foul: Personal,Alex Caruso,Collin Sexton,CNC,http://official.nba.com/last-two-minute-report/?gameNo=0022000261&eventNum=2178,Caruso (LAL) maintains a legal guarding position on Sexton (CLE) and absorbs the contact as Sexton loses control of the ball.,0022000261
Q4,00:57.0,Foul: Personal,Dennis Schroder,Collin Sexton,CNC,http://official.nba.com/last-two-minute-report/?gameNo=0022000261&eventNum=2179,Schroder (LAL) maintains a legal guarding position on Sexton (CLE) following the pick.,0022000261
Q4,00:53.3,Foul: Personal,Kentavious Caldwell-Pope,Cedi Osman,CC,http://official.nba.com/last-two-minute-report/?gameNo=0022000261&eventNum=2180,Caldwell-Pope (LAL) makes contact with Osman's (CLE) arm and affects his ability to pass.,0022000261
Q4,00:46.3,Foul: Personal,Cedi Osman,Anthony Davis,CC,http://official.nba.com/last-two-minute-report/?gameNo=0022000261&eventNum=2181,Osman (CLE) reaches in and makes contact with Davis's (LAL) head.,0022000261
Q4,00:46.3,Foul: Personal,Taurean Prince,Dennis Schroder,CNC,http://official.nba.com/last-two-minute-report/?gameNo=0022000261&eventNum=2182,Prince (CLE) makes marginal contact with Schroder (LAL) during the drive.,0022000261
Q4,00:27.7,Foul: Shooting,Kentavious Caldwell-Pope,Cedi Osman,CNC,http://official.nba.com/last-two-minute-report/?gameNo=0022000261&eventNum=2183,Caldwell-Pope (LAL) makes marginal contact with Osman (CLE) before he begins his upward shooting motion.,0022000261
Q4,01:59.2,Foul: Shooting,Louis King,Tim Frazier,CNC,http://official.nba.com/last-two-minute-report/?gameNo=0022000263&eventNum=2133,King (SAC) legally contests Frazier's (MEM) jump shot attempt and avoids making contact with Frazier's right foot as he returns to the floor.,0022000263
Q4,01:42.9,Foul: Shooting,Xavier Tillman,Justin James,CNC,http://official.nba.com/last-two-minute-report/?gameNo=0022000263&eventNum=2134,Tillman (MEM) has his left hand extended forward and marginal contact occurs with James' (SAC) right arm before Tillman cleanly blocks the shot attempt thereafter.,0022000263
Q4,01:28.1,Foul: Offensive,Xavier Tillman,Jahmi'us Ramsey,CNC,http://official.nba.com/last-two-minute-report/?gameNo=0022000263&eventNum=2135,Tillman (MEM) establishes himself in a screening position in Ramsey's (SAC) path and turns slightly before absorbing the contact.,0022000263
Q4,01:24.0,Foul: Personal,Terence Davis,Killian Tillie,CNC,http://official.nba.com/last-two-minute-report/?gameNo=0022000263&eventNum=2149,Davis (SAC) extends his hands forward and marginal contact occurs with Tillie's (MEM) front during the drive.,0022000263
Q4,01:22.4,Foul: Shooting,Damian Jones,Killian Tillie,CC,http://official.nba.com/last-two-minute-report/?gameNo=0022000263&eventNum=2136,Jones (SAC) brings his arm down and initiates contact with Tillie's (MEM) left arm during his upward shooting motion.,0022000263
Q4,01:11.8,Foul: Offensive,Damian Jones,Xavier Tillman,CNC,http://official.nba.com/last-two-minute-report/?gameNo=0022000263&eventNum=2137,Jones (SAC) establishes himself in a screening position in Tillman's (MEM) path and absorbs the contact. Jones and Tillman then engage and disengage as they move toward the lane.,0022000263
Q4,01:05.0,Foul: Personal,Terence Davis,Killian Tillie,CNC,http://official.nba.com/last-two-minute-report/?gameNo=0022000263&eventNum=2150,Davis (SAC) moves forward toward Tillie (MEM) and marginal contact occurs with Tillie's back and right arm as he makes the pass.,0022000263
Q4,00:53.8,Foul: Offensive,Tim Frazier,Louis King,CNC,http://official.nba.com/last-two-minute-report/?gameNo=0022000263&eventNum=2138,Frazier (MEM) establishes himself in a screening position in King's (SAC) path and absorbs the contact.,0022000263
Q4,00:49.8,Foul: Personal,Louis King,Tim Frazier,CNC,http://official.nba.com/last-two-minute-report/?gameNo=0022000263&eventNum=2151,King (SAC) has his right hand slightly extended forward as he turns alongside Frazier's (MEM) path and marginal contact occurs during Frazier's drive into the lane. Jones (SAC) then brushes Frazier's front and marginal contact occurs at the end of the drive.,0022000263
Q4,00:45.7,Foul: Away from Play,Xavier Tillman,Louis King,CNC,http://official.nba.com/last-two-minute-report/?gameNo=0022000263&eventNum=2152,Tillman (MEM) engages and disengages with King (SAC) during the inbound.,0022000263
Q4,00:42.8,Foul: Shooting,Tim Frazier,Jahmi'us Ramsey,CNC,http://official.nba.com/last-two-minute-report/?gameNo=0022000263&eventNum=2139,Frazier (MEM) swipes forward and marginal contact occurs as he brushes Ramsey's (SAC) front after his gather. Porter (MEM) jumps vertically and absorbs the marginal body contact that occurs with Ramsey during the follow-through of his shot attempt.,0022000263
Q4,00:38.1,Foul: Personal,Justin James,Xavier Tillman,CC,http://official.nba.com/last-two-minute-report/?gameNo=0022000263&eventNum=2140,James (SAC) commits a take foul on Tillman (MEM).,0022000263
Q4,00:32.2,Foul: Shooting,Jontay Porter,Justin James,CNC,http://official.nba.com/last-two-minute-report/?gameNo=0022000263&eventNum=2141,Porter (MEM) has his hands slightly extended forward and marginal contact occurs with James' (SAC) front as he is gathering the ball.,0022000263
Q4,00:31.1,Foul: Offensive,Tim Frazier,Jahmi'us Ramsey,CNC,http://official.nba.com/last-two-minute-report/?gameNo=0022000263&eventNum=2153,Frazier (MEM) and Ramsey (SAC) engage and disengage with one another during the inbound.,0022000263
Q4,00:29.9,Foul: Personal,Jahmi'us Ramsey,Tim Frazier,CC,http://official.nba.com/last-two-minute-report/?gameNo=0022000263&eventNum=2142,Ramsey (SAC) initiates arm contact with Frazier (MEM) that affects his SQBR as he dribbles along the sideline.,0022000263
Q4,00:23.6,Foul: Personal,Tim Frazier,Justin James,CNC,http://official.nba.com/last-two-minute-report/?gameNo=0022000263&eventNum=2154,Frazier (MEM) moves slightly forward toward James (SAC) and marginal contact occurs with James' front before he loses control of the ball.,0022000263
Q4,00:21.1,Foul: Personal,Justin James,Tim Frazier,CC,http://official.nba.com/last-two-minute-report/?gameNo=0022000263&eventNum=2143,James (SAC) commits a take foul on Frazier (MEM).,0022000263
Q4,00:20.5,Foul: Personal,Xavier Tillman,Louis King,CNC,http://official.nba.com/last-two-minute-report/?gameNo=0022000263&eventNum=2155,Tillman (MEM) moves forward toward King (SAC) and marginal contact occurs with King's side as he receives the pass.,0022000263
Q4,00:12.4,Foul: Personal,Justin James,Justise Winslow,CC,http://official.nba.com/last-two-minute-report/?gameNo=0022000263&eventNum=2144,James (SAC) commits a take foul on Winslow (MEM).,0022000263
Q4,00:09.0,Foul: Shooting,Tim Frazier,Terence Davis,CNC,http://official.nba.com/last-two-minute-report/?gameNo=0022000263&eventNum=2145,Frazier (MEM) extends his left hand outward and marginal contact occurs with Davis' (SAC) right leg during the jump shot attempt.,0022000263
Q4,00:05.3,Foul: Personal,Louis King,Justise Winslow,CC,http://official.nba.com/last-two-minute-report/?gameNo=0022000263&eventNum=2146,King (SAC) commits a take foul on Winslow (MEM).,0022000263
Q4,00:05.3,Foul: Loose Ball,Terence Davis,Jontay Porter,CNC,http://official.nba.com/last-two-minute-report/?gameNo=0022000263&eventNum=2147,Davis (SAC) extends his arm forward and marginal contact occurs with Porter's (MEM) left arm as they each attempt to retrieve the rebound. King (SAC) has his hand rested on Porter's front as the rebound falls overhead and marginal contact occurs.,0022000263
Q4,00:01.0,Foul: Shooting,Justise Winslow,Terence Davis,CNC,http://official.nba.com/last-two-minute-report/?gameNo=0022000263&eventNum=2148,Winslow (MEM) and Tillman (MEM) legally contest Davis' (SAC) shot attempt.,0022000263
Q4,01:48.6,Foul: Personal,Derrick White,Steven Adams,CNC,http://official.nba.com/last-two-minute-report/?gameNo=0022000264&eventNum=2149,White (SAS) makes marginal contact with Adams' (NOP) arm as he attempts to get to the pass.,0022000264
Q4,01:44,Foul: Loose Ball,Steven Adams,Dejounte Murray,CNC,http://official.nba.com/last-two-minute-report/?gameNo=0022000264&eventNum=2153,Adams (NOP) places a hand on Murray (SAS) and marginal contact occurs as he goes for the rebound.,0022000264
Q4,01:40.2,Foul: Offensive,Steven Adams,Jakob Poeltl,CC,http://official.nba.com/last-two-minute-report/?gameNo=0022000264&eventNum=2142,Adams (NOP) grabs Poeltl's (SAS) arm off-ball and affects his ability to defend the driving shot attempt by Williamson (NOP). ,0022000264
Q4,00:59.8,Foul: Personal,Dejounte Murray,Zion Williamson,CNC,http://official.nba.com/last-two-minute-report/?gameNo=0022000264&eventNum=2150,Murray (SAS) deflects the incoming pass away from Williamson (NOP). ,0022000264
Q4,00:56.0,Foul: Shooting,Keldon Johnson,Zion Williamson,CNC,http://official.nba.com/last-two-minute-report/?gameNo=0022000264&eventNum=2143,Johnson (SAS) absorbs the contact to Williamson's (NOP) arm during his driving shot attempt. ,0022000264
Q4,00:39.7,Foul: Offensive,Keldon Johnson,Naji Marshall,CNC,http://official.nba.com/last-two-minute-report/?gameNo=0022000264&eventNum=2144,Johnson (SAS) slightly extends his arms into Marshall's (NOP) body and does not dislodge him from his legally obtained position during the pick.,0022000264
Q4,00:27.8,Foul: Shooting,Dejounte Murray,Lonzo Ball,CNC,http://official.nba.com/last-two-minute-report/?gameNo=0022000264&eventNum=2145,Murray (SAS) makes incidental contact to Ball's (NOP) arm after the release of his jump shot attempt.,0022000264
Q4,00:20.8,Foul: Personal,Naji Marshall,DeMar DeRozan,CC,http://official.nba.com/last-two-minute-report/?gameNo=0022000264&eventNum=2146,Marshall (NOP) commits a take foul on DeRozan (SAS).,0022000264
Q4,00:19.7,Foul: Personal,Wes Iwundu,Dejounte Murray,CC,http://official.nba.com/last-two-minute-report/?gameNo=0022000264&eventNum=2147,Iwundu (NOP) commits a take foul on Murray (SAS).,0022000264
Q4,00:16.2,Foul: Shooting,Derrick White,Brandon Ingram,CNC,http://official.nba.com/last-two-minute-report/?gameNo=0022000264&eventNum=2148,White (SAS) gives Ingram (NOP) room to land on the jump shot attempt.,0022000264
Q4,00:02.8,Foul: Personal,DeMar DeRozan,Lonzo Ball,CNC,http://official.nba.com/last-two-minute-report/?gameNo=0022000264&eventNum=2151,DeRozan (SAS) makes incidental contact with Ball's (NOP) foot during the inbounds. ,0022000264
Q4,00:02.8,Foul: Personal,DeMar DeRozan,Brandon Ingram,CNC,http://official.nba.com/last-two-minute-report/?gameNo=0022000264&eventNum=2152,DeRozan (SAS) moves slightly into Ingram's (NOP) path and makes marginal contact with his body during the inbounds.,0022000264
Q4,01:57.1,Foul: Personal,Carmelo Anthony,Darius Bazley,CNC,http://official.nba.com/last-two-minute-report/?gameNo=0022000267&eventNum=2146,Anthony (POR) cleanly dislodges the ball from Bazley (OKC) during his drive. ,0022000267
Q4,01:51.2,Foul: Offensive,Enes Kanter,Darius Bazley,CNC,http://official.nba.com/last-two-minute-report/?gameNo=0022000267&eventNum=2147,Kanter (POR) establishes himself in a screening position in the path of Bazley (OKC) and absorbs the contact. ,0022000267
Q4,01:48.6,Foul: Shooting,Isaiah Roby,Carmelo Anthony,CNC,http://official.nba.com/last-two-minute-report/?gameNo=0022000267&eventNum=2148,Roby (OKC) makes incidental contact to Anthony's (POR) arm after the release of his driving shot attempt. ,0022000267
Q4,01:45.1,Foul: Loose Ball,Luguentz Dort,Enes Kanter,CNC,http://official.nba.com/last-two-minute-report/?gameNo=0022000267&eventNum=2149,Dort (OKC) makes incidental contact to Kanter's (OKC) body during the rebound. ,0022000267
Q4,01:45.1,Foul: Loose Ball,Kenrich Williams,Damian Lillard,CC,http://official.nba.com/last-two-minute-report/?gameNo=0022000267&eventNum=2149,Williams (OKC) dislodges Lillard (POR) from his position during the rebound.,0022000267
Q4,01:33.3,Foul: Shooting,Damian Lillard,Shai Gilgeous-Alexander,CNC,http://official.nba.com/last-two-minute-report/?gameNo=0022000267&eventNum=2150,Lillard (POR) jumps vertically and absorbs the body contact from Gilgeous-Alexander (OKC) and the contact with his arm is marginal.,0022000267
Q4,01:19.6,Foul: Loose Ball,Enes Kanter,Isaiah Roby,CNC,http://official.nba.com/last-two-minute-report/?gameNo=0022000267&eventNum=2151,Kanter (POR) makes incidental contact to Roby's (OKC) arm during the rebound. ,0022000267
Q4,01:14.8,Foul: Personal,Anfernee Simons,Shai Gilgeous-Alexander,CNC,http://official.nba.com/last-two-minute-report/?gameNo=0022000267&eventNum=2152,Simons (POR) makes marginal contact with Gilgeous-Alexander's (OKC) body at the end of his drive as he moves along his path.,0022000267
Q4,00:49.9,Foul: Offensive,Damian Lillard,Luguentz Dort,CNC,http://official.nba.com/last-two-minute-report/?gameNo=0022000267&eventNum=2164,Lillard (POR) releases from Dort (OKC) on the perimeter. ,0022000267
Q4,00:42.1,Foul: Shooting,Shai Gilgeous-Alexander,Anfernee Simons,CNC,http://official.nba.com/last-two-minute-report/?gameNo=0022000267&eventNum=2153,Gilgeous-Alexander (OKC) blocks the shot attempt by Simons (POR) before making marginal contact with his arm.,0022000267
Q4,00:35.2,Foul: Shooting,Isaiah Roby,Enes Kanter,CNC,http://official.nba.com/last-two-minute-report/?gameNo=0022000267&eventNum=2154,Roby (OKC) makes marginal contact to Kanter's (POR) body during his shooting motion on his shot attempt near the basket. ,0022000267
Q4,00:31.4,Foul: Personal,Damian Lillard,Shai Gilgeous-Alexander,CC,http://official.nba.com/last-two-minute-report/?gameNo=0022000267&eventNum=2155,Lillard (POR) commits a take foul on Gilgeous-Alexander (OKC).,0022000267
Q4,00:31.3,Foul: Personal,Kenrich Williams,Damian Lillard,CNC,http://official.nba.com/last-two-minute-report/?gameNo=0022000267&eventNum=2165,Williams (OKC) makes incidental contact to Lillard's (POR) foot during the inbounds. ,0022000267
Q4,00:28.1,Foul: Loose Ball,Isaiah Roby,Enes Kanter,CNC,http://official.nba.com/last-two-minute-report/?gameNo=0022000267&eventNum=2156,Roby (OKC) slightly extends his arm into Kanter (POR) but does not dislodge him during the rebound.,0022000267
Q4,00:24.4,Foul: Offensive,Enes Kanter,Isaiah Roby,CNC,http://official.nba.com/last-two-minute-report/?gameNo=0022000267&eventNum=2166,Kanter (POR) briefly grasps Roby's (OKC) arm off ball.,0022000267
Q4,00:20.7,Foul: Shooting,Luguentz Dort,Damian Lillard,CNC,http://official.nba.com/last-two-minute-report/?gameNo=0022000267&eventNum=2157,Replay review of the shooting foul called on Dort (OKC) pursuant to a coach?s challenge was deemed successful.  Dort reaches in and makes clean contact with the ball while defending Lillard (POR).,0022000267
