Period,Time,Call Type,Committing Player,Disadvantaged Player,Review Decision,Video,Comment,game_id
Q4,00:39.3,Foul: Defense 3 Second,Julius Randle,Cavaliers,INC,http://official.nba.com/last-two-minute-report/?gameNo=0022000181&eventNum=2169,Randle (NYK) straddles the lane line and is in the paint for longer than three seconds without imminently actively guarding an opponent.,0022000181
Q4,00:39.3,Violation: Kicked Ball,Reggie Bullock,Knicks,CC,http://official.nba.com/last-two-minute-report/?gameNo=0022000181&eventNum=2169,Bullock (NYK) extends his leg in Dotson's (CLE) path and makes foot to ball contact during his drive and a kicked ball violation is correctly called.,0022000181
Q4,00:39.2,Foul: Personal,Reggie Bullock,Damyean Dotson,CNC,http://official.nba.com/last-two-minute-report/?gameNo=0022000181&eventNum=2170,Bullock (NYK) cleanly deflects the pass attempt to Dotson (CLE). Any ensuing contact is deemed incidental. ,0022000181
Q4,00:36.2,Turnover: Stepped out of Bounds,Reggie Bullock,Cavaliers,CNC,http://official.nba.com/last-two-minute-report/?gameNo=0022000181&eventNum=2181,There is no clear or conclusive angle that shows Bullock (NYK) steps out of bounds at the end of his drive to the basket.,0022000181
Q4,00:34.2,Foul: Personal,Andre Drummond,Mitchell Robinson,CNC,http://official.nba.com/last-two-minute-report/?gameNo=0022000181&eventNum=2171,Drummond (CLE) makes marginal contact with Robinson's (NYK) arm in the lane.,0022000181
Q4,00:23.7,Foul: Personal Take,Mitchell Robinson,Andre Drummond,CC,http://official.nba.com/last-two-minute-report/?gameNo=0022000181&eventNum=2172,Robinson (NYK) commits a take foul on Drummond (CLE).,0022000181
Q4,00:22.3,Foul: Offensive,Mitchell Robinson,Damyean Dotson,CNC,http://official.nba.com/last-two-minute-report/?gameNo=0022000181&eventNum=2173,Robinson (NYK) establishes legal screening position in Dotson's (CLE) path and gives him a step to avoid contact. ,0022000181
Q4,00:21.2,Foul: Personal,Andre Drummond,RJ Barrett,CNC,http://official.nba.com/last-two-minute-report/?gameNo=0022000181&eventNum=2174,Drummond (CLE) cleanly dislodges the ball from Barret (NYK). ,0022000181
Q4,00:16.3,Foul: Personal Take,Immanuel Quickley,Andre Drummond,CC,http://official.nba.com/last-two-minute-report/?gameNo=0022000181&eventNum=2175,Quickley (NYK) commits a take foul on Drummond (CLE). ,0022000181
Q4,00:09.8,Foul: Shooting,Lamar Stevens,Immanuel Quickley,CNC,http://official.nba.com/last-two-minute-report/?gameNo=0022000181&eventNum=2176,Stevens (CLE) legally contests Quickley's (NYK) driving shot attempt.,0022000181
Q4,00:07.3,Foul: Personal Take,RJ Barrett,Isaac Okoro,CC,http://official.nba.com/last-two-minute-report/?gameNo=0022000181&eventNum=2177,Barrett (NYK) commits a take foul on Okoro (CLE). ,0022000181
Q4,01:50.0,Foul: Offensive,Brook Lopez,Luka Doncic,CNC,http://official.nba.com/last-two-minute-report/?gameNo=0022000182&eventNum=2164,Lopez (MIL) sets the screen on Doncic (DAL) and does not deliver contact.,0022000182
Q4,01:47.4,Foul: Offensive,Willie Cauley-Stein,Jrue Holiday,CNC,http://official.nba.com/last-two-minute-report/?gameNo=0022000182&eventNum=2165,Cauley-Stein (DAL) sets the screen on Holiday (MIL) and gives him room to avoid the contact.,0022000182
Q4,01:47.4,Foul: Offensive,Luka Doncic,Khris Middleton,CNC,http://official.nba.com/last-two-minute-report/?gameNo=0022000182&eventNum=2166,Doncic (DAL) makes marginal contact with Middleton (MIL) before releasing and stepping back for his shot attempt.,0022000182
Q4,01:45.3,Foul: Offensive,Tim Hardaway Jr.,Jrue Holiday,CNC,http://official.nba.com/last-two-minute-report/?gameNo=0022000182&eventNum=2167,Hardaway Jr. (DAL) sets the screen on Holiday (MIL) and does not deliver contact.,0022000182
Q4,01:39.8,Foul: Shooting,Luka Doncic,Khris Middleton,CNC,http://official.nba.com/last-two-minute-report/?gameNo=0022000182&eventNum=2168,Middleton (MIL) maintains a legal guarding position while defending Doncic's (DAL) shot attempt.,0022000182
Q4,01:20.5,Foul: Personal,Tim Hardaway Jr.,Brook Lopez,CNC,http://official.nba.com/last-two-minute-report/?gameNo=0022000182&eventNum=2169,Hardaway Jr. (DAL) maintains a legal guarding position on Lopez (MIL) in the post.,0022000182
Q4,01:17.5,Foul: Shooting,Tim Hardaway Jr.,Brook Lopez,CNC,http://official.nba.com/last-two-minute-report/?gameNo=0022000182&eventNum=2170,Hardaway Jr. (DAL) maintains a legal guarding position while defending Lopez's (MIL) shot atttempt.,0022000182
Q4,01:12,Foul: Offensive,Luka Doncic,Jrue Holiday,CNC,http://official.nba.com/last-two-minute-report/?gameNo=0022000182&eventNum=2159,Doncic (DAL) and Holiday (MIL) briefly engage and disengage.,0022000182
Q4,01:10,Foul: Offensive,Kristaps Porzingis,Jrue Holiday,CNC,http://official.nba.com/last-two-minute-report/?gameNo=0022000182&eventNum=2160,Porzingis (DAL) sets the screen on Holiday (MIL) and gives him room to avoid the contact.,0022000182
Q4,01:05.4,Foul: Shooting,Jrue Holiday,Luka Doncic,CNC,http://official.nba.com/last-two-minute-report/?gameNo=0022000182&eventNum=2171,Holiday (MIL) makes marginal contact with Doncic (DAL) during the driving shot attempt.,0022000182
Q4,00:40.4,Foul: Loose Ball,Trey Burke,Donte DiVincenzo,CNC,http://official.nba.com/last-two-minute-report/?gameNo=0022000182&eventNum=2172,Burke (DAL) and DiVincenzo (MIL) briefly engage and disengage during the rebound.,0022000182
Q4,00:33,Foul: Personal,Khris Middleton,Kristaps Porzingis,CNC,http://official.nba.com/last-two-minute-report/?gameNo=0022000182&eventNum=2161,Middleton (MIL) maintains a legal guarding position on Porzingis (DAL).,0022000182
Q4,00:25.7,Foul: Offensive,Trey Burke,Jrue Holiday,CNC,http://official.nba.com/last-two-minute-report/?gameNo=0022000182&eventNum=2173,Burke (DAL) sets the screen on Holiday (MIL) and does not deliver contact.,0022000182
Q4,00:20.4,Foul: Loose Ball,Brook Lopez,Kristaps Porzingis,INC,http://official.nba.com/last-two-minute-report/?gameNo=0022000182&eventNum=2153,Lopez (MIL) extends his arms into Porzingis (DAL) and initiates contact that dislodges him from his position during the rebound.,0022000182
Q4,00:13.3,Foul: Shooting,Giannis Antetokounmpo,Kristaps Porzingis,CNC,http://official.nba.com/last-two-minute-report/?gameNo=0022000182&eventNum=2154,"Antetokounmpo (MIL) makes incidental ""high-five"" contact with Porzingis (DAL) after the release that does not affect his jump shot attempt.",0022000182
Q4,00:07.9,Foul: Personal,Trey Burke,Khris Middleton,CC,http://official.nba.com/last-two-minute-report/?gameNo=0022000182&eventNum=2155,Burke (DAL) commits a take foul on Middleton (MIL).,0022000182
Q4,00:07.8,Foul: Personal,Jrue Holiday,Luka Doncic,CNC,http://official.nba.com/last-two-minute-report/?gameNo=0022000182&eventNum=2156,Holiday (MIL) maintains a legal guarding position on Doncic (DAL) during the drive as he moves along his path. ,0022000182
Q4,00:07.8,Foul: Away from Play,Khris Middleton,Tim Hardaway Jr.,CNC,http://official.nba.com/last-two-minute-report/?gameNo=0022000182&eventNum=2162,Middleton (MIL) and Hardaway Jr. (DAL) briefly engage and disengage during the inbound.,0022000182
Q4,00:02.7,Foul: Shooting,Jrue Holiday,Luka Doncic,CNC,http://official.nba.com/last-two-minute-report/?gameNo=0022000182&eventNum=2157,Holiday (MIL) makes marginal contact with Doncic's (DAL) body during the shot attempt.,0022000182
Q4,00:02.0,Foul: Offensive,Brook Lopez,Wes Iwundu,CNC,http://official.nba.com/last-two-minute-report/?gameNo=0022000182&eventNum=2163,Lopez (MIL) and Iwundu (DAL) briefly engage and separate during the inbound.,0022000182
Q4,00:01.0,Foul: Personal,Luka Doncic,Brook Lopez,CC,http://official.nba.com/last-two-minute-report/?gameNo=0022000182&eventNum=2158,Doncic (DAL) commits a take foul on Lopez (MIL).,0022000182
Q4,01:59,Foul: Loose Ball,Jarred Vanderbilt,Ja Morant,CNC,http://official.nba.com/last-two-minute-report/?gameNo=0022000183&eventNum=2148,Morant (MEM) goes to the ground to pursue the loose ball and any contact by Russell (MIN) or Vanderbilt (MIN) before they cleanly tie it up is deemed marginal. A jump ball between Vanderbilt and Morant is correctly whistled.,0022000183
Q4,01:56.9,Foul: Personal,Desmond Bane,Jaden McDaniels,CNC,http://official.nba.com/last-two-minute-report/?gameNo=0022000183&eventNum=2149,Bane (MEM) makes clean ball contact to temporarily dislodge it from McDaniels (MIN) after he secures the tipped jump ball.,0022000183
Q4,01:51,Foul: Personal,Dillon Brooks,D'Angelo Russell,CNC,http://official.nba.com/last-two-minute-report/?gameNo=0022000183&eventNum=2152,"During the drive, Brooks (MEM) places a resting arm to Russell's (MIN) front and marginal contact occurs with his arm as he immediately removes it. ",0022000183
Q4,01:48,Foul: Personal,Dillon Brooks,Karl-Anthony Towns,CNC,http://official.nba.com/last-two-minute-report/?gameNo=0022000183&eventNum=2151,Brooks (MEM) and Towns (MIN) engage and disengage off-ball in the post and the contact is marginal.,0022000183
Q4,01:43.4,Turnover:  Out of Bounds - Bad Pass Turn,Karl-Anthony Towns,Dillon Brooks,CC,http://official.nba.com/last-two-minute-report/?gameNo=0022000183&eventNum=2137,Towns (MIN) throws an errant pass across the court and it goes off of McDaniels' (MIN) hands out of bounds.,0022000183
Q4,01:11.3,Foul: Shooting,Xavier Tillman,D'Angelo Russell,CNC,http://official.nba.com/last-two-minute-report/?gameNo=0022000183&eventNum=2138,Tillman (MEM) maintains a legal guarding position during the driving shot attempt by Russell (MIN).,0022000183
Q4,01:11.3,Foul: Defense 3 Second,Kyle Anderson,Timberwolves,CNC,http://official.nba.com/last-two-minute-report/?gameNo=0022000183&eventNum=2138,Anderson (MEM) is in the paint for around three seconds when the shot is imminent.,0022000183
Q4,00:59.9,Foul: Shooting,Jaden McDaniels,Ja Morant,INC,http://official.nba.com/last-two-minute-report/?gameNo=0022000183&eventNum=2139,"McDaniels (MIN) brings his arm down and makes contact with Morant's (MEM) head, which affects his driving shot attempt.",0022000183
Q4,00:54.3,Foul: Personal,Dillon Brooks,D'Angelo Russell,CC,http://official.nba.com/last-two-minute-report/?gameNo=0022000183&eventNum=2140,Brooks (MEM) makes contact with Russell (MIN) and it dislodges him out of bounds. ,0022000183
Q4,00:39.2,Foul: Offensive,Xavier Tillman,Jaden McDaniels,CNC,http://official.nba.com/last-two-minute-report/?gameNo=0022000183&eventNum=2141,Tillman (MEM) establishes himself in a screening position in McDaniels' (MIN) path and absorbs the contact. ,0022000183
Q4,00:31.8,Foul: Shooting,Xavier Tillman,D'Angelo Russell,CNC,http://official.nba.com/last-two-minute-report/?gameNo=0022000183&eventNum=2142,"Tillman (MEM) legally contests Russell's (MIN) jump shot attempt.  Any ""high-five"" contact after the release is considered incidental.",0022000183
Q4,00:29.2,Foul: Loose Ball,Karl-Anthony Towns,Kyle Anderson,CNC,http://official.nba.com/last-two-minute-report/?gameNo=0022000183&eventNum=2143,"During the rebound, Towns (MIN) has his hands resting on Anderson's (MEM) back and marginal contact occurs as he releases for the ball that goes over their heads. ",0022000183
Q4,00:25.1,Turnover:  Out of Bounds - Bad Pass Turn,Karl-Anthony Towns,Brandon Clarke,CC,http://official.nba.com/last-two-minute-report/?gameNo=0022000183&eventNum=2144,Towns (MIN) throws an errant pass across the court that goes out of bounds. ,0022000183
Q4,00:15.8,Foul: Personal,Jarred Vanderbilt,Ja Morant,CC,http://official.nba.com/last-two-minute-report/?gameNo=0022000183&eventNum=2145,"Vanderbilt (MIN) runs to and through Morant's (MEM) body, which knocks him to the ground.",0022000183
Q4,00:13.1,Foul: Personal,Jaden McDaniels,Ja Morant,CC,http://official.nba.com/last-two-minute-report/?gameNo=0022000183&eventNum=2146,McDaniels (MIN) commits a take foul on Morant (MEM).,0022000183
Q4,00:12.8,Foul: Offensive,Karl-Anthony Towns,Kyle Anderson,CNC,http://official.nba.com/last-two-minute-report/?gameNo=0022000183&eventNum=2150,"During the inbound, Towns (MIN) cuts to the perimeter and incidental contact occurs with Anderson (MEM) as they briefly come together. ",0022000183
Q4,00:08.5,Foul: Personal,Josh Okogie,Desmond Bane,CC,http://official.nba.com/last-two-minute-report/?gameNo=0022000183&eventNum=2147,Okogie (MIN) reaches in and makes contact to Bane's (MEM) arm.,0022000183
Q4,01:58.4,Foul: Shooting,Patrick Williams,Luguentz Dort,CNC,http://official.nba.com/last-two-minute-report/?gameNo=0022000184&eventNum=2127,Williams (CHI) legally contest Dort's (OKC) jump shot attempt.,0022000184
Q4,01:47.2,Foul: Shooting,Wendell Carter Jr.,Mike Muscala,IC,http://official.nba.com/last-two-minute-report/?gameNo=0022000184&eventNum=2128,Carter Jr. (CHI) makes marginal contact with Muscala's (OKC) hand after the follow-through of his jump shot. The marginal contact does not affect Muscala's ability to completely follow-through.,0022000184
Q4,01:31.1,Foul: Personal,Luguentz Dort,Zach LaVine,CNC,http://official.nba.com/last-two-minute-report/?gameNo=0022000184&eventNum=2160,Dort (OKC) momentarily places two hands on LaVine (CHI) on the dribble. The contact is marginal and LaVine is able to successfully take a dribble and continue into his shot.,0022000184
Q4,01:29.9,Foul: Shooting,Luguentz Dort,Zach LaVine,CNC,http://official.nba.com/last-two-minute-report/?gameNo=0022000184&eventNum=2129,Dort (OKC) legally contest LaVine's (CHI) jump shot attempt. ,0022000184
Q4,01:27.4,Foul: Loose Ball,George Hill,Patrick Williams,CNC,http://official.nba.com/last-two-minute-report/?gameNo=0022000184&eventNum=2130,Hill (OKC) briefly grasps Williams' (CHI) arm during the rebound. ,0022000184
Q4,01:27.4,Foul: Loose Ball,Patrick Williams,Kenrich Williams,CNC,http://official.nba.com/last-two-minute-report/?gameNo=0022000184&eventNum=2130,Williams (CHI) makes clean hand on ball contact as he tips the rebound away from Williams (OKC). ,0022000184
Q4,01:27.4,Foul: Offensive,Shai Gilgeous-Alexander,Garrett Temple,CNC,http://official.nba.com/last-two-minute-report/?gameNo=0022000184&eventNum=2130,Gilgeous-Alexander (OKC) initiates marginal contact with Temple (CHI) at the end of the drive. ,0022000184
Q4,01:27.4,Foul: Personal,Garrett Temple,Shai Gilgeous-Alexander,CNC,http://official.nba.com/last-two-minute-report/?gameNo=0022000184&eventNum=2130,Temple (CHI) maintains a legal guarding position during Gilgeous-Alexander's (OKC) drive.,0022000184
Q4,01:12.9,Foul: Offensive,Lauri Markkanen,Luguentz Dort,CNC,http://official.nba.com/last-two-minute-report/?gameNo=0022000184&eventNum=2161,Markkanen (CHI) establishes himself in a legal screening position in Dort's (OKC) path. ,0022000184
Q4,01:01.4,Foul: Offensive,Zach LaVine,Luguentz Dort,CNC,http://official.nba.com/last-two-minute-report/?gameNo=0022000184&eventNum=2131,LaVine (CHI) makes marginal contact with Dort (OKC) during the steal.,0022000184
Q4,00:52.5,Foul: Offensive,George Hill,Garrett Temple,CNC,http://official.nba.com/last-two-minute-report/?gameNo=0022000184&eventNum=2132,Hill's (OKC) hand makes brush contact with Temple (CHI) during the pick. ,0022000184
Q4,00:50.0,Foul: Shooting,Garrett Temple,Kenrich Williams,CNC,http://official.nba.com/last-two-minute-report/?gameNo=0022000184&eventNum=2133,Temple (CHI) places a stayed hand on Williams (OKC) backside during the play at the basket.,0022000184
Q4,00:49.8,Foul: Offensive,Coby White,Luguentz Dort,CC,http://official.nba.com/last-two-minute-report/?gameNo=0022000184&eventNum=2134,White (CHI) is late establishing himself in a screening position in Dort's (OKC) path and he delivers contact.,0022000184
Q4,00:42.4,Foul: Shooting,Patrick Williams,Luguentz Dort,CNC,http://official.nba.com/last-two-minute-report/?gameNo=0022000184&eventNum=2135,Williams (CHI) legally contests Dort's (OKC) jump shot.,0022000184
Q4,00:39.7,Foul: Loose Ball,George Hill,Lauri Markkanen,CNC,http://official.nba.com/last-two-minute-report/?gameNo=0022000184&eventNum=2136,Hill (OKC) makes hand on ball contact then marginal follow-through contact with Markkanen's (CHI) arm during the rebound.,0022000184
Q4,00:39.7,Foul: Loose Ball,Coby White,George Hill,CNC,http://official.nba.com/last-two-minute-report/?gameNo=0022000184&eventNum=2136,White (CHI) engages and disengages with Hill (OKC) during the rebound. ,0022000184
Q4,00:26.9,Foul: Offensive,Lauri Markkanen,Kenrich Williams,CC,http://official.nba.com/last-two-minute-report/?gameNo=0022000184&eventNum=2137,Markkanen (CHI) is late establishing himself in a picking position in Williams' (OKC) path.,0022000184
Q4,00:18.6,Foul: Offensive,George Hill,Zach LaVine,CNC,http://official.nba.com/last-two-minute-report/?gameNo=0022000184&eventNum=2138,Hill (OKC) places his arm slightly away from his body and does not deliver any contact as he establishes himself in a picking position in LaVine's (CHI) path.,0022000184
Q4,00:16.4,Foul: Shooting,Coby White,Shai Gilgeous-Alexander,CC,http://official.nba.com/last-two-minute-report/?gameNo=0022000184&eventNum=2139,White (CHI) makes contact with Gilgeous-Alexander's (OKC) body during his driving shot attempt. ,0022000184
Q4,00:02.1,Foul: Shooting,Darius Bazley,Zach LaVine,CNC,http://official.nba.com/last-two-minute-report/?gameNo=0022000184&eventNum=2140,Bazley (OKC) legally contests LaVine's (CHI) jump shot attempt.,0022000184
Q5,01:52.2,Foul: Offensive,Wendell Carter Jr.,Shai Gilgeous-Alexander,CNC,http://official.nba.com/last-two-minute-report/?gameNo=0022000184&eventNum=2162,Carter Jr. (CHI) establishes himself in a legal screening position in Gilgeous-Alexander's (OKC) path. ,0022000184
Q5,01:51.8,Foul: Offensive,Lauri Markkanen,Shai Gilgeous-Alexander,CNC,http://official.nba.com/last-two-minute-report/?gameNo=0022000184&eventNum=2163,"As the screen concludes, Markkanen (CHI) makes marginal contact with Gilgeous-Alexander (OKC) as they move in the same path. ",0022000184
Q5,01:50.3,Foul: Offensive,Wendell Carter Jr.,Kenrich Williams,CNC,http://official.nba.com/last-two-minute-report/?gameNo=0022000184&eventNum=2141,Carter Jr. (CHI) establishes himself in a legal picking position in Williams' (OKC) path. ,0022000184
Q5,01:49.5,Foul: Shooting,Kenrich Williams,Coby White,CNC,http://official.nba.com/last-two-minute-report/?gameNo=0022000184&eventNum=2142,Williams (OKC) legally contests White's (CHI) jump shot attempt.,0022000184
Q5,01:39.5,Foul: Personal,Zach LaVine,Mike Muscala,CC,http://official.nba.com/last-two-minute-report/?gameNo=0022000184&eventNum=2143,LaVine (CHI) wraps Muscala (OKC) during the pick and affects his FOM. ,0022000184
Q5,01:34.2,Foul: Shooting,Zach LaVine,Mike Muscala,CNC,http://official.nba.com/last-two-minute-report/?gameNo=0022000184&eventNum=2144,"LaVine (CHI) makes incidental ""high-five"" contact with Muscala (OKC) after the release that does not affect his jump shot attempt.",0022000184
Q5,01:30.0,Foul: Personal,Luguentz Dort,Coby White,CNC,http://official.nba.com/last-two-minute-report/?gameNo=0022000184&eventNum=2145,Dort (OKC) maintains a legal guarding position during White's (CHI) drive. ,0022000184
Q5,01:13.1,Foul: Shooting,Kenrich Williams,Lauri Markkanen,CNC,http://official.nba.com/last-two-minute-report/?gameNo=0022000184&eventNum=2146,Williams (OKC) legally contests Markkanen's (CHI) jump shot attempt.,0022000184
Q5,00:57.2,Foul: Offensive,Mike Muscala,Zach LaVine,CNC,http://official.nba.com/last-two-minute-report/?gameNo=0022000184&eventNum=2147,Muscala (OKC) establishes himself in a legal picking position in LaVine's (CHI) path.,0022000184
Q5,00:53.8,Foul: Shooting,Wendell Carter Jr.,Mike Muscala,CNC,http://official.nba.com/last-two-minute-report/?gameNo=0022000184&eventNum=2148,Carter Jr. (CHI) legally contests Muscala's (OKC) jump shot attempt.,0022000184
Q5,00:45.5,Foul: Offensive,Otto Porter Jr.,Luguentz Dort,CNC,http://official.nba.com/last-two-minute-report/?gameNo=0022000184&eventNum=2149,Porter Jr. (CHI) makes marginal contact with Dort (OKC) during the pick. ,0022000184
Q5,00:42.9,Foul: Shooting,Shai Gilgeous-Alexander,Otto Porter Jr.,CNC,http://official.nba.com/last-two-minute-report/?gameNo=0022000184&eventNum=2150,Gilgeous-Alexander (OKC) legally contests Porter Jr.'s (CHI) jump shot attempt.,0022000184
Q5,00:40.1,Foul: Loose Ball,Wendell Carter Jr.,Mike Muscala,CNC,http://official.nba.com/last-two-minute-report/?gameNo=0022000184&eventNum=2151,Carter Jr. (CHI) makes marginal contact with Muscala (OKC) during the rebound. ,0022000184
Q5,00:21.8,Foul: Offensive,George Hill,Zach LaVine,CNC,http://official.nba.com/last-two-minute-report/?gameNo=0022000184&eventNum=2152,Hill (OKC) places his arm slightly away from his body and does not deliver any contact as he establishes himself in a picking position in LaVine's (CHI) path.,0022000184
Q5,00:21.2,Foul: Offensive,Kenrich Williams,Zach LaVine,CNC,http://official.nba.com/last-two-minute-report/?gameNo=0022000184&eventNum=2153,Williams (OKC) establishes himself in a legal picking position in LaVine's (CHI) path,0022000184
Q5,00:16.8,Foul: Shooting,Zach LaVine,Shai Gilgeous-Alexander,CNC,http://official.nba.com/last-two-minute-report/?gameNo=0022000184&eventNum=2154,LaVine (CHI) legally contests Gilgeous-Alexander's (OKC) jump shot attempt.,0022000184
Q5,00:14.7,Turnover: 24 Second Violation,Thunder,Bulls,CC,http://official.nba.com/last-two-minute-report/?gameNo=0022000184&eventNum=2155,Gilgeous-Alexander's (OKC) jump shot attempt does not make contact with the rim resulting in a correctly administered shot clock violation. ,0022000184
Q5,00:13.5,Foul: Personal,George Hill,Coby White,CC,http://official.nba.com/last-two-minute-report/?gameNo=0022000184&eventNum=2156,Hill (OKC) commits a take foul on White (CHI).,0022000184
Q5,00:07.6,Foul: Shooting,Luguentz Dort,Zach LaVine,CNC,http://official.nba.com/last-two-minute-report/?gameNo=0022000184&eventNum=2157,Dort (OKC) legally contests LaVine's (CHI) jump shot attempt.,0022000184
Q5,00:05.2,Foul: Personal,Coby White,George Hill,CC,http://official.nba.com/last-two-minute-report/?gameNo=0022000184&eventNum=2158,White (CHI) commits a take foul on Hill (OKC).,0022000184
Q5,00:01.0,Foul: Shooting,Luguentz Dort,Zach LaVine,CNC,http://official.nba.com/last-two-minute-report/?gameNo=0022000184&eventNum=2159,Dort (OKC) legally contests LaVine's (CHI) jump shot attempt.,0022000184
Q4,01:59.5,Foul: Offensive,Bismack Biyombo,OG Anunoby,CNC,http://official.nba.com/last-two-minute-report/?gameNo=0022000191&eventNum=2167,Biyombo (CHA) establishes a legal guarding position on Anunoby (TOR) and does not move into his path to impede him.,0022000191
Q4,01:59.2,Foul: Shooting,Pascal Siakam,Devonte' Graham,CNC,http://official.nba.com/last-two-minute-report/?gameNo=0022000191&eventNum=2154,Siakam (TOR) maintains a legal guarding position during the driving shot attempt by Graham (CHA) and absorbs the contact.,0022000191
Q4,01:44.9,Foul: Offensive,Chris Boucher,Terry Rozier,CNC,http://official.nba.com/last-two-minute-report/?gameNo=0022000191&eventNum=2168,Boucher (TOR) sets the screen in Rozier's (CHA) path and gives him room to avoid the contact.,0022000191
Q4,01:41.5,Foul: Shooting,P.J. Washington,Chris Boucher,CC,http://official.nba.com/last-two-minute-report/?gameNo=0022000191&eventNum=2155,Washington (CHA) jumps from A to B into Boucher's (TOR) body and affects his shot attempt.,0022000191
Q4,01:08.6,Foul: Offensive,Fred VanVleet,Devonte' Graham,CNC,http://official.nba.com/last-two-minute-report/?gameNo=0022000191&eventNum=2156,VanVleet (TOR) sets the screen on Graham (CHA) and does not deliver contact.,0022000191
Q4,01:07.0,Foul: Shooting,Terry Rozier,Kyle Lowry,CC,http://official.nba.com/last-two-minute-report/?gameNo=0022000191&eventNum=2157,Rozier (CHA) moves laterally into Lowry's (TOR) path and initiates contact that affects his shot attempt.,0022000191
Q4,00:29.0,Foul: Personal,Pascal Siakam,Devonte' Graham,CC,http://official.nba.com/last-two-minute-report/?gameNo=0022000191&eventNum=2158,Siakam (TOR) extends his forearm into Graham's (CHA) chest and initiates contact that affects his SQBR. ,0022000191
Q4,00:24.8,Foul: Offensive,Gordon Hayward,Kyle Lowry,CNC,http://official.nba.com/last-two-minute-report/?gameNo=0022000191&eventNum=2159,Hawyward (CHA) sets the screen on Lowry (TOR) and gives him room to avoid the contact.,0022000191
Q4,00:22.5,Foul: Personal,Kyle Lowry,Gordon Hayward,CNC,http://official.nba.com/last-two-minute-report/?gameNo=0022000191&eventNum=2169,Lowry (TOR) makes marginal contact with Hayward (CHA) as he establishes a post position. Hayward's momentum is moving in the direction of the contact when it occurs.,0022000191
Q4,00:20.1,Turnover: Traveling,Devonte' Graham,Raptors,CNC,http://official.nba.com/last-two-minute-report/?gameNo=0022000191&eventNum=2160,Graham (CHA) gathers the ball and takes two steps before fumbling the ball. He gathers the fumble and does not move his pivot foot before shooting.,0022000191
Q4,00:18,Foul: Personal,Stanley Johnson,Devonte' Graham,CNC,http://official.nba.com/last-two-minute-report/?gameNo=0022000191&eventNum=2170,Johnson (TOR) makes marginal contact with Graham (CHA) at the start of his drive.,0022000191
Q4,00:15.6,Foul: Shooting,Stanley Johnson,Devonte' Graham,CNC,http://official.nba.com/last-two-minute-report/?gameNo=0022000191&eventNum=2161,Johnson (TOR) legally contests Graham's (CHA) jump shot attempt.,0022000191
Q4,00:14.2,Turnover: 24 Second Violation,Hornets,Raptors,CC,http://official.nba.com/last-two-minute-report/?gameNo=0022000191&eventNum=2162,Correctly called 24 second violation.,0022000191
Q4,00:13.3,Foul: Personal,Terry Rozier,Fred VanVleet,CC,http://official.nba.com/last-two-minute-report/?gameNo=0022000191&eventNum=2163,Rozier (CHA) commits a take foul on VanVleet (TOR).,0022000191
Q4,00:07,Foul: Personal,LaMelo Ball,Pascal Siakam,CNC,http://official.nba.com/last-two-minute-report/?gameNo=0022000191&eventNum=2171,Ball (CHA) makes marginal contact with Siakam (TOR) as he makes the pass.,0022000191
