Period,Time,Call Type,Committing Player,Disadvantaged Player,Review Decision,Video,Comment,game_id
Q4,01:58.5,Foul: Offensive,Daniel Theis,Jrue Holiday,CNC,http://official.nba.com/last-two-minute-report/?gameNo=0022000003&eventNum=2087,Theis (BOS) sets the screen on Holiday (MIL) and absorbs the contact.,0022000003
Q4,01:54.1,Foul: Personal,Jrue Holiday,Daniel Theis,CNC,http://official.nba.com/last-two-minute-report/?gameNo=0022000003&eventNum=2100,Holiday (MIL) and Theis (BOS) engage and disengage with one another after Theis begins rolling toward the lane. ,0022000003
Q4,01:44.9,Foul: Offensive,Pat Connaughton,Marcus Smart,CNC,http://official.nba.com/last-two-minute-report/?gameNo=0022000003&eventNum=2088,Connaughton (MIL) firms up in his screening position in Smart's (BOS) path and absorbs the contact by collapsing his arms. Smart's reaction is not consistent with the amount of contact.,0022000003
Q4,01:42,Foul: Offensive,Giannis Antetokounmpo,Daniel Theis,CNC,http://official.nba.com/last-two-minute-report/?gameNo=0022000003&eventNum=2101,"Antetokounmpo (MIL) goes to, not through, Theis' (BOS) space and spins off of the contact made inside the lane. ",0022000003
Q4,01:41.8,Foul: Shooting,Daniel Theis,Giannis Antetokounmpo,CNC,http://official.nba.com/last-two-minute-report/?gameNo=0022000003&eventNum=2089,"As Theis (BOS) falls to the floor, he makes marginal contact with Antetokounmpo (MIL).",0022000003
Q4,01:35,Foul: Personal,Khris Middleton,Jaylen Brown,CNC,http://official.nba.com/last-two-minute-report/?gameNo=0022000003&eventNum=2102,Middleton's (MIL) arm is extended slightly forward and marginal contact occurs with Brown's (BOS) left arm as he makes the pass.,0022000003
Q4,01:26.1,Foul: Defense 3 Second,Giannis Antetokounmpo,Bucks,INC,http://official.nba.com/last-two-minute-report/?gameNo=0022000003&eventNum=2090,Antetokounmpo (MIL) is in the lane for longer than three seconds without actively guarding an opponent.,0022000003
Q4,01:26.1,Foul: Shooting,Pat Connaughton,Jayson Tatum,CNC,http://official.nba.com/last-two-minute-report/?gameNo=0022000003&eventNum=2090,Connaughton (MIL) legally contests the shot attempt by Tatum (BOS).,0022000003
Q4,01:17,Foul: Personal,Jaylen Brown,Giannis Antetokounmpo,CNC,http://official.nba.com/last-two-minute-report/?gameNo=0022000003&eventNum=2103,Brown (BOS) and Antetokounmpo (MIL) engage and disengage with one another following the pick.,0022000003
Q4,00:58.4,Foul: Shooting,Giannis Antetokounmpo,Jayson Tatum,CNC,http://official.nba.com/last-two-minute-report/?gameNo=0022000003&eventNum=2091,Antetokounmpo (MIL) places his left arm against Tatum (BOS) during his driving shot attempt but the contact is marginal.,0022000003
Q4,00:53.8,Foul: Shooting,Jeff Teague,Donte DiVincenzo,CNC,http://official.nba.com/last-two-minute-report/?gameNo=0022000003&eventNum=2092,Teague (BOS) makes contact with the ball and the part of DiVincenzo's (MIL) hand that is on the ball during the driving shot attempt. ,0022000003
Q4,00:52.7,Foul: Personal,Khris Middleton,Daniel Theis,CNC,http://official.nba.com/last-two-minute-report/?gameNo=0022000003&eventNum=2104,Middleton (MIL) briefly has his arms around Theis' (BOS) upper half before correcting.,0022000003
Q4,00:52.7,Foul: Offensive,Daniel Theis,Khris Middleton,CNC,http://official.nba.com/last-two-minute-report/?gameNo=0022000003&eventNum=2104,Theis (BOS) makes marginal contact with Middleton (MIL) during the screen.,0022000003
Q4,00:50.3,Foul: Offensive,Daniel Theis,Khris Middleton,CNC,http://official.nba.com/last-two-minute-report/?gameNo=0022000003&eventNum=2093,Theis (BOS) firms up in his screening position in Middleton's (MIL) path and absorbs the contact.,0022000003
Q4,00:28.4,Foul: Offensive,Brook Lopez,Jaylen Brown,CNC,http://official.nba.com/last-two-minute-report/?gameNo=0022000003&eventNum=2094,Lopez (MIL) establishes himself in a screening position in Brown's (BOS) path and does not deliver the contact. ,0022000003
Q4,00:13.5,Foul: Offensive,Daniel Theis,Khris Middleton,CNC,http://official.nba.com/last-two-minute-report/?gameNo=0022000003&eventNum=2095,Theis (BOS) establishes himself in a screening position in Middleton's (MIL) path and does not deliver the contact. ,0022000003
Q4,00:08.9,Foul: Personal,Giannis Antetokounmpo,Jaylen Brown,CC,http://official.nba.com/last-two-minute-report/?gameNo=0022000003&eventNum=2096,Antetokounmpo (MIL) extends into Brown's (BOS) path as Brown attempts to avoid the contact. ,0022000003
Q4,00:08.8,Foul: Offensive,Daniel Theis,Khris Middleton,CNC,http://official.nba.com/last-two-minute-report/?gameNo=0022000003&eventNum=2097,Theis (BOS) establishes himself in a screening position in Middleton's (MIL) path and does not deliver the contact.,0022000003
Q4,00:00.4,Violation: Lane,Celtics,Bucks,INC,http://official.nba.com/last-two-minute-report/?gameNo=0022000003&eventNum=2098,Theis (BOS) steps into the lane before Antetokounmpo (MIL) releases the free throw.,0022000003
Q4,00:00.0,Foul: Loose Ball,Tristan Thompson,Giannis Antetokounmpo,IC,http://official.nba.com/last-two-minute-report/?gameNo=0022000003&eventNum=2099,"Thompson (BOS) and Antetokounmpo (MIL) both make a legal attempt to reach the inbound pass, and the contact should have been deemed incidental.  Referees reviewed the call in instant replay as per the automatic trigger for fouls called at when there is no time remaining on the clock at the end of any period to confirm that the foul was called before the expiration of time, but the foul itself is not a reviewable matter.",0022000003
Q4,01:56.2,Foul: Shooting,Cameron Johnson,Luka Doncic,CC,http://official.nba.com/last-two-minute-report/?gameNo=0022000004&eventNum=2155,Johnson (PHX) makes contact to Doncic's (DAL) arm that affects his driving shot attempt.,0022000004
Q4,01:49.7,Foul: Offensive,Devin Booker,Maxi Kleber,CNC,http://official.nba.com/last-two-minute-report/?gameNo=0022000004&eventNum=2156,Booker (PHX) establishes himself in a legal screening position in Kleber's (DAL) path and he absorbs the oncoming contact.,0022000004
Q4,01:44.9,Foul: Shooting,Josh Richardson,Devin Booker,CC,http://official.nba.com/last-two-minute-report/?gameNo=0022000004&eventNum=2157,Richardson (DAL) makes contact to Booker's (PHX) arm that affects his driving shot attempt. ,0022000004
Q4,01:21.1,Foul: Shooting,Maxi Kleber,Chris Paul,CNC,http://official.nba.com/last-two-minute-report/?gameNo=0022000004&eventNum=2158,"Kleber (DAL) makes incidental ""high-five"" contact with Paul (PHX) after the ball is released during his jump shot attempt.",0022000004
Q4,00:40.2,Turnover: Traveling,Luka Doncic,Suns,INC,http://official.nba.com/last-two-minute-report/?gameNo=0022000004&eventNum=2159,Doncic (DAL) splits his feet at the start of his dribble.,0022000004
Q4,00:18.5,Foul: Offensive,Deandre Ayton,Tim Hardaway Jr.,CNC,http://official.nba.com/last-two-minute-report/?gameNo=0022000004&eventNum=2160,Ayton (PHX) establishes himself in a legal position in Hardaway Jr.'s (DAL) path and he absorbs the oncoming contact during the pick.,0022000004
Q4,00:12.2,Foul: Shooting,Maxi Kleber,Devin Booker,CNC,http://official.nba.com/last-two-minute-report/?gameNo=0022000004&eventNum=2161,Kleber (DAL) maintains a legal guarding position during Booker's (PHX) jump shot attempt.,0022000004
Q4,00:07.5,Foul: Personal,Maxi Kleber,Devin Booker,CC,http://official.nba.com/last-two-minute-report/?gameNo=0022000004&eventNum=2162,Kleber (DAL) commits a take foul on Booker (PHX).,0022000004
Q4,01:50,Foul: Personal,Duncan Robinson,Evan Fournier,CNC,http://official.nba.com/last-two-minute-report/?gameNo=0022000012&eventNum=2191,Robinson (MIA) places a collapsed arm to Fournier's (ORL) side defending his drive to the basket.,0022000012
Q4,01:46.0,Foul: Shooting,Duncan Robinson,Markelle Fultz,CNC,http://official.nba.com/last-two-minute-report/?gameNo=0022000012&eventNum=2192,Robinson (MIA) jumps vertically when he defends Fultz's (ORL) play at the basket.,0022000012
Q4,01:34,Foul: Personal,Nikola Vucevic,Goran Dragic,CNC,http://official.nba.com/last-two-minute-report/?gameNo=0022000012&eventNum=2193,Vucevic (ORL) reaches in and makes marginal contact with Dragic (MIA) that does not affect his SQBR.,0022000012
Q4,01:24.5,Foul: Shooting,Evan Fournier,Bam Adebayo,CC,http://official.nba.com/last-two-minute-report/?gameNo=0022000012&eventNum=2194,Fournier (ORL) makes contact to Adebayo's (MIA) body during his shooting motion that affects his shot attempt.,0022000012
Q4,01:11.4,Foul: Shooting,Goran Dragic,Markelle Fultz,CC,http://official.nba.com/last-two-minute-report/?gameNo=0022000012&eventNum=2195,Dragic (MIA) makes contact with Fultz's (ORL) arm that affects his driving shot attempt.,0022000012
Q4,01:11.4,Foul: Personal,Aaron Gordon,Goran Dragic,CNC,http://official.nba.com/last-two-minute-report/?gameNo=0022000012&eventNum=2196,Gordon (ORL) places an arm to Dragic's (MIA) front during his drive to the basket and the contact is marginal.,0022000012
Q4,01:08.0,Foul: Offensive,Jimmy Butler,Markelle Fultz,CNC,http://official.nba.com/last-two-minute-report/?gameNo=0022000012&eventNum=2197,Butler (MIA) establishes legal screening position in Fultz's (ORL) path during the pick and does not deliver contact. ,0022000012
Q4,00:57.1,Foul: Personal,Goran Dragic,Markelle Fultz,CNC,http://official.nba.com/last-two-minute-report/?gameNo=0022000012&eventNum=2207,"Dragic (MIA) moves laterally towards Fultz (ORL), who spins away from contact and does not dislodge Dragic from his defensive position.",0022000012
Q4,00:52.0,Foul: Personal,Andre Iguodala,Nikola Vucevic,CNC,http://official.nba.com/last-two-minute-report/?gameNo=0022000012&eventNum=2198,Iguodala (MIA) engages with Vucevic (ORL) off ball and does not affect his ability to get to the pass.,0022000012
Q4,00:49.5,Foul: Shooting,Andre Iguodala,Evan Fournier,CC,http://official.nba.com/last-two-minute-report/?gameNo=0022000012&eventNum=2199,Iguodala (MIA) makes contact to Fournier's (ORL) body that affects his play at the basket.,0022000012
Q4,00:43.8,Foul: Shooting,Nikola Vucevic,Goran Dragic,CNC,http://official.nba.com/last-two-minute-report/?gameNo=0022000012&eventNum=2200,Vucevic (ORl) legally contests Dragic's (MIA) driving shot attempt.,0022000012
Q4,00:36,Foul: Personal,Goran Dragic,Markelle Fultz,CNC,http://official.nba.com/last-two-minute-report/?gameNo=0022000012&eventNum=2208,Dragic (MIA) makes marginal contact with Fultz (ORL) when he reaches in.,0022000012
Q4,00:33.2,Foul: Personal,Bam Adebayo,Markelle Fultz,CNC,http://official.nba.com/last-two-minute-report/?gameNo=0022000012&eventNum=2209,Adebayo (MIA) makes marginal contact with Fultz (ORL) as he makes the pass.,0022000012
Q4,00:28.5,Foul: Personal,Andre Iguodala,Terrence Ross,CC,http://official.nba.com/last-two-minute-report/?gameNo=0022000012&eventNum=2201,Iguodala (MIA) moves into Ross' (ORL) space and makes body contact that affects his SQBR.,0022000012
Q4,00:28.5,Foul: Offensive,Bam Adebayo,Aaron Gordon,CNC,http://official.nba.com/last-two-minute-report/?gameNo=0022000012&eventNum=2202,Adebayo (MIA) and Gordon (ORL) briefly engage and disengage during the inbound.,0022000012
Q4,00:18.7,Foul: Personal Take,Tyler Herro,Aaron Gordon,CC,http://official.nba.com/last-two-minute-report/?gameNo=0022000012&eventNum=2203,Herro (MIA) commits a take foul on Gordon (ORL). ,0022000012
Q4,00:13.0,Foul: Offensive,Bam Adebayo,Markelle Fultz,CNC,http://official.nba.com/last-two-minute-report/?gameNo=0022000012&eventNum=2205,Adebayo (MIA) establishes legal position in Fultz's (ORL) path during the pick and absorbs the contact. ,0022000012
Q4,00:12.2,Foul: Personal,Nikola Vucevic,Goran Dragic,CNC,http://official.nba.com/last-two-minute-report/?gameNo=0022000012&eventNum=2204,Vucevic (ORL) makes marginal contact with Dragic (MIA) as he drives to the basket.,0022000012
Q4,00:07.8,Foul: Personal Take,Goran Dragic,Evan Fournier,CC,http://official.nba.com/last-two-minute-report/?gameNo=0022000012&eventNum=2206,Dragic (MIA) commits a take foul on Fournier (ORL). ,0022000012
Q4,01:56,Turnover: Traveling,Ben Simmons,,INC,http://official.nba.com/last-two-minute-report/?gameNo=0022000013&eventNum=2345,Simmons (PHI) splits his feet on the perimeter.,0022000013
Q4,01:51.5,Foul: Personal,Russell Westbrook,Joel Embiid,CNC,http://official.nba.com/last-two-minute-report/?gameNo=0022000013&eventNum=2322,"At the end of the drive, Embiid (PHI) loses control of his dribble on the spin move and Westbrook (WAS) makes marginal contact to Embiid's off-ball hand.",0022000013
Q4,01:51.5,Turnover: Double Dribble,Joel Embiid,Wizards,CNC,http://official.nba.com/last-two-minute-report/?gameNo=0022000013&eventNum=2322,Embiid (PHI) loses control of the ball and does not restart his dribble as he attempts to regain control.,0022000013
Q4,01:44.3,Foul: Shooting,Thomas Bryant,Seth Curry,CNC,http://official.nba.com/last-two-minute-report/?gameNo=0022000013&eventNum=2323,Bryant (WAS) maintains a legal guarding position during the driving shot attempt by Curry (PHI).,0022000013
Q4,01:36.8,Foul: Offensive,Thomas Bryant,Shake Milton,CNC,http://official.nba.com/last-two-minute-report/?gameNo=0022000013&eventNum=2324,Bryant (WAS) establishes himself in a screening position in Milton's (PHI) path and gives him room to avoid the contact. ,0022000013
Q4,01:35.8,Foul: Personal,Shake Milton,Bradley Beal,CNC,http://official.nba.com/last-two-minute-report/?gameNo=0022000013&eventNum=2325,"As Beal (WAS) starts his dribble, Milton (PHI) has a legal resting hand on Beal (WAS) that he neither extends nor delivers contact with.",0022000013
Q4,01:28.8,Foul: Shooting,Joel Embiid,Thomas Bryant,CC,http://official.nba.com/last-two-minute-report/?gameNo=0022000013&eventNum=2326,Embiid (PHI) makes contact to Bryant's (WAS) arm that affects his play at the basket.,0022000013
Q4,01:28.8,Foul: Loose Ball,Isaac Bonga,Ben Simmons,CNC,http://official.nba.com/last-two-minute-report/?gameNo=0022000013&eventNum=2327,Bonga (WAS) does not extend his arm or deliver contact to Simmons' (PHI) back during the rebound.,0022000013
Q4,01:17.0,Foul: Offensive,Joel Embiid,Bradley Beal,CNC,http://official.nba.com/last-two-minute-report/?gameNo=0022000013&eventNum=2328,Embiid (PHI) establishes himself in a screening position in Beal's (WAS) path and gives him room to avoid the contact. ,0022000013
Q4,01:10.8,Foul: Shooting,Thomas Bryant,Joel Embiid,CNC,http://official.nba.com/last-two-minute-report/?gameNo=0022000013&eventNum=2329,Bryant (WAS) makes marginal contact with Embiid's (PHI) arm that does not affect his play at the basket.,0022000013
Q4,01:05.2,Foul: Offensive,Bradley Beal,Tobias Harris,CNC,http://official.nba.com/last-two-minute-report/?gameNo=0022000013&eventNum=2330,Beal (WAS) establishes himself in a screening position in Harris' (PHI) path and gives him room to avoid the contact. ,0022000013
Q4,01:04.8,Foul: Personal,Shake Milton,Thomas Bryant,CNC,http://official.nba.com/last-two-minute-report/?gameNo=0022000013&eventNum=2331,Milton (PHI) immediately slides his hand off Bryant's (WAS) waist as he engages on the screen and the contact does not affect Bryant's FOM. ,0022000013
Q4,01:00.6,Foul: Loose Ball,Isaac Bonga,Tobias Harris,CNC,http://official.nba.com/last-two-minute-report/?gameNo=0022000013&eventNum=2332,Bonga (WAS) makes clean ball contact to knock it away from Harris (PHI) during the rebound attempt. ,0022000013
Q4,00:59.2,Foul: Loose Ball,Tobias Harris,Thomas Bryant,CNC,http://official.nba.com/last-two-minute-report/?gameNo=0022000013&eventNum=2333,Harris (PHI) cleanly dislodges the ball away from Bryant (WAS) during the rebound. ,0022000013
Q4,00:42.2,Foul: Shooting,Isaac Bonga,Shake Milton,CC,http://official.nba.com/last-two-minute-report/?gameNo=0022000013&eventNum=2334,Bonga (WAS) makes contact to Milton's (PHI) body that affects his driving shot attempt.,0022000013
Q4,00:38.5,Foul: Offensive,Thomas Bryant,Shake Milton,CNC,http://official.nba.com/last-two-minute-report/?gameNo=0022000013&eventNum=2342,Bryant (WAS) establishes himself in a screening position in Milton's (PHI) path and gives him room to avoid the contact. ,0022000013
Q4,00:25.1,Foul: Offensive,Joel Embiid,Bradley Beal,CNC,http://official.nba.com/last-two-minute-report/?gameNo=0022000013&eventNum=2335,Embiid (PHI) establishes himself in a screening position in Beal's (WAS) path and gives him room to avoid the contact. ,0022000013
Q4,00:22.0,Foul: Shooting,Thomas Bryant,Ben Simmons,INC,http://official.nba.com/last-two-minute-report/?gameNo=0022000013&eventNum=2336,Bryant (WAS) jumps from point A to point B and makes contact with Simmons' (PHI) arm and body that affects his play at the basket.,0022000013
Q4,00:21.7,Foul: Offensive,Thomas Bryant,Matisse Thybulle,CNC,http://official.nba.com/last-two-minute-report/?gameNo=0022000013&eventNum=2337,Bryant (WAS) establishes himself in a screening position in Thybulle's (PHI) path and absorbs the contact. ,0022000013
Q4,00:21.7,Foul: Personal,Shake Milton,Russell Westbrook,CNC,http://official.nba.com/last-two-minute-report/?gameNo=0022000013&eventNum=2343,Milton (PHI) and Westbrook (WAS) engage and disengage during the inbound. ,0022000013
Q4,00:15.0,Foul: Personal,Russell Westbrook,Tobias Harris,CC,http://official.nba.com/last-two-minute-report/?gameNo=0022000013&eventNum=2338,Westbrook (WAS) commits a take foul on Harris (PHI).,0022000013
Q4,00:13.4,Foul: Personal,Matisse Thybulle,Bradley Beal,CC,http://official.nba.com/last-two-minute-report/?gameNo=0022000013&eventNum=2339,"Prior to Beal (WAS) receiving the pass, Thybulle (PHI) reaches around the screen to make contact with Beal that affects his FOM.",0022000013
Q4,00:12.7,Foul: Personal,Thomas Bryant,Seth Curry,CC,http://official.nba.com/last-two-minute-report/?gameNo=0022000013&eventNum=2340,Bryant (WAS) commits a take foul on Curry (PHI).,0022000013
Q4,00:08.9,Foul: Offensive,Thomas Bryant,Ben Simmons,CNC,http://official.nba.com/last-two-minute-report/?gameNo=0022000013&eventNum=2341,Bryant (WAS) establishes himself in a screening position in Simmons' (PHI) path and gives him room to avoid the contact. ,0022000013
Q4,00:08.1,Foul: Personal,Ben Simmons,Bradley Beal,CNC,http://official.nba.com/last-two-minute-report/?gameNo=0022000013&eventNum=2344,"Prior to the pass, Simmons (PHI) makes clean ball contact as he tries to dislodge the ball from Beal (WAS).",0022000013
Q4,01:56.8,Foul: Shooting,Victor Oladipo,Theo Maledon,CNC,http://official.nba.com/last-two-minute-report/?gameNo=0022000016&eventNum=2110,Oladipo (HOU) jumps alongside of Maledon's (OKC) path to the basket and marginal contact occurs during his driving shot attempt.,0022000016
Q4,01:48.5,Foul: Offensive,Jae'Sean Tate,Luguentz Dort,CNC,http://official.nba.com/last-two-minute-report/?gameNo=0022000016&eventNum=2111,Tate (HOU) sets the screen on Dort (OKC) and gives him room to avoid the contact.,0022000016
Q4,01:45.5,Foul: Personal,Aleksej Pokusevski,Danuel House Jr.,CNC,http://official.nba.com/last-two-minute-report/?gameNo=0022000016&eventNum=2112,House Jr. (HOU) drives along the baseline and marginal contact occurs with Pokusevski (OKC).  The contact does not affect House Jr.'s ability to make the pass.,0022000016
Q4,01:19.8,Turnover:  Out of Bounds - Bad Pass Turn,Ty Jerome,Victor Oladipo,CC,http://official.nba.com/last-two-minute-report/?gameNo=0022000016&eventNum=2113,Jerome (OKC) throws the pass out of bounds.,0022000016
Q4,01:09.8,Foul: Shooting,Ty Jerome,John Wall,CC,http://official.nba.com/last-two-minute-report/?gameNo=0022000016&eventNum=2114,Jerome (OKC) makes contact to Wall's (HOU) body that affects his driving shot attempt.,0022000016
Q4,00:47.7,Foul: Shooting,Jae'Sean Tate,Aleksej Pokusevski,CNC,http://official.nba.com/last-two-minute-report/?gameNo=0022000016&eventNum=2115,Tate (HOU) makes clean contact with the ball when he reaches in during the jump shot by Pokusevski (OKC).,0022000016
Q4,00:16.6,Foul: Loose Ball,Isaiah Roby,Victor Oladipo,CNC,http://official.nba.com/last-two-minute-report/?gameNo=0022000016&eventNum=2116,Roby (OKC) and Oladipo (HOU) both go for the rebound and marginal contact occurs as Oladipo taps the ball to Wood (HOU).,0022000016
Q4,00:09.3,Foul: Shooting,Luguentz Dort,John Wall,CNC,http://official.nba.com/last-two-minute-report/?gameNo=0022000016&eventNum=2117,Dort (OKC) maintains a legal guarding position and cleanly blocks the driving shot attempt by Wall (HOU).,0022000016
Q4,00:06.6,Foul: Personal,Jae'Sean Tate,Luguentz Dort,CNC,http://official.nba.com/last-two-minute-report/?gameNo=0022000016&eventNum=2119,Tate (HOU) engages with Dort (OKC) and marginal contact occurs during the inbound.  Dort's reaction is not consistent with the level of contact.,0022000016
Q4,00:05.3,Foul: Personal,Jae'Sean Tate,Aleksej Pokusevski,CC,http://official.nba.com/last-two-minute-report/?gameNo=0022000016&eventNum=2118,Tate (HOU) commits a take foul on Pokusevski (OKC).,0022000016
Q4,01:54.1,Foul: Offensive,Josh Jackson,Malik Beasley,CNC,http://official.nba.com/last-two-minute-report/?gameNo=0022000018&eventNum=2146,Jackson (DET) releases from contact with Beasley (MIN) during his drive to the basket.,0022000018
Q4,01:50,Foul: Personal,Karl-Anthony Towns,Josh Jackson,CNC,http://official.nba.com/last-two-minute-report/?gameNo=0022000018&eventNum=2156,Towns (MIN) makes marginal contact with Jackson (DET) during his pass underneath the basket.,0022000018
Q4,01:33.5,Foul: Personal,Mason Plumlee,Karl-Anthony Towns,CNC,http://official.nba.com/last-two-minute-report/?gameNo=0022000018&eventNum=2147,Plumlee (DET) makes marginal contact with Towns (MIN) defending his drive to the basket.,0022000018
Q4,01:21.2,Foul: Shooting,Karl-Anthony Towns,Josh Jackson,CNC,http://official.nba.com/last-two-minute-report/?gameNo=0022000018&eventNum=2148,"Towns (MIN) makes incidental ""high-five"" contact with Jackson (DET) after the release that does not affect his jump shot attempt.",0022000018
Q4,01:19.9,Foul: Loose Ball,Mason Plumlee,Josh Okogie,CNC,http://official.nba.com/last-two-minute-report/?gameNo=0022000018&eventNum=2149,Plumlee (DET) and Okogie (MIN) engage and disengage while rebounding. ,0022000018
Q4,01:08.8,Foul: Offensive,Ricky Rubio,Mason Plumlee,CNC,http://official.nba.com/last-two-minute-report/?gameNo=0022000018&eventNum=2150,Rubio (MIN) establishes legal position in Plumlee's (DET) path during the screen and absorbs contact.,0022000018
Q4,01:05.1,Foul: Shooting,Mason Plumlee,Karl-Anthony Towns,CC,http://official.nba.com/last-two-minute-report/?gameNo=0022000018&eventNum=2151,Towns (MIN) draws Plumlee (DET) into the air towards him and the contact results in a foul on Plumlee (DET) even if contact is initiated by Towns (MIN).,0022000018
Q4,00:58.8,Foul: Shooting,Ricky Rubio,Blake Griffin,CNC,http://official.nba.com/last-two-minute-report/?gameNo=0022000018&eventNum=2152,Rubio (MIN) makes incidental contact to Griffin's (DET) arm after the release of his jump shot attempt.,0022000018
Q4,00:40,Foul: Personal,Mason Plumlee,D'Angelo Russell,CNC,http://official.nba.com/last-two-minute-report/?gameNo=0022000018&eventNum=2157,Plumlee (DET) makes marinal contact with Russell (MIN) after he passes the ball.,0022000018
Q4,00:36.2,Foul: Shooting,Josh Jackson,Josh Okogie,CC,http://official.nba.com/last-two-minute-report/?gameNo=0022000018&eventNum=2153,Jackson (DET) makes contact to Okogie's (MIN) arm that affects his play at the basket.,0022000018
Q4,00:26.9,Foul: Shooting,Ricky Rubio,Jerami Grant,CNC,http://official.nba.com/last-two-minute-report/?gameNo=0022000018&eventNum=2154,"During his jump shot attempt, Grant (DET) initiates contact with Rubio (MIN), who is in a legal guarding position.",0022000018
Q4,00:00.2,Turnover: 24 Second Violation,Timberwolves,Pistons,CC,http://official.nba.com/last-two-minute-report/?gameNo=0022000018&eventNum=2155,A 24 second violation is correctly called.,0022000018
Q4,01:52.5,Turnover: Traveling,Harrison Barnes,Nuggets,INC,http://official.nba.com/last-two-minute-report/?gameNo=0022000019&eventNum=2099,Barnes (SAC) splits his pivot foot prior to the start of his drive. ,0022000019
Q4,01:49.3,Foul: Shooting,Nikola Jokic,Harrison Barnes,CC,http://official.nba.com/last-two-minute-report/?gameNo=0022000019&eventNum=2100,Jokic (DEN) makes contact to the body of Barnes (SAC) during his shooting motion that disrupts his driving shot attempt.,0022000019
Q4,01:36.0,Foul: Offensive,Jamal Murray,Hassan Whiteside,CC,http://official.nba.com/last-two-minute-report/?gameNo=0022000019&eventNum=2101,"Replay review of the foul called on Murray (DEN) pursuant to a coach?s challenge was deemed unsuccessful. Murray cups Whiteside's (SAC) side, who is making a legal attempt to block the shot, and there is no clear and conclusive evidence to overturn the call on the floor.",0022000019
Q4,01:24.4,Foul: Shooting,Paul Millsap,Hassan Whiteside,CC,http://official.nba.com/last-two-minute-report/?gameNo=0022000019&eventNum=2102,Millsap (DEN) makes contact to the arm of Whiteside (SAC) during his shooting motion that disrupts his play at the basket.,0022000019
Q4,00:29.3,Foul: Personal,Buddy Hield,Nikola Jokic,CC,http://official.nba.com/last-two-minute-report/?gameNo=0022000019&eventNum=2103,Hield (SAC) wraps the upper body of Jokic (DEN) while trying to defend around the screen being set. ,0022000019
Q4,00:28.7,Foul: Personal,Gary Harris,De'Aaron Fox,CNC,http://official.nba.com/last-two-minute-report/?gameNo=0022000019&eventNum=2115,Harris (DEN) makes marginal two hand contact to Fox's (SAC) body as he receives the inbound pass. ,0022000019
Q4,00:02.6,Foul: Offensive,Nikola Jokic,Cory Joseph,CC,http://official.nba.com/last-two-minute-report/?gameNo=0022000019&eventNum=2104,Jokic (DEN) uses both hands and pushes Joseph (SAC) while setting the pick. Disrupting his ability to defend. ,0022000019
