Period,Time,Call Type,Committing Player,Disadvantaged Player,Review Decision,Video,Comment,game_id
Q4,00:33.5,Foul: Shooting,Lauri Markkanen,Taurean Prince,CNC,http://official.nba.com/last-two-minute-report/?gameNo=0021800928&eventNum=2200,Markkanen (CHI) maintains a legal guarding position during the jump shot attempt by Prince (ATL).,0021800928
Q4,00:04.1,Foul: Shooting,Kris Dunn,Trae Young,CNC,http://official.nba.com/last-two-minute-report/?gameNo=0021800928&eventNum=2201,Dunn (CHI) gives Young (ATL) room to land on the jump shot attempt.,0021800928
Q4,00:00.4,Foul: Shooting,Dewayne Dedmon,Otto Porter Jr.,CC,http://official.nba.com/last-two-minute-report/?gameNo=0021800928&eventNum=2202,Dedmon (ATL) makes contact with Porter Jr.'s (WAS) arm that affects his ability to follow through naturally on his jump shot attempt.,0021800928
Q5,01:51.5,Foul: Shooting,Dewayne Dedmon,Zach LaVine,CC,http://official.nba.com/last-two-minute-report/?gameNo=0021800928&eventNum=2203,"LLS shows Dedmon (ATL) is outside of the restricted area, but he is late to the spot and fails to establish himself in a legal guarding position at the time of the contact with LaVine (CHI) during his driving shot attempt.",0021800928
Q5,01:01.9,Foul: Shooting,Alex Len,Lauri Markkanen,CNC,http://official.nba.com/last-two-minute-report/?gameNo=0021800928&eventNum=2204,Len (ATL) collapses his left arm to his body and absorbs the body contact from Markkanen (CHI) and cleanly blocks the driving shot attempt.,0021800928
Q5,01:01.4,Foul: Loose Ball,Otto Porter Jr.,Alex Len,CNC,http://official.nba.com/last-two-minute-report/?gameNo=0021800928&eventNum=2205,Porter Jr. (CHI) and Len (ATL) engage and disengage during the rebound.,0021800928
Q5,01:01.4,Foul: Loose Ball,Vince Carter,Otto Porter Jr.,CNC,http://official.nba.com/last-two-minute-report/?gameNo=0021800928&eventNum=2205,Carter (ATL) reaches in and makes marginal contact with Porter Jr.'s (CHI) arm that does not affect his ability to get the rebound.,0021800928
Q5,00:36.8,Foul: Personal,Vince Carter,Wayne Selden,CC,http://official.nba.com/last-two-minute-report/?gameNo=0021800928&eventNum=2206,Carter (ATL) commits a take foul on Selden (CHI).,0021800928
Q5,00:11.1,Foul: Defense 3 Second,Vince Carter,Bulls, ,http://official.nba.com/last-two-minute-report/?gameNo=0021800928&eventNum=2207,[Observable in enhanced video] Carter (ATL) stands with a foot on the lane line and is in the paint for longer than three seconds without actively guarding an opponent.,0021800928
Q5,00:11.1,Foul: Shooting,Alex Len,Zach LaVine,CNC,http://official.nba.com/last-two-minute-report/?gameNo=0021800928&eventNum=2207,Len (ATL) cleanly blocks LaVine's (CHI) jump shot attempt and makes slight contact to LaVine's head after the blocked shot.,0021800928
Q6,01:52.6,Turnover: Traveling,Trae Young,Bulls, ,http://official.nba.com/last-two-minute-report/?gameNo=0021800928&eventNum=2208,[Observable in enhanced video] Young (ATL) slides his pivot foot at the start of his dribble.,0021800928
Q6,01:48.8,Turnover: Traveling,Vince Carter,Bulls, ,http://official.nba.com/last-two-minute-report/?gameNo=0021800928&eventNum=2209,[Observable in enhanced video] Carter (ATL) slides his pivot foot at the start of his dribble.,0021800928
Q6,01:45.9,Foul: Shooting,Wayne Selden,Vince Carter,CNC,http://official.nba.com/last-two-minute-report/?gameNo=0021800928&eventNum=2210,Selden (CHI) makes incidental contact with Carter (ATL) after he has released his shot attempt that does not affect his ability to follow through naturally.,0021800928
Q6,01:35,Foul: Offensive,Zach LaVine,DeAndre' Bembry,CNC,http://official.nba.com/last-two-minute-report/?gameNo=0021800928&eventNum=2211,LaVine (CHI) extends his arm slightly but does not dislodge Bembry (ATL) from his defensive position.,0021800928
Q6,01:35,Foul: Personal,DeAndre' Bembry,Zach LaVine,CNC,http://official.nba.com/last-two-minute-report/?gameNo=0021800928&eventNum=2211,Bembry (ATL) maintains legal guarding position and makes incidental contact with LaVine (CHI) that does not affect his SQBR.,0021800928
Q6,01:32.5,Foul: Loose Ball,Taurean Prince,Otto Porter Jr.,CNC,http://official.nba.com/last-two-minute-report/?gameNo=0021800928&eventNum=2212,Prince (ATL) and Porter Jr. (CHI) engage and disengage during rebounding.,0021800928
Q6,01:14.2,Foul: Personal,Zach LaVine,Alex Len,CNC,http://official.nba.com/last-two-minute-report/?gameNo=0021800928&eventNum=2213,LaVine (CHI) places his hand momentarily on Len's (ATL) hip and immediately corrects.,0021800928
Q6,01:10,Foul: Personal,Lauri Markkanen,Trae Young,CNC,http://official.nba.com/last-two-minute-report/?gameNo=0021800928&eventNum=2214,Markkanen (CHI) maintains legal guarding position and makes incidental contact with Young (ATL) that does not affect his SQBR.,0021800928
Q6,01:07.1,Turnover: 3 Second Violation,Alex Len,Bulls,CNC,http://official.nba.com/last-two-minute-report/?gameNo=0021800928&eventNum=2215,Len (ATL) is in the lane and his shot attempt is imminent within three seconds.,0021800928
Q6,01:07.1,Foul: Shooting,Wayne Selden,Alex Len,CC,http://official.nba.com/last-two-minute-report/?gameNo=0021800928&eventNum=2215,RLS shows Selden (CHI) extends his arm into Len's (ATL) body and affects his shot near the rim.,0021800928
Q6,01:01.2,Foul: Shooting,DeAndre' Bembry,Zach LaVine,CNC,http://official.nba.com/last-two-minute-report/?gameNo=0021800928&eventNum=2216,"Bembry (ATL) legally contests LaVine's (CHI) jump shot attempt.  Any ""high-five"" contact after the release is considered incidental.",0021800928
Q6,00:43.9,Foul: Offensive,Alex Len,Zach LaVine,CNC,http://official.nba.com/last-two-minute-report/?gameNo=0021800928&eventNum=2217,Len (ATL) is already in LaVine's (CHI) path when contact occurs and he does not deliver contact.,0021800928
Q6,00:41.9,Foul: Personal,Lauri Markkanen,Trae Young,CNC,http://official.nba.com/last-two-minute-report/?gameNo=0021800928&eventNum=2218,Markkanen (CHI) makes marginal contact with Young (ATL) on the perimeter.,0021800928
Q6,00:35.2,Turnover: 3 Second Violation,Alex Len,Bulls,INC,http://official.nba.com/last-two-minute-report/?gameNo=0021800928&eventNum=2220,Len (ATL) is in the paint for longer than three seconds.,0021800928
Q6,00:35.2,Turnover:  Out of Bounds - Bad Pass Turn,Taurean Prince,Otto Porter Jr.,CC,http://official.nba.com/last-two-minute-report/?gameNo=0021800928&eventNum=2219,Correctly called out of bounds.,0021800928
Q6,00:16.7,Foul: Offensive,Vince Carter,Zach LaVine,CNC,http://official.nba.com/last-two-minute-report/?gameNo=0021800928&eventNum=2221,Carter (ATL) is already in LaVine's (CHI) path when contact occurs and he does not deliver contact.  He briefly grasps LaVine around the waist and immediately releases.,0021800928
Q6,00:15.4,Foul: Personal,Lauri Markkanen,Trae Young,CNC,http://official.nba.com/last-two-minute-report/?gameNo=0021800928&eventNum=2222,Markkanen (CHI) makes marginal contact with Young (ATL) that does not affect his ability to gather the ball.,0021800928
Q6,00:03.9,Foul: Personal,Taurean Prince,Ryan Arcidiacono,CC,http://official.nba.com/last-two-minute-report/?gameNo=0021800928&eventNum=2223,Prince (ATL) places a hand/arm to the front of Arcidiacono (CHI) on the drive and the contact affects his SQBR.,0021800928
Q6,00:01.1,Foul: Shooting,Alex Len,Otto Porter Jr.,INC,http://official.nba.com/last-two-minute-report/?gameNo=0021800928&eventNum=2224,LAR and RLB show Len (ATL) jumps from point A to point B into the body of Porter Jr. (CHI) and the contact affects his shot attempt.,0021800928
Q7,01:45,Foul: Offensive,Alex Len,Shaquille Harrison,CNC,http://official.nba.com/last-two-minute-report/?gameNo=0021800928&eventNum=2225,Len (ATL) establishes himself in a screening position in the path of Harrison (CHI) and does not deliver contact.,0021800928
Q7,01:32.8,Foul: Shooting,Alex Len,Zach LaVine,CC,http://official.nba.com/last-two-minute-report/?gameNo=0021800928&eventNum=2226,Len (ATL) makes contact to the arm of LaVine (CHI) during his shooting motion that affects his driving shot attempt.,0021800928
Q7,01:23.8,Foul: Offensive,Alex Len,Otto Porter Jr.,CNC,http://official.nba.com/last-two-minute-report/?gameNo=0021800928&eventNum=2227,Len (ATL) establishes himself in a screening position in the path of Porter Jr. (CHI) and does not deliver contact.,0021800928
Q7,01:07.2,Foul: Offensive,Zach LaVine,Alex Len,CNC,http://official.nba.com/last-two-minute-report/?gameNo=0021800928&eventNum=2228,LaVine (CHI) slightly extends his arm and initiates contact with Len (ATL) during his driving shot attempt but the marginal contact does not affect his ability to defend.,0021800928
Q7,00:54.4,Foul: Defense 3 Second,Robin Lopez,Hawks,CNC,http://official.nba.com/last-two-minute-report/?gameNo=0021800928&eventNum=2229,Lopez (CHI) is in the paint for less than three seconds when he is imminently actively guarding an opponent.,0021800928
Q7,00:50.4,Turnover: Stepped out of Bounds,Zach LaVine,DeAndre' Bembry,CC,http://official.nba.com/last-two-minute-report/?gameNo=0021800928&eventNum=2230,"After gathering the rebound, LaVine (CHI) steps out of bounds.",0021800928
Q7,00:36.5,Foul: Defense 3 Second,Robin Lopez,Hawks,CNC,http://official.nba.com/last-two-minute-report/?gameNo=0021800928&eventNum=2231,Lopez (CHI) is in the paint for less than three seconds when he is imminently actively guarding an opponent.,0021800928
Q7,00:30.2,Turnover: Traveling,DeAndre' Bembry,Lauri Markkanen,CC,http://official.nba.com/last-two-minute-report/?gameNo=0021800928&eventNum=2232,Bembry (ATL) lifts his pivot foot after receiving the pass.,0021800928
Q7,00:08.0,Foul: Shooting,Justin Anderson,Zach LaVine,CNC,http://official.nba.com/last-two-minute-report/?gameNo=0021800928&eventNum=2233,Anderson (ATL) maintains a legal guarding position during the jump shot attempt by LaVine (CHI).,0021800928
Q7,00:06,Foul: Personal,Shaquille Harrison,Trae Young,CNC,http://official.nba.com/last-two-minute-report/?gameNo=0021800928&eventNum=2234,Harrison (CHI) reaches in and cleanly dislodges the ball from Young (ATL) during the drive.,0021800928
Q7,00:05.8,Turnover: 24 Second Violation,Bulls,Hawks,CC,http://official.nba.com/last-two-minute-report/?gameNo=0021800928&eventNum=2235,Correctly called 24 second violation.,0021800928
Q7,00:03.7,Turnover: Stepped out of Bounds,Trae Young,Shaquille Harrison,CC,http://official.nba.com/last-two-minute-report/?gameNo=0021800928&eventNum=2236,"After regaining possession of the ball during his drive, Young (ATL) steps out of bounds.",0021800928
Q7,00:01.1,Foul: Offensive,Zach LaVine,Vince Carter,CC,http://official.nba.com/last-two-minute-report/?gameNo=0021800928&eventNum=2237,Carter (ATL) establishes himself in a legal guarding position in LaVine's (CHI) path and LaVine drives through his space.,0021800928
Q8,01:59.3,Foul: Shooting,Alex Len,Lauri Markkanen,CC,http://official.nba.com/last-two-minute-report/?gameNo=0021800928&eventNum=2238,Len (ATL) does not give Markkanen (CHI) room to land on the jump shot attempt.,0021800928
Q8,01:45.3,Foul: Shooting,Robin Lopez,DeAndre' Bembry,CNC,http://official.nba.com/last-two-minute-report/?gameNo=0021800928&eventNum=2239,Lopez (CHI) maintains a legal guarding position during the driving shot attempt by Bembry (ATL).,0021800928
Q8,01:43.0,Violation: Kicked Ball,Alex Len,Bulls,CC,http://official.nba.com/last-two-minute-report/?gameNo=0021800928&eventNum=2240,Len (ATL) intentionally kicks the ball.,0021800928
Q8,01:35.6,Foul: Offensive,Robin Lopez,Kent Bazemore,CNC,http://official.nba.com/last-two-minute-report/?gameNo=0021800928&eventNum=2241,Lopez (CHI) establishes himself in a screening position in the path of Bazemore (ATL) and has his arm slightly extended but he does not deliver contact.,0021800928
Q8,01:33.2,Foul: Shooting,Alex Len,Otto Porter Jr.,INC,http://official.nba.com/last-two-minute-report/?gameNo=0021800928&eventNum=2242,RLB shows Len (ATL) jumps from point A to point B into the body of Porter Jr. (CHI) and the contact affects his shot attempt.,0021800928
Q8,01:26,Foul: Offensive,Trae Young,Ryan Arcidiacono,CNC,http://official.nba.com/last-two-minute-report/?gameNo=0021800928&eventNum=2243,Young (ATL) initiates some contact with Arcidiacono (CHI) during the drive but the contact is marginal and Arcidiacono's momentum carries him backwards.,0021800928
Q8,01:15.1,Foul: Personal,Alex Len,Otto Porter Jr.,CNC,http://official.nba.com/last-two-minute-report/?gameNo=0021800928&eventNum=2244,Len (ATL) makes marginal contact with Porter Jr. (WAS) as he splits the defenders.,0021800928
Q8,01:10.7,Foul: Shooting,Alex Len,Otto Porter Jr.,CNC,http://official.nba.com/last-two-minute-report/?gameNo=0021800928&eventNum=2245,Len (ATL) makes incidental contact to the arm of Porter Jr. (CHI) after the release that does not affect his jump shot attempt.,0021800928
Q8,01:08.8,Foul: Loose Ball,Robin Lopez,Vince Carter,CNC,http://official.nba.com/last-two-minute-report/?gameNo=0021800928&eventNum=2246,"Lopez (CHI) makes inadvertent contact with Carter's (ATL) head/face during the rebound. Contact to an opponent's head/face can be deemed marginal when the result of a natural basketball move, provided the contact is not disproportionate or uncontrolled.",0021800928
Q8,00:40.2,Foul: Offensive,Robin Lopez,Vince Carter,CNC,http://official.nba.com/last-two-minute-report/?gameNo=0021800928&eventNum=2247,Lopez (CHI) establishes himself in a screening position in the path of Carter (ATL) and does not deliver contact.,0021800928
Q8,00:38.2,Foul: Shooting,Kent Bazemore,Zach LaVine,CNC,http://official.nba.com/last-two-minute-report/?gameNo=0021800928&eventNum=2248,Bazemore (ATL) makes marginal contact with LaVine (CHI) that does not affect his driving shot attempt.,0021800928
Q8,00:35.7,Foul: Offensive,Alex Len,Otto Porter Jr.,CNC,http://official.nba.com/last-two-minute-report/?gameNo=0021800928&eventNum=2249,Len (ATL) establishes himself in a screening position in the path of Porter Jr. (CHI) and delivers some contact.,0021800928
Q8,00:33.5,Foul: Shooting,Otto Porter Jr.,Kent Bazemore,CNC,http://official.nba.com/last-two-minute-report/?gameNo=0021800928&eventNum=2250,Porter Jr. (CHI) maintains a legal guarding position during the jump shot attempt by Bazemore (ATL).,0021800928
Q8,00:31.1,Foul: Loose Ball,Robin Lopez,Alex Len,CNC,http://official.nba.com/last-two-minute-report/?gameNo=0021800928&eventNum=2251,Lopez (CHI) and Len (ATL) engage and disengage during the rebound.,0021800928
Q8,00:16.6,Foul: Personal,Kent Bazemore,Wayne Selden,IC,http://official.nba.com/last-two-minute-report/?gameNo=0021800928&eventNum=2252,LLB shows Bazemore (ATL) reaches in and makes clean contact with the ball as he defends Selden (CHI).,0021800928
Q8,00:14.9,Foul: Personal,Justin Anderson,Lauri Markkanen,CC,http://official.nba.com/last-two-minute-report/?gameNo=0021800928&eventNum=2253,Anderson (ATL) commits a take foul on Markkanen (CHI).,0021800928
Q4,01:58,Foul: Offensive,Jusuf Nurkic,Kyle Lowry,CNC,http://official.nba.com/last-two-minute-report/?gameNo=0021800930&eventNum=1068,Nurkic (POR) firms up and absorbs the contact from Lowry (TOR) during the pick.,0021800930
Q4,01:53.9,Foul: Loose Ball,Jusuf Nurkic,Pascal Siakam,INC,http://official.nba.com/last-two-minute-report/?gameNo=0021800930&eventNum=1069,"Nurkic (POR) puts his arm on the shoulder of Siakam (TOR), using him as leverage and affecting Siakam's ability to get the rebound.",0021800930
Q4,01:42.8,Foul: Personal,Maurice Harkless,Kawhi Leonard,CNC,http://official.nba.com/last-two-minute-report/?gameNo=0021800930&eventNum=1070,Harkless (POR) makes marginal contact with Leonard (TOR) prior to him cleanly stealing the pass.,0021800930
Q4,01:38.0,Violation: Lane,Marc Gasol,Trail Blazers, ,http://official.nba.com/last-two-minute-report/?gameNo=0021800930&eventNum=1071,[Observable in enhanced video] Gasol (TOR) enters the lane prior to the release of the free throw shot from Harkless (POR).,0021800930
Q4,01:32.9,Foul: Personal,Jake Layman,Kyle Lowry,CNC,http://official.nba.com/last-two-minute-report/?gameNo=0021800930&eventNum=1072,"Layman (POR) makes marginal contact to the arm of Lowry (TOR), but the contact does not affect his control of the ball during the start of his drive.",0021800930
Q4,01:32.9,Turnover: Traveling,Kyle Lowry,Trail Blazers, ,http://official.nba.com/last-two-minute-report/?gameNo=0021800930&eventNum=1072,[Observable in enhanced video] Lowry (TOR) lifts his pivot foot at the start of his dribble.,0021800930
Q4,01:20.8,Foul: Personal,Marc Gasol,Jake Layman,CNC,http://official.nba.com/last-two-minute-report/?gameNo=0021800930&eventNum=1073,Gasol (TOR) makes marginal contact to the arm of Layman (POR) at the end of his drive that does not affect his ability to pass.,0021800930
Q4,01:14.9,Turnover: 3 Second Violation,Jusuf Nurkic,Raptors,CNC,http://official.nba.com/last-two-minute-report/?gameNo=0021800930&eventNum=1074,Nurkic (POR) is imminently exiting the lane within three seconds.,0021800930
Q4,01:06.3,Foul: Offensive,Danny Green,CJ McCollum,CNC,http://official.nba.com/last-two-minute-report/?gameNo=0021800930&eventNum=1075,Green (TOR) slightly extends his arms towards McCollum (POR) when they disengage but the contact does not affect his ability to defend the play.,0021800930
Q4,00:46.9,Foul: Personal,Pascal Siakam,Jusuf Nurkic,CNC,http://official.nba.com/last-two-minute-report/?gameNo=0021800930&eventNum=1076,"Siakam (TOR) briefly grasps the arm of Nurkic (POR) during the pick, but the contact does not affect his SQBR.",0021800930
Q4,00:46.0,Foul: Personal,Pascal Siakam,Damian Lillard,CC,http://official.nba.com/last-two-minute-report/?gameNo=0021800930&eventNum=1077,Siakam (TOR) moves laterally into Lillard's (POR) path and makes body to body contact that causes him to fall to the floor.,0021800930
Q4,00:42.9,Foul: Offensive,Kyle Lowry,Maurice Harkless,CNC,http://official.nba.com/last-two-minute-report/?gameNo=0021800930&eventNum=1078,"Lowry (TOR) briefly places his arms to the body of Harkless (POR) during the pick, but does not affect his ability to defend.",0021800930
Q4,00:38.3,Foul: Personal,Maurice Harkless,Kyle Lowry,CNC,http://official.nba.com/last-two-minute-report/?gameNo=0021800930&eventNum=1079,Harkless (POR) makes marginal contact to the arm of Lowry (TOR) at the start of his drive that does not affect his SQBR.,0021800930
Q4,00:36.5,Foul: Offensive,Marc Gasol,Jusuf Nurkic,CNC,http://official.nba.com/last-two-minute-report/?gameNo=0021800930&eventNum=1080,"LAR shows Gasol (TOR) slightly extends his arms to the body of Nurkic (POR) as he steps in as the help defender during Lowry's (TOR) driving shot attempt, but the contact does not affect Nurkic's ability to defend the shot attempt.",0021800930
Q4,00:36.4,Turnover: 3 Second Violation,Marc Gasol,Trail Blazers,CNC,http://official.nba.com/last-two-minute-report/?gameNo=0021800930&eventNum=1081,Gasol (TOR) is in the lane for less than three seconds when the shot is imminent.,0021800930
Q4,00:29.1,Violation: Kicked Ball,Pascal Siakam,Trail Blazers,CC,http://official.nba.com/last-two-minute-report/?gameNo=0021800930&eventNum=1082,Siakam (TOR) intentionally kicks the ball during Lillard's (POR) dribble.,0021800930
Q4,00:27.2,Foul: Offensive,Jusuf Nurkic,Kawhi Leonard,CNC,http://official.nba.com/last-two-minute-report/?gameNo=0021800930&eventNum=1083,Nurkic (POR) establishes himself in a screening position in the path of Leonard (TOR) and absorbs the contact during the pick.,0021800930
Q4,00:17.8,Foul: Personal,Jake Layman,Kawhi Leonard,CC,http://official.nba.com/last-two-minute-report/?gameNo=0021800930&eventNum=1084,Layman (POR) commits a take foul on Leonard (TOR).,0021800930
Q4,00:17.0,Foul: Offensive,Jake Layman,Kawhi Leonard,CNC,http://official.nba.com/last-two-minute-report/?gameNo=0021800930&eventNum=1085,Layman (POR) has his arms extended when he briefly engages with Leonard (TOR) but he immediately disengages.,0021800930
Q4,00:16.7,Foul: Offensive,Maurice Harkless,Patrick McCaw,CNC,http://official.nba.com/last-two-minute-report/?gameNo=0021800930&eventNum=1086,Harkless (POR) establishes himself in a screening position in the path of McCaw (TOR) and makes marginal contact to his body during the screen.,0021800930
Q4,00:13.8,Foul: Shooting,Kyle Lowry,Damian Lillard,CC,http://official.nba.com/last-two-minute-report/?gameNo=0021800930&eventNum=1087,Lillard (POR) draws Lowry (TOR) into the air towards him and Lowry makes contact with Lillard's arm during his shooting motion that affects his jump shot attempt.,0021800930
Q4,00:06.7,Foul: Offensive,Kyle Lowry,Maurice Harkless,CNC,http://official.nba.com/last-two-minute-report/?gameNo=0021800930&eventNum=1088,Lowry (TOR) establishes himself in a screening position in the path of Harkless (POR) and absorbs the contact during the pick.,0021800930
Q4,00:03.9,Foul: Shooting,Damian Lillard,Kawhi Leonard,CNC,http://official.nba.com/last-two-minute-report/?gameNo=0021800930&eventNum=1089,Lillard (POR) makes incidental contact to the body of Leonard (TOR) after the release that does not affect his jump shot attempt.,0021800930
Q4,01:50.5,Foul: Offensive,Lou Williams,Harrison Barnes,CNC,http://official.nba.com/last-two-minute-report/?gameNo=0021800933&eventNum=1057,Williams (LAC) establishes himself in a screening position in the path of Barnes (SAC) and firms up to absorb the contact.,0021800933
Q4,01:49,Foul: Personal,Buddy Hield,Montrezl Harrell,CNC,http://official.nba.com/last-two-minute-report/?gameNo=0021800933&eventNum=1058,Hield (SAC) briefly places an arm around the back of Harrell (LAC) as he runs through the lane but the contact does not affect his SQBR.,0021800933
Q4,01:44.9,Foul: Personal,Buddy Hield,Montrezl Harrell,CC,http://official.nba.com/last-two-minute-report/?gameNo=0021800933&eventNum=1059,Hield (SAC) wraps Harrell (LAC) in the post during the entry pass.,0021800933
Q4,01:44.8,Turnover: Double Dribble,Montrezl Harrell,Kings,CNC,http://official.nba.com/last-two-minute-report/?gameNo=0021800933&eventNum=1060,Harrell (LAC) bobbles the inbound pass and legally starts his dribble when he gains possession.,0021800933
Q4,01:44,Foul: Personal,Buddy Hield,Lou Williams,CNC,http://official.nba.com/last-two-minute-report/?gameNo=0021800933&eventNum=1061,Hield (LAC) has a resting hand on the hip of Williams (LAC) but immediately removes it as he starts to move away.,0021800933
Q4,01:41.4,Foul: Offensive,Shai Gilgeous-Alexander,Harrison Barnes,CNC,http://official.nba.com/last-two-minute-report/?gameNo=0021800933&eventNum=1062,Gilgeous-Alexander (LAC) establishes himself in a screening position in the path of Barnes (SAC) and gives him room to avoid the contact.,0021800933
Q4,01:41.4,Foul: Personal,Harrison Barnes,Danilo Gallinari,CNC,http://official.nba.com/last-two-minute-report/?gameNo=0021800933&eventNum=1062,Barnes (SAC) and Gallinari (LAC) engage and separate as they go through the screen.,0021800933
Q4,01:33.3,Foul: Shooting,Harrison Barnes,Danilo Gallinari,CNC,http://official.nba.com/last-two-minute-report/?gameNo=0021800933&eventNum=1063,Barnes (SAC) maintains a legal guarding position during the jump shot attempt by Gallinari (LAC) and makes clean contact with the ball.,0021800933
Q4,01:29.0,Foul: Loose Ball,Bogdan Bogdanovic,Patrick Beverley,CNC,http://official.nba.com/last-two-minute-report/?gameNo=0021800933&eventNum=1064,Bogdanovic (SAC) briefly grasps the arm of Beverley (LAC) but the contact does not affect his ability to go for the rebound.,0021800933
Q4,01:20,Foul: Offensive,De'Aaron Fox,Shai Gilgeous-Alexander,CNC,http://official.nba.com/last-two-minute-report/?gameNo=0021800933&eventNum=1065,Fox (SAC) makes marginal contact with Gilgeous-Alexander (LAC) at the end of the drive.,0021800933
Q4,01:00.2,Foul: Offensive,Montrezl Harrell,Buddy Hield,CNC,http://official.nba.com/last-two-minute-report/?gameNo=0021800933&eventNum=1066,Harrell (LAC) establishes himself in a screening position in the path of Hield (SAC) and gives him room to avoid the contact.,0021800933
Q4,00:53.9,Foul: Personal,Shai Gilgeous-Alexander,Willie Cauley-Stein,CNC,http://official.nba.com/last-two-minute-report/?gameNo=0021800933&eventNum=1067,Gilgeous-Alexander (LAC) briefly places an arm on the hip of Cauley-Stein (SAC) but the contact does not affect his SQBR.,0021800933
Q4,00:51.1,Foul: Shooting,Shai Gilgeous-Alexander,De'Aaron Fox,CNC,http://official.nba.com/last-two-minute-report/?gameNo=0021800933&eventNum=1068,RLS shows Gilgeous-Alexander (LAC) maintains a legal guarding position during the driving shot attempt by Fox (SAC) and he makes incidental foot to foot contact with his teammate Harrell (LAC) that causes him to fall to the floor.,0021800933
Q4,00:35.5,Foul: Offensive,Montrezl Harrell,Buddy Hield,CNC,http://official.nba.com/last-two-minute-report/?gameNo=0021800933&eventNum=1069,Harrell (LAC) establishes himself in a screening position in the path of Hield (SAC) and gives him room to avoid the contact.,0021800933
Q4,00:31.4,Foul: Loose Ball,Montrezl Harrell,Buddy Hield,CNC,http://official.nba.com/last-two-minute-report/?gameNo=0021800933&eventNum=1070,Harrell (LAC) makes clean ball contact and does not impede Hield (SAC) during the rebound.,0021800933
Q4,00:17.7,Foul: Shooting,Bogdan Bogdanovic,Lou Williams,CNC,http://official.nba.com/last-two-minute-report/?gameNo=0021800933&eventNum=1071,Bogdanovic (SAC) maintains a legal guarding position during the driving shot attempt by Williams (LAC) and the contact to his side is marginal.,0021800933
Q4,00:14.8,Foul: Loose Ball,Harrison Barnes,Patrick Beverley,CNC,http://official.nba.com/last-two-minute-report/?gameNo=0021800933&eventNum=1072,Barnes (SAC) cleanly gathers the loose ball.,0021800933
Q4,00:14.8,Foul: Personal,Buddy Hield,Montrezl Harrell,CNC,http://official.nba.com/last-two-minute-report/?gameNo=0021800933&eventNum=1072,RLB shows Hield (SAC) cleanly steals the ball from Harrell (LAC).,0021800933
