Period,Time,Call Type,Committing Player,Disadvantaged Player,Review Decision,Video,Comment,game_id
Q4,00:29.1,Foul: Personal,RJ Barrett,Victor Oladipo,CNC,http://official.nba.com/last-two-minute-report/?gameNo=0022000080&eventNum=2156,Barrett (NYK) makes marginal contact with Oladipo's (IND) arm before he gathers for his shot attempt.,0022000080
Q4,00:26.4,Foul: Offensive,Julius Randle,Aaron Holiday,CNC,http://official.nba.com/last-two-minute-report/?gameNo=0022000080&eventNum=2157,Randle (NYK) sets the screen on Holiday (IND) and gives him room to avoid the contact.,0022000080
Q4,00:22,Foul: Personal,Malcolm Brogdon,Immanuel Quickley,CNC,http://official.nba.com/last-two-minute-report/?gameNo=0022000080&eventNum=2158,Brogdon (IND) maintains a legal guarding position on Quickley (NYK) before forcing the tie-up.,0022000080
Q4,00:16.5,Foul: Loose Ball,Elfrid Payton,Domantas Sabonis,CNC,http://official.nba.com/last-two-minute-report/?gameNo=0022000080&eventNum=2147,Payton (NYK) and Sabonis (IND) make incidental contact during the loose ball.,0022000080
Q4,00:15.0,Turnover: Backcourt Turnover,Domantas Sabonis,Elfrid Payton,CC,http://official.nba.com/last-two-minute-report/?gameNo=0022000080&eventNum=2148,Correctly called backcourt violation.,0022000080
Q4,00:12.6,Foul: Personal,Victor Oladipo,RJ Barrett,CNC,http://official.nba.com/last-two-minute-report/?gameNo=0022000080&eventNum=2159,Oladipo (IND) makes contact with the ball while defending Barrett (NYK).,0022000080
Q4,00:09.6,Foul: Personal,Aaron Holiday,RJ Barrett,CC,http://official.nba.com/last-two-minute-report/?gameNo=0022000080&eventNum=2149,Holiday (IND) commits a take foul on Barrett (NYK).,0022000080
Q4,00:09.6,Foul: Offensive,Domantas Sabonis,Austin Rivers,CNC,http://official.nba.com/last-two-minute-report/?gameNo=0022000080&eventNum=2150,Sabonis (IND) sets the screen on Rivers (NYK) and gives him room to avoid the contact.,0022000080
Q4,00:06.1,Foul: Personal,Aaron Holiday,RJ Barrett,CC,http://official.nba.com/last-two-minute-report/?gameNo=0022000080&eventNum=2151,Holiday (IND) commits a take foul on Barrett (NYK).,0022000080
Q4,01:53.3,Foul: Offensive,John Collins,Dante Exum,CNC,http://official.nba.com/last-two-minute-report/?gameNo=0022000083&eventNum=2214,Collins (ATL) firms up in his screening position in Exum's (CLE) path and absorbs the contact.,0022000083
Q4,01:52.4,Foul: Personal,Larry Nance Jr.,Trae Young,CNC,http://official.nba.com/last-two-minute-report/?gameNo=0022000083&eventNum=2228,"Nance Jr. (CLE) has his left hand extended forward when marginal contact occurs with Young's (ATL) right arm. The contact occurs before the start of Young's upward shooting motion, and Nance Jr. legally contests his jump shot attempt.",0022000083
Q4,01:37.6,Foul: Offensive,Andre Drummond,Bogdan Bogdanovic,CNC,http://official.nba.com/last-two-minute-report/?gameNo=0022000083&eventNum=2215,Drummond (CLE) establishes himself in a screening position in Bogdanovic's (ATL) path and does not deliver the contact.,0022000083
Q4,01:36,Foul: Loose Ball,Andre Drummond,Clint Capela,INC,http://official.nba.com/last-two-minute-report/?gameNo=0022000083&eventNum=2234,Drummond (CLE) dislodges Capela (ATL) from his position during the rebound.,0022000083
Q4,01:35.4,Foul: Shooting,Bogdan Bogdanovic,Dante Exum,CNC,http://official.nba.com/last-two-minute-report/?gameNo=0022000083&eventNum=2216,Bogdanovic (ATL) maintains a rested hand on Exum's (CLE) backside and marginal contact occurs during the driving shot attempt. ,0022000083
Q4,01:33.8,Foul: Shooting,De'Andre Hunter,Andre Drummond,CNC,http://official.nba.com/last-two-minute-report/?gameNo=0022000083&eventNum=2217,Hunter (ATL) cleanly blocks Drummond's (CLE) shot attempt near the rim.,0022000083
Q4,01:31.9,Foul: Loose Ball,Andre Drummond,John Collins,INC,http://official.nba.com/last-two-minute-report/?gameNo=0022000083&eventNum=2229,Drummond (CLE) swings down and makes contact across Collins' (ATL) left forearm that affects his ability to control the loose ball.,0022000083
Q4,01:30.9,Foul: Loose Ball,John Collins,Andre Drummond,CNC,http://official.nba.com/last-two-minute-report/?gameNo=0022000083&eventNum=2230,Collins (ATL) makes incidental contact with Drummond's (CLE) lower half as the ball is loose on the floor. ,0022000083
Q4,01:23.4,Turnover: 8 Second Violation,,Cavaliers,CC,http://official.nba.com/last-two-minute-report/?gameNo=0022000083&eventNum=2218,"Before the out of bounds, Collins (ATL) gathers the rebound with two hands, which resets the shot clock to 24. As noted, Drummond (CLE) knocks the ball loose and the ball ultimately goes out of bounds off of him, with 22 left on the shot clock. ATL has a total of eight seconds from the time Collins initially possesses the ball to advance the ball, even if the ball is knocked out of bounds by CLE. When the shot clock reaches 15, ATL has been in continuous possession of the ball in its backcourt for eight seconds (including the time before the out of bounds) and an 8-second violation is called. ",0022000083
Q4,01:10.0,Foul: Personal,Bogdan Bogdanovic,Dante Exum,CNC,http://official.nba.com/last-two-minute-report/?gameNo=0022000083&eventNum=2231,Bogdanovic (ATL) and Exum (CLE) engage and disengage with one another off-ball. ,0022000083
Q4,01:03.8,Turnover: 3 Second Violation,Andre Drummond,De'Andre Hunter,CC,http://official.nba.com/last-two-minute-report/?gameNo=0022000083&eventNum=2219,Drummond (CLE) is in the lane for longer than three seconds.,0022000083
Q4,00:56.0,Foul: Personal,Collin Sexton,De'Andre Hunter,CNC,http://official.nba.com/last-two-minute-report/?gameNo=0022000083&eventNum=2232,Sexton (CLE) and Hunter (ATL) engage and disengage with one another off-ball. ,0022000083
Q4,00:34.7,Foul: Personal,John Collins,Andre Drummond,CNC,http://official.nba.com/last-two-minute-report/?gameNo=0022000083&eventNum=2233,Collins (ATL) is jumping slightly toward Drummond (CLE) when marginal body contact occurs as Drummond is passing the ball while airborne.,0022000083
Q4,00:27.2,Foul: Offensive,John Collins,Dante Exum,CNC,http://official.nba.com/last-two-minute-report/?gameNo=0022000083&eventNum=2220,"Collins (ATL) re-establishes slightly in Exum's (CLE) path after initial contact takes place during the screen, and the contact is marginal.",0022000083
Q4,00:27.2,Foul: Personal,Dante Exum,Trae Young,CNC,http://official.nba.com/last-two-minute-report/?gameNo=0022000083&eventNum=2221,Exum (CLE) rests his hand on Young's (ATL) side and marginal contact occurs as Young drives into the lane.,0022000083
Q4,00:27.2,Foul: Away from Play,Collin Sexton,Cam Reddish,CNC,http://official.nba.com/last-two-minute-report/?gameNo=0022000083&eventNum=2221,Sexton (CLE) and Reddish (ATL) engage and disengage with one another during the inbound.,0022000083
Q4,00:27.2,Foul: Personal,Dante Exum,Trae Young,CNC,http://official.nba.com/last-two-minute-report/?gameNo=0022000083&eventNum=2221,Exum (CLE) brushes Young's (ATL) backside as he receives the pass and marginal body contact occurs.,0022000083
Q4,00:23.6,Foul: Shooting,Dante Exum,John Collins,CNC,http://official.nba.com/last-two-minute-report/?gameNo=0022000083&eventNum=2222,Exum (CLE) legally contests Collins' (ATL) dunk attempt. ,0022000083
Q4,00:21.5,Foul: Personal,Trae Young,Andre Drummond,CC,http://official.nba.com/last-two-minute-report/?gameNo=0022000083&eventNum=2223,Young (ATL) commits the take foul on Drummond (CLE).,0022000083
Q4,00:18.3,Foul: Personal,De'Andre Hunter,Darius Garland,CC,http://official.nba.com/last-two-minute-report/?gameNo=0022000083&eventNum=2224,Hunter (ATL) commits the take foul on Garland (CLE).,0022000083
Q4,00:10.0,Foul: Loose Ball,John Collins,Andre Drummond,CNC,http://official.nba.com/last-two-minute-report/?gameNo=0022000083&eventNum=2225,Collins (ATL) makes incidental contact with Drummond's (CLE) backside as they each attempt to fight for the rebound. ,0022000083
Q4,00:08.0,Foul: Personal,Cam Reddish,Collin Sexton,CC,http://official.nba.com/last-two-minute-report/?gameNo=0022000083&eventNum=2226,Reddish (ATL) commits the take foul on Sexton (CLE).,0022000083
Q4,00:02.8,Foul: Personal,Trae Young,Collin Sexton,CC,http://official.nba.com/last-two-minute-report/?gameNo=0022000083&eventNum=2227,Young (ATL) commits the take foul on Sexton (CLE).,0022000083
Q4,01:57.1,Foul: Offensive,OG Anunoby,Eric Bledsoe,CNC,http://official.nba.com/last-two-minute-report/?gameNo=0022000084&eventNum=2125,Anunoaby (TOR) is already in Bledsoe's (TOR) path and releases away from the contact.,0022000084
Q4,01:54,Foul: Offensive,Fred VanVleet,Eric Bledsoe,CNC,http://official.nba.com/last-two-minute-report/?gameNo=0022000084&eventNum=2124,VanVleet (TOR) is bracing for the contact from Bledsoe (NOP) and he releases away from the contact.,0022000084
Q4,01:48.3,Foul: Shooting,Kyle Lowry,Eric Bledsoe,INC,http://official.nba.com/last-two-minute-report/?gameNo=0022000084&eventNum=2126,"Lowry (TOR) does not maintain verticality as he turns his body and makes contact with Bledsoe's (NOP) lower body, which affects the driving shot attempt.",0022000084
Q4,01:47.6,Foul: Loose Ball,Lonzo Ball,Norman Powell,CNC,http://official.nba.com/last-two-minute-report/?gameNo=0022000084&eventNum=2127,Ball (NOP) and Powell (TOR) make incidental contact with one another during rebounding.,0022000084
Q4,01:46.8,Turnover:  Out of Bounds - Bad Pass Turn,Steven Adams,OG Anunoby,CC,http://official.nba.com/last-two-minute-report/?gameNo=0022000084&eventNum=2128,Possession is correctly awarded to Toronto.,0022000084
Q4,01:38,Foul: Offensive,Stan Van Gundy,Eric Bledsoe,CNC,http://official.nba.com/last-two-minute-report/?gameNo=0022000084&eventNum=2144,VanVleet (TOR) and Bledsoe (NOP) briefly engage and disengage off ball.,0022000084
Q4,01:33.8,Foul: Offensive,OG Anunoby,Eric Bledsoe,CNC,http://official.nba.com/last-two-minute-report/?gameNo=0022000084&eventNum=2129,Anunoby (TOR) is already in Bledsoe's (NOP) path when contact occurs and he does not deliver contact.,0022000084
Q4,01:33.8,Foul: Personal,Eric Bledsoe,Fred VanVleet,CNC,http://official.nba.com/last-two-minute-report/?gameNo=0022000084&eventNum=2129,Bledsoe (NOP) places his hand momentarily on VanVleet's (TOR) hip before correcting.,0022000084
Q4,01:31,Foul: Personal,Eric Bledsoe,Chris Boucher,CNC,http://official.nba.com/last-two-minute-report/?gameNo=0022000084&eventNum=2145,Bledsoe (NOP) makes hand-on-ball contact to briefly dislodge the ball from Boucher (TOR) on the perimeter.,0022000084
Q4,01:24.5,Foul: Shooting,Brandon Ingram,Norman Powell,CNC,http://official.nba.com/last-two-minute-report/?gameNo=0022000084&eventNum=2130,Ingram (NOP) is moving alongside Powell's (TOR) path and cleanly blocks his shot attempt.,0022000084
Q4,01:22.1,Turnover: 24 Second Violation,Raptors,Pelicans,CC,http://official.nba.com/last-two-minute-report/?gameNo=0022000084&eventNum=2131,Correctly called 24 second violation.,0022000084
Q4,01:16.5,Foul: Personal,Fred VanVleet,Brandon Ingram,CNC,http://official.nba.com/last-two-minute-report/?gameNo=0022000084&eventNum=2132,VanVleet (TOR) is moving alongside Ingram's (NOP) path and makes incidental contact with Ingram as the two fight over the screen.,0022000084
Q4,01:08.0,Foul: Shooting,Chris Boucher,Brandon Ingram,CC,http://official.nba.com/last-two-minute-report/?gameNo=0022000084&eventNum=2133,"Boucher (TOR) brings his arm down and makes contact with Ingram's (NOP) arm, which affects his driving shot attempt.",0022000084
Q4,01:05.3,Foul: Offensive,OG Anunoby,Lonzo Ball,CNC,http://official.nba.com/last-two-minute-report/?gameNo=0022000084&eventNum=2134,Anunoby (TOR) is already in Ball's (NOP) path and is firming up when contact occurs.,0022000084
Q4,01:03.8,Foul: Personal,Eric Bledsoe,OG Anunoby,CNC,http://official.nba.com/last-two-minute-report/?gameNo=0022000084&eventNum=2146,Bledsoe (NOP) and Anunoby (TOR) make incidental contact with one another off ball.,0022000084
Q4,01:01.5,Turnover:  Out of Bounds - Bad Pass Turn,OG Anunoby,Eric Bledsoe,CC,http://official.nba.com/last-two-minute-report/?gameNo=0022000084&eventNum=2135,Possession is correctly awarded to New Orleans.,0022000084
Q4,00:53.7,Foul: Offensive,Steven Adams,Fred VanVleet,INC,http://official.nba.com/last-two-minute-report/?gameNo=0022000084&eventNum=2136,Adams (NOP) extends into VanVleet's (TOR) path and delivers leg contact during the pick.,0022000084
Q4,00:34.5,Foul: Shooting,Lonzo Ball,OG Anunoby,CC,http://official.nba.com/last-two-minute-report/?gameNo=0022000084&eventNum=2137,Ball (NOP) does not establish a legal guarding position outside the RA prior to contact with Anunoby (TOR).,0022000084
Q4,00:33.7,Foul: Loose Ball,Josh Hart,Norman Powell,CNC,http://official.nba.com/last-two-minute-report/?gameNo=0022000084&eventNum=2138,Hart (NOP) and Powell (TOR) make incidental contact with one another during rebounding.,0022000084
Q4,00:12.4,Foul: Shooting,Norman Powell,Brandon Ingram,CC,http://official.nba.com/last-two-minute-report/?gameNo=0022000084&eventNum=2139,Powell (TOR) makes contact with Ingram's (NOP) arm that causes Ingram to lose control of the ball after his gather.,0022000084
Q4,00:10.5,Foul: Offensive,Chris Boucher,Eric Bledsoe,CNC,http://official.nba.com/last-two-minute-report/?gameNo=0022000084&eventNum=2141,Boucher (TOR) is already in Bledsoe's (NOP) path when contact occurs and he does not deliver contact.,0022000084
Q4,00:09.5,Foul: Personal,Steven Adams,Fred VanVleet,CNC,http://official.nba.com/last-two-minute-report/?gameNo=0022000084&eventNum=2140,Adams (NOP) is moving alongside VanVleet's (TOR) path as he defends the drive to the basket.,0022000084
Q4,00:08.4,Foul: Shooting,Josh Hart,Fred VanVleet,CNC,http://official.nba.com/last-two-minute-report/?gameNo=0022000084&eventNum=2142,Hart (NOP) legally contests VanVleet's (TOR) driving shot attempt.,0022000084
Q4,00:04.2,Foul: Personal,Norman Powell,Eric Bledsoe,CNC,http://official.nba.com/last-two-minute-report/?gameNo=0022000084&eventNum=2147,Powell (TOR) makes marginal contact with Bledsoe (NOP) as he releases the pass.,0022000084
Q4,00:02.6,Foul: Personal,OG Anunoby,Brandon Ingram,CC,http://official.nba.com/last-two-minute-report/?gameNo=0022000084&eventNum=2143,Anunoby (TOR) commits a take foul on Ingram (NOP).,0022000084
Q4,01:56.5,Foul: Shooting,Mason Plumlee,Daniel Theis,CC,http://official.nba.com/last-two-minute-report/?gameNo=0022000085&eventNum=2149,Plumlee (DET) is drawn into the air by the pump fake from Theis (BOS) and on his way down he makes contact to Theis' (BOS) body during his shooting motion.,0022000085
Q4,01:54,Foul: Personal,Svi Mykhailiuk,Jaylen Brown,CNC,http://official.nba.com/last-two-minute-report/?gameNo=0022000085&eventNum=2160,"Mykhailiuk (DET) makes marginal contact to Brown's (BOS) body at the start of the drive, before he cleanly dislodges the ball out of bounds. ",0022000085
Q4,01:46.1,Foul: Personal,Marcus Smart,Derrick Rose,CNC,http://official.nba.com/last-two-minute-report/?gameNo=0022000085&eventNum=2150,Smart (BOS) briefly places his forearm to the front of Rose (DET) during the drive up the court. The contact is marginal. ,0022000085
Q4,01:38.8,Turnover: Traveling,Jerami Grant,Celtics,INC,http://official.nba.com/last-two-minute-report/?gameNo=0022000085&eventNum=2151,Grant (DET) ends his dribble and hops consecutively on the same foot after his gather.,0022000085
Q4,01:27.8,Foul: Offensive,Tristan Thompson,Svi Mykhailiuk,CC,http://official.nba.com/last-two-minute-report/?gameNo=0022000085&eventNum=2152,"Thompson (BOS) does not establish himself in the path of Mykhailiuk (DET) while setting the screen, and delivers contact to his back while he is trying to defend around the screen. ",0022000085
Q4,01:16.9,Foul: Shooting,Tristan Thompson,Blake Griffin,CC,http://official.nba.com/last-two-minute-report/?gameNo=0022000085&eventNum=2153,Thompson (BOS) makes contact to Griffin's (DET) arm during his shooting motion that disrupts his layup attempt.,0022000085
Q4,01:06.7,Foul: Offensive,Jayson Tatum,Jerami Grant,CNC,http://official.nba.com/last-two-minute-report/?gameNo=0022000085&eventNum=2154,Tatum (BOS) releases and does not extend his off arm elbow to wrist into Grant's body at the end of his drive to the basket. ,0022000085
Q4,00:42.2,Foul: Shooting,Daniel Theis,Mason Plumlee,CC,http://official.nba.com/last-two-minute-report/?gameNo=0022000085&eventNum=2155,"Theis (BOS) makes contact to Plumlee's (DET) arm as he gathers and enters his shooting motion, during the driving shot attempt. ",0022000085
Q4,00:29.5,Foul: Shooting,Jayson Tatum,Derrick Rose,CNC,http://official.nba.com/last-two-minute-report/?gameNo=0022000085&eventNum=2156,Tatum (BOS) makes marginal contact to Rose's (DET) body as he gathers and enters  shooting motion. Rose is able to move through the contact and it does not disrupt his ability to attempt the layup. ,0022000085
Q4,00:25.4,Foul: Personal,Semi Ojeleye,Blake Griffin,CNC,http://official.nba.com/last-two-minute-report/?gameNo=0022000085&eventNum=2157,Oljeleye (BOS) goes to but not through the screen set by Griffin (DET). Griffin's reaction is not consistent with the level of contact.  ,0022000085
Q4,00:22.0,Foul: Personal,Semi Ojeleye,Jerami Grant,CC,http://official.nba.com/last-two-minute-report/?gameNo=0022000085&eventNum=2158,Ojeleye (BOS) makes contact to Grant's (DET) body on the drive that disrupts his SQBR. ,0022000085
Q4,00:01.5,Foul: Shooting,Jayson Tatum,Blake Griffin,CNC,http://official.nba.com/last-two-minute-report/?gameNo=0022000085&eventNum=2159,Tatum (BOS) maintains a legal guarding position during the jump shot attempt by Griffin (DET) and cleanly dislodges the ball. ,0022000085
Q4,01:56.4,Foul: Personal,Thomas Bryant,Kevin Durant,CC,http://official.nba.com/last-two-minute-report/?gameNo=0022000086&eventNum=2234,Bryant (WAS) grabs Durant's (BKN) arm during his drive to the basket. ,0022000086
Q4,01:39.5,Foul: Personal,Joe Harris,Rui Hachimura,CC,http://official.nba.com/last-two-minute-report/?gameNo=0022000086&eventNum=2235,"Harris (BKN) clamps Hachimura's (WAS) arm while he is receiving the pass in the post, disrupting his ability to catch the ball cleanly. ",0022000086
Q4,01:31.0,Foul: Offensive,Jeff Green,Rui Hachimura,CNC,http://official.nba.com/last-two-minute-report/?gameNo=0022000086&eventNum=2236,Green (BKN) firms up in a screening position in the path of Hachimura (WAS) and absorbs the contact.,0022000086
Q4,01:29.7,Foul: Personal,Rui Hachimura,Kevin Durant,CNC,http://official.nba.com/last-two-minute-report/?gameNo=0022000086&eventNum=2244,Hachimura (WAS) briefly engages and then disengages in marginal arm contact with Durant (BKN) as he is receiving the pass.,0022000086
Q4,01:26.5,Foul: Offensive,Jeff Green,Rui Hachimura,CNC,http://official.nba.com/last-two-minute-report/?gameNo=0022000086&eventNum=2237,Green (BKN) firms up in a screening position in the path of Hachimura (WAS) and absorbs the contact.,0022000086
Q4,01:21.0,Foul: Shooting,Bradley Beal,Kevin Durant,CC,http://official.nba.com/last-two-minute-report/?gameNo=0022000086&eventNum=2238,Beal (WAS) does not get up to ball height and makes contact to Durant's (BKN) arm as he is in his shooting motion and releases the ball on his jump shot.,0022000086
Q4,01:12.5,Foul: Offensive,Thomas Bryant,Kyrie Irving,CNC,http://official.nba.com/last-two-minute-report/?gameNo=0022000086&eventNum=2239,Bryant (WAS) establishes himself in a screening position in the path of Irving (BKN) firms up and absorbs the contact. ,0022000086
Q4,01:11.0,Foul: Shooting,Jeff Green,Bradley Beal,CNC,http://official.nba.com/last-two-minute-report/?gameNo=0022000086&eventNum=2240,Green (BKN) makes marginal contact to Beal's (WAS) arm during his shooting motion that does not disrupt his layup attempt.,0022000086
Q4,01:06,Foul: Personal,Bradley Beal,Timothe Luwawu-Cabarrot,CNC,http://official.nba.com/last-two-minute-report/?gameNo=0022000086&eventNum=2243,"Beal (WAS) makes marginal contact to Luwawu-Cabarrot's (BKN) body, but does not disrupt his ability to make the pass. ",0022000086
Q4,01:00.7,Foul: Offensive,Kyrie Irving,Rui Hachimura,CNC,http://official.nba.com/last-two-minute-report/?gameNo=0022000086&eventNum=2241,Irving (BKN) firms up in a screening position in the path of Hachimura (WAS) and absorbs the contact.,0022000086
Q4,00:15.2,Foul: Shooting,Timothe Luwawu-Cabarrot,Thomas Bryant,CNC,http://official.nba.com/last-two-minute-report/?gameNo=0022000086&eventNum=2242,Luwawu-Cabarrot (BKN) makes marginal contact to Bryant's (WAS) arm during his shooting motion that does not disrupt the dunk attempt. ,0022000086
Q4,01:37.5,Foul: Shooting,Paul George,Deandre Ayton,CC,http://official.nba.com/last-two-minute-report/?gameNo=0022000091&eventNum=2195,George (LAC) makes contact to Ayton's (PHX) arm during his shot attempt near the rim.,0022000091
Q4,01:22.8,Foul: Shooting,Jae Crowder,Kawhi Leonard,CNC,http://official.nba.com/last-two-minute-report/?gameNo=0022000091&eventNum=2196,Crowder (PHX) maintains a legal guarding position during Leonard's (LAC) jump shot attempt.,0022000091
Q4,01:10.8,Foul: Shooting,Serge Ibaka,Chris Paul,CNC,http://official.nba.com/last-two-minute-report/?gameNo=0022000091&eventNum=2197,"Ibaka (LAC) makes incidental ""high-five"" contact with Paul (PHX) after the release of his jump shot attempt.",0022000091
Q4,00:36.9,Foul: Offensive,Deandre Ayton,Paul George,CNC,http://official.nba.com/last-two-minute-report/?gameNo=0022000091&eventNum=2198,Ayton (PHX) establishes himself in a legal screening position in George's (LAC) path.,0022000091
Q4,00:14,Foul: Offensive,Paul George,Devin Booker,CNC,http://official.nba.com/last-two-minute-report/?gameNo=0022000091&eventNum=2201,"Following the pass, George's (LAC) momentum carries him to but not through Booker (PHX) when the marginal contact occurs. Paul does not dislodge Booker.",0022000091
Q4,00:06.5,Foul: Personal,Jae Crowder,Patrick Beverley,CC,http://official.nba.com/last-two-minute-report/?gameNo=0022000091&eventNum=2199,Crowder (PHX) commits a take foul on Beverley (LAC).,0022000091
Q4,00:01.3,Foul: Shooting,Paul George,Mikal Bridges,CC,http://official.nba.com/last-two-minute-report/?gameNo=0022000091&eventNum=2200,George (LAC) makes contact to Bridges' (PHX) arm and the contact affects his jump shot attempt.,0022000091
Q4,01:54.8,Foul: Shooting,Julius Randle,Trae Young,CNC,http://official.nba.com/last-two-minute-report/?gameNo=0022000095&eventNum=2156,Randle (NYK) is moving alongside Young's (ATL) path and maintains a legal guarding position as he defends the driving shot attempt.,0022000095
Q4,01:50.9,Foul: Shooting,Mitchell Robinson,John Collins,INC,http://official.nba.com/last-two-minute-report/?gameNo=0022000095&eventNum=2157,Robinson (NYK) does not maintain verticality and makes contact with Collins' (ATL) arm that affects his shot near the rim.,0022000095
Q4,01:47.5,Foul: Personal,John Collins,Julius Randle,CC,http://official.nba.com/last-two-minute-report/?gameNo=0022000095&eventNum=2158,Collins (ATL) makes contact with Randle's (NYK) arm after Randle has secured the ball.,0022000095
Q4,01:41.9,Foul: Shooting,Austin Rivers,De'Andre Hunter,CNC,http://official.nba.com/last-two-minute-report/?gameNo=0022000095&eventNum=2159,Rivers (NYK) legally contests Hunter's (ATL) jump shot attempt.,0022000095
Q4,01:29.6,Foul: Offensive,Mitchell Robinson,Kevin Huerter,CNC,http://official.nba.com/last-two-minute-report/?gameNo=0022000095&eventNum=2160,Robinson (NYK) is already in Huerter's (ATL) path when contact occurs and he does not deliver contact.,0022000095
Q4,01:22.9,Foul: Offensive,Trae Young,Austin Rivers,CC,http://official.nba.com/last-two-minute-report/?gameNo=0022000095&eventNum=2161,Young (ATL) extends his arm into Rivers' (NYK) body and dislodges Rivers from his legally obtained defensive position.,0022000095
Q4,01:09,Foul: Personal,De'Andre Hunter,Mitchell Robinson,CNC,http://official.nba.com/last-two-minute-report/?gameNo=0022000095&eventNum=2174,Hunter (ATL) momentarily rests his hand on the hip of Robinson (NYK) off ball.,0022000095
Q4,01:07,Foul: Personal,John Collins,Julius Randle,CNC,http://official.nba.com/last-two-minute-report/?gameNo=0022000095&eventNum=2162,Collins (ATL) is moving alongside Randle's (NYK) path to the basket and maintains a legal guarding position.,0022000095
Q4,01:03,Foul: Loose Ball,Julius Randle,John Collins,CNC,http://official.nba.com/last-two-minute-report/?gameNo=0022000095&eventNum=2177,Randle (NYK) makes marginal contact to Collins (ATL) arm as they reach for the rebound. ,0022000095
Q4,01:00.8,Foul: Loose Ball,Mitchell Robinson,De'Andre Hunter,CNC,http://official.nba.com/last-two-minute-report/?gameNo=0022000095&eventNum=2163,Robinson (NYK) and Hunter (ATL)  make incidental contact with one another during rebounding.,0022000095
Q4,00:50.8,Foul: Personal,Trae Young,Austin Rivers,CNC,http://official.nba.com/last-two-minute-report/?gameNo=0022000095&eventNum=2164,Young (ATL) makes marginal contact to Rivers' (NYK) side during his drive to the basket. ,0022000095
Q4,00:48.7,Foul: Offensive,Austin Rivers,Trae Young,CNC,http://official.nba.com/last-two-minute-report/?gameNo=0022000095&eventNum=2165,"As Rivers (NYK) is starting his natural upward shooting motion, he makes some contact with the head/neck area of Young (ATL).   Contact to an opponent?s head/face can be deemed marginal when the result of a natural basketball move, provided the contact is not disproportionate or uncontrolled.",0022000095
Q4,00:48.7,Foul: Shooting,Trae Young,Austin Rivers,CNC,http://official.nba.com/last-two-minute-report/?gameNo=0022000095&eventNum=2165,Young (ATL) is moving alongside Rivers' (NYK) path to the basket and maintains a legal guarding position as he defends the shot.,0022000095
Q4,00:42.4,Foul: Personal,Austin Rivers,Trae Young,CC,http://official.nba.com/last-two-minute-report/?gameNo=0022000095&eventNum=2166,Rivers (NYK) turns into Young's (ATL) body and delivers contact that affects his SQBR.,0022000095
